ecotruck.com.br,"A EcoTruck® fornece uma série de Tecnológicas para gestão ao mercado de Transporte, assegurando o mais moderno e eficiente sistema de soluções integradas para redução de custos com pneus, combustíveis e manutenção. As Ferramentas, Programas e Produto...",2024-05-09 17:35:00,10513,Published,,NA
cultivarnet.com.br,"Com uma equipe administrativa e comercial experiente, dedicada, proativa e competente a Cultivar se destaca também por seu amplo portfólio, com diversos fornecedores nos segmentos de agricultura e pecuária, indo desde os fertilizantes e corretivos, a...",2024-05-09 17:33:00,10925,Published,,| http://lockbit7z2jwcskxpbokpemdxmltipntwlkmidcll2qirbu7ykg46eyd.onion/secret/455605c524b1a91b3b4cea6df41c803d-1099e8b0-25d0-3c48-ab5b-9d64befa6165/cultivarnet.com.br/LIst.txt
ckfinc.com,"January 31, 2023 - CKF, Inc. Strengthens Position in Sustainable Packaging Market Sector with $10 million Capital InvestmentJanuary 31, 2023 - CKF, Inc. Strengthens Position in Sustainable Packaging Market Sector with $10 million Capital Investment N...",2024-05-09 17:32:00,10508,Published,0.02,| http://lockbit7z2jwcskxpbokpemdxmltipntwlkmidcll2qirbu7ykg46eyd.onion/secret/dcc639b824bcc951469837c12b91da5a-cc7aa3fe-b048-383b-941f-c5c8c8e0fc12/ckfinc.com/ckfull.7z-file-tree.txt| http://lockbit7z2jwcskxpbokpemdxmltipntwlkmidcll2qirbu7ykg46eyd.onion/secret/dcc639b824bcc951469837c12b91da5a-cc7aa3fe-b048-383b-941f-c5c8c8e0fc12/ckfinc.com/ckfull.txt
besttaxfiler.com,Yupp TV coupon Free $20.00 (www.Yupptv.com) Free. ITIN Application (worth of $29.99 service) (for Certification filing only) Free. FBAR (worth of $29.99 service) Free. Extension Filing (worth of $19.99 service) Free. 7 years assistance to resolve you...,2024-05-09 17:30:00,10567,Published,0.0,| http://lockbit7z2jwcskxpbokpemdxmltipntwlkmidcll2qirbu7ykg46eyd.onion/secret/4f30fb86c96bebf36bdb0fe5a50f18d6-f86148bb-ae1d-3c26-94fe-a5f13d0bc666/besttaxfiler.com/besttaxfiler.com-private.tar.gz-file-tree.txt| http://lockbit7z2jwcskxpbokpemdxmltipntwlkmidcll2qirbu7ykg46eyd.onion/secret/4f30fb86c96bebf36bdb0fe5a50f18d6-f86148bb-ae1d-3c26-94fe-a5f13d0bc666/besttaxfiler.com/besttaxfiler.com.zip-file-tree.txt
amsoft.cl,"Soluciones tecnológicas que impulsan tu negocio.Somos tu partner para transformar tu negocio de la mano de la tecnología; desarrollamos tu próxima aplicación, seremos tu equipo de profesionales, te asesoramos para dar el salto digital. Leer más Sobre...",2024-05-09 17:29:00,10509,Published,,NA
faacgroup.com,"Fabbrica Automatismi Apertura Cancelli (FAAC) was founded in 1965 and immediately became synonymous with automation for gates all around the world. Quality, safety, reliability, satisfaction, passion and research are the values on which the company l...",2024-05-09 17:27:00,10264,Published,,NA
worldlearning.org,"EDUCATION. A global development and exchange organization delivering education programs in more than 150 countries. Built on 90 years of expertise, our bottom-up and top-down approach serves individuals and communities at all levels.We have the uniqu...",2024-05-09 17:26:00,10151,Published,,NA
wisconsinindustrialcoatings.com,"Turn to the experienced professionals at Wisconsin Industrial Coatings for superior quality industrial coating and sandblasting services. Our facility includes 105,000 square feet of shop space and 12 overhead cranes with a maximum capacity of 50,000...",2024-05-09 17:24:00,10210,Published,,NA
mckimcreed.com,"McKim & Creed! You have 14 days left to avoid the devastating consequences of having your data published. We are ready to update your data that contains the following: - Personal data of your employees, customers and partners - Positive drug tes...",2024-05-09 16:54:00,9784,Published,357.43,| http://lockbit33chewwx25efq6dgkhkw4u7nefudq4ijkuamjfd7x73on6dyd.onion/secret/a5b0c99a67125d1edaa2b2fd7999d330-2b83882b-01be-379f-9bd3-0202109702d7/mckimcreed.com/mckimcreed.com.7z-file-tree.txt
nampak.com,"We will use the contacts we gain for our future phishing campaigns. Nampak has been attacked at 20.03.24 so partners and affiliates can check how they care about you. Nampak is Africa’s leading diversified packaging manufacturer, and has been listed...",2024-05-09 16:53:00,9899,Published,19.2,| http://lockbit33chewwx25efq6dgkhkw4u7nefudq4ijkuamjfd7x73on6dyd.onion/secret/2409177811dc998b6e2862a2ed6aedf6-9505d3ae-4c5a-35d9-b674-4eac3594cee5/nampak.com/nampak.tgz-file-tree.txt
taylorlaw.net,"Taylor Law Offices, P.C. was established in 1980 as a general practice law firm and is located in Effingham, Illinois. We have seven attorneys with more than ninety years experience providing legal services to individuals and business clients through...",2024-05-09 16:25:00,10038,Published,61.3,| http://lockbit33chewwx25efq6dgkhkw4u7nefudq4ijkuamjfd7x73on6dyd.onion/secret/4963f90bafe1b84fa7d221b06443b409-973065b3-8a67-3197-a5e5-be7c827b8303/taylorlaw.net/taylorlaw.net.7z-file-tree.txt
kjf-augsburg.de,"Die KJF Augsburg ist eines der größten Sozialunternehmen in Bayern. Wir sind Träger von über 80 Einrichtungen und Diensten in Schwaben und dem angrenzenden Oberbayern. Ob Kita, Berufsbildungswerk, Schule oder Klinik – die KJF Augsburg ist in fast all...",2024-05-09 16:20:00,10050,Published,182.31,| http://lockbit33chewwx25efq6dgkhkw4u7nefudq4ijkuamjfd7x73on6dyd.onion/secret/4a9e2a59a2e777daa7ee6d79e45ea779-2ec203f9-1a22-3f05-8fa3-007586469d58/kjf-augsburg.de/kjf-augsburg.de.tgz-file-tree.txt
disb.dc.gov,05/19/2021 DC health insurance marketplace: history and news of the state's exchange: 04/22/2021 DISB Celebrates April as Financial Literacy Month with Free Resources for District Residents: 04/19/2021 Insurance in a Time of Transition: Highlights Fr...,2024-05-09 16:18:00,10215,Published,7.9,| http://lockbit33chewwx25efq6dgkhkw4u7nefudq4ijkuamjfd7x73on6dyd.onion/secret/12754c01f1fd82c776573ab398a1d8d5-7c402d5c-06e4-3206-bce0-5858e2866280/disb.dc.gov/disb.dc.gov.7z-file-tree.txt
tascoplumbing.com,"TASCO Plumbing & Mechanical Corp is a company that operates in the Construction industry. It employs 51-100 people and has $10M-$25M of revenue. The company is headquartered in Hialeah, Florida.",2024-05-09 16:13:00,9617,Published,25.9,| http://lockbit33chewwx25efq6dgkhkw4u7nefudq4ijkuamjfd7x73on6dyd.onion/secret/dcc1bcd7ddd7b1a2bd1f7d02b3657368-0ea14bdd-62db-3fe6-a050-4fb22f876ee2/tascoplumbing.com/tascoplumbing.com.7z-file-tree.txt
tu-ilmenau.de,"Eine moderne, zukunftsfähige Universität benötigt einen internationalen Campus mit einem weltoffenen Umfeld, in dem Menschen in ihrer Vielfalt akzeptiert werden und Grundrechte sowie Wissenschaftsfreiheit nicht in Frage gestellt werden.",2024-05-09 14:53:00,15731,Published,256.42,| http://lockbit33chewwx25efq6dgkhkw4u7nefudq4ijkuamjfd7x73on6dyd.onion/secret/9a418569636678823d4e42124cdb82a0-523ca150-73e3-3072-92e4-8c52b2f25329/tu-ilmenau.de/tu-ilmenau.de.7z-file-tree.txt
uslinen.com,"We are a family-owned, professionally managed provider of uniforms, mats, and towels that values a positive customer experience. Honesty, integrity, and respect are the driving forces behind our services. We believe in accountability, reliability, an...",2024-05-09 14:51:00,14514,Published,1.1,| http://lockbit33chewwx25efq6dgkhkw4u7nefudq4ijkuamjfd7x73on6dyd.onion/secret/700a49aaf070d6a9087519f8379af21a-ac15daa8-7683-30c0-a736-0a8fb95652b9/uslinen.com/uslinen.com.7z-file-tree.txt
sesenergy.org,"As one of New England's original energy management companies, Secure Energy has been a trusted vendor partner, aggregator, and authorized broker for leading national suppliers since the infancy of the energy management industry. Let our team with 175...",2024-05-09 14:49:00,13421,Published,,NA
lenmed.co.za,Maputo Private Hospital is Mozambique’s first multidisciplinary hospital. It is equipped with cutting edge facilities and is located in the heart of Maputo. The hospital offers services in both English & Portuguese.,2024-05-09 14:49:00,15874,Published,145.51,| http://lockbit33chewwx25efq6dgkhkw4u7nefudq4ijkuamjfd7x73on6dyd.onion/secret/cf1ed4fb45a2f15fc356597c4163393d-11a2898c-3431-3378-84d8-01ecedb063e8/lenmed.co.za/lenmed.co.za.7z-file-tree.txt
dagma.com.ar,"NUESTROS VALORES ""Con visión y perseverancia de crecimiento"" Nos basamos en la conﬁanza, el respeto y la lealtad para con nuestros empleados y clientes, porque entendemos que son la base para construir juntos.",2024-05-09 14:48:00,8353,Published,69.61,| http://lockbit33chewwx25efq6dgkhkw4u7nefudq4ijkuamjfd7x73on6dyd.onion/secret/6bce64bf8d0629331ca21244f725bd4c-48132cd2-c115-3310-87d8-d838828a748c/dagma.com.ar/dagma.com.ar.7z-file-tree.txt
kimmelcleaners.com,100gb,2024-05-09 14:45:00,14115,Published,69.51,| http://lockbit33chewwx25efq6dgkhkw4u7nefudq4ijkuamjfd7x73on6dyd.onion/secret/4dd7c6f1276440792dd371f8359b5af1-208850f1-18f3-3280-b898-5f0edaed7ad0/kimmelcleaners.com/kimmelcleaners.com.7z-file-tree.txt
ccofva.com,"Based in Richmond, Virginia, we function like a family, with each related company working together. Our experienced management team provides you with in-depth knowledge and can develop customized solutions for your particular needs.",2024-05-09 14:41:00,8139,Published,843.16,| http://lockbit33chewwx25efq6dgkhkw4u7nefudq4ijkuamjfd7x73on6dyd.onion/secret/13e4d794b37008b7e1573935e3cb0993-8118444e-5c75-36af-b6e4-398b50072013/ccofva.com/ccofva.com.rar-file-tree.txt
ctc-corp.net,"For over 115 years, we have built and maintained partnerships with our customers by providing solutions that are essential to their business. With our versatile offering of rental service, laundry and dry cleaning service and janitorial products, we...",2024-05-09 14:40:00,14118,Published,48.5,| http://lockbit33chewwx25efq6dgkhkw4u7nefudq4ijkuamjfd7x73on6dyd.onion/secret/cf890cc6b91b913f6dff8755944b9fa7-96adf4f5-81ad-3db0-b24a-d47f65f1236f/ctc-corp.net/ctc-corp.net.7z-file-tree.txt
casajove.com,"Vídeo corporatiu de Casa Jové. Amb 140 anys d'història, reafirmem el nostre compromís per fer del món un lloc millor, just, sostenible, socialment responsable, on prevalgui l'ètica i el compromís impregni les nostres accions. Servei tècnic reparació...",2024-05-09 14:37:00,7695,Published,128.01,| http://lockbit33chewwx25efq6dgkhkw4u7nefudq4ijkuamjfd7x73on6dyd.onion/secret/7f457ed773e14410bdcb79b12fb89baa-51a75e60-7905-3b81-80af-2a2610ea4e80/casajove.com/casajove.tgz-file-tree.txt
torrepacheco.es,"Torre-Pacheco es un municipio español de la Región de Murcia, enclavado en la llanura del Campo de Cartagena, a 8 km de las playas del Mar Menor. Con 39 037 habitantes, es el sexto municipio de la Región en número de habitantes.",2024-05-09 14:35:00,8163,Published,143.01,| http://lockbit33chewwx25efq6dgkhkw4u7nefudq4ijkuamjfd7x73on6dyd.onion/secret/4ecd5370e3591cf685a0200779995508-07ee5e57-bf14-33f4-9887-5fc31ff5b118/torrepacheco.es/torrepacheco1.tgz-file-tree.txt| http://lockbit33chewwx25efq6dgkhkw4u7nefudq4ijkuamjfd7x73on6dyd.onion/secret/4ecd5370e3591cf685a0200779995508-07ee5e57-bf14-33f4-9887-5fc31ff5b118/torrepacheco.es/torrepacheco2.tgz-file-tree.txt
habeco.com.vn,"HABECO cam kết uống có trách nhiệm. Đó là lý do tại sao chúng tôi cần đảm bảo rằng bạn ở trên độ tuổi uống rượu hợp pháp và được phép xem trang web này một cách hợp pháp. Bằng cách nhấp vào xác nhận ""Tôi đã đủ 18 tuổi"" là bạn đồng ý với các điều khoả...",2024-05-09 14:22:00,8139,Published,19.0,| http://lockbit33chewwx25efq6dgkhkw4u7nefudq4ijkuamjfd7x73on6dyd.onion/secret/e2a1c716b2302b983339fdf1f3491769-6b3142e8-99f6-36a2-83e3-707df105a10d/habeco.com.vn/habeco.com.vn.7z-file-tree.txt
easternshipbuilding.com,"Commercial Shipbuilding. For more than 45 years, Eastern has delivered over 350 vessels for commercial clients. Our quality of construction and commitment to customers are key to our success. Let us build your next state-of-the-art craft. Learn More.",2024-05-09 14:17:00,8027,Published,18.7,| http://lockbit33chewwx25efq6dgkhkw4u7nefudq4ijkuamjfd7x73on6dyd.onion/secret/583257eb6dd8163cbd89ae4d13dff87a-3347ca5b-4cc3-3c71-830a-0188ab2f470d/easternshipbuilding.com/easternshipbuilding.com.7z-file-tree.txt
redwoodcoastrc.org,"This website uses cookies to improve your experience while you navigate through the website. Out of these, the cookies that are categorized as necessary are stored on your browser as they are essential for the working of basic functionalities of the...",2024-05-09 14:14:00,7906,Published,95.81,| http://lockbit33chewwx25efq6dgkhkw4u7nefudq4ijkuamjfd7x73on6dyd.onion/secret/dc6e36e9b2667f5b90c5b00a15401873-cb620abe-2961-3c3a-829a-21c5c885ffec/redwoodcoastrc.org/redwoodcoastrc.org.7z-file-tree.txt
gpaa.gov.za,"The Government Pensions Administration Agency (GPAA) administers pensions on behalf of its primary clients, the Government Employees Pension Fund (GEPF) and National Treasury You can contact the main system administrator on the contacts below, wai...",2024-05-09 14:05:00,8085,Published,668.25,| http://lockbit33chewwx25efq6dgkhkw4u7nefudq4ijkuamjfd7x73on6dyd.onion/secret/9aa07c71f268701c5d09af846abdcb6c-510c7437-f514-3476-8b45-39df5b65e338/gpaa.gov.za/gpaa.gov.za.7z-file-tree.txt
universalservicesms.com,"About Us. Universal Services LLC offers the unique capability of in-house design, fabrication, and installation; saving cost, schedule, and coordination. Since 2004, Universal has provided quality electrical, mechanical, structural, and CNC Machining...",2024-05-09 14:01:00,7845,Published,388.53,| http://lockbit33chewwx25efq6dgkhkw4u7nefudq4ijkuamjfd7x73on6dyd.onion/secret/86643265237906658429d53acabe1317-7091ce97-17e4-385d-86d5-8a51e3aed947/universalservicesms.com/universalservicesms.com.7z-file-tree.txt
rmhfranchise.com,"RMH Vision. RMH Franchise strives to be a multi-brand restaurant company with a dynamic culture, focused on operational excellence and engaged team members who create value for our guests and deliver a superior return to our investors.",2024-05-09 13:59:00,8094,Published,685.35,| http://lockbit7z2jwcskxpbokpemdxmltipntwlkmidcll2qirbu7ykg46eyd.onion/secret/98bbe0b30b09f876f3edbbd9ae7c9145-06c3da40-30ae-3f9a-a3e2-d64f7ee61264/rmhfranchise.com/rmhfranchise.com.7z-file-tree.txt
ksa-architecture.com,"KSA is a different breed of architecture firm. We are a team of skilled technicians and consultants with decades of expertise in sustainable design. top of page. Solving problems. Building trust. ""You gave us a building that has exceeded our grandest...",2024-05-09 13:55:00,7664,Published,778.26,| http://lockbit7z2jwcskxpbokpemdxmltipntwlkmidcll2qirbu7ykg46eyd.onion/secret/5762c7e24580c143f1a8c3008f703f55-6c82a49d-9985-35e7-bbb6-2686772731c7/ksa-architecture.com/ksa-architecture.com.7z-file-tree.txt
themisbourne.co.uk,"The Misbourne School is a coeducational secondary school and sixth form located in Great Missenden, Buckinghamshire, England. The school has approximately 1020 students, and the sixth form has around 170 students, offering A-Levels as well as BTEC qu...",2024-05-09 13:52:00,7923,Published,3.3,| http://lockbit7z2jwcskxpbokpemdxmltipntwlkmidcll2qirbu7ykg46eyd.onion/secret/70fb8d5bfe7f9cee35d2c6d33ad13baf-502b572f-8ecc-3a5f-9f5b-2b6ab31bac87/themisbourne.co.uk/themisbourne.co.uk.zip-file-tree.txt
calvia.com,"L'Ajuntament de Calvià és l'administració local del municipi de Calvià, a Mallorca. Consulta els serveis, les notícies i el registre electrònic.",2024-05-09 13:44:00,7990,Published,,NA
nybravestfcu.org,"Manage your finances better with a Checking Account from NY Bravest FCU. With our Internet Teller, managing your money has never been easier. Quickly check your balance, review transactions, and balance your checkbook all in one place!",2024-05-09 13:31:00,7775,Published,3.1,| http://lockbit7z2jwcskxpbokpemdxmltipntwlkmidcll2qirbu7ykg46eyd.onion/secret/5b164bdf512362246d8de7c839226689-a7a57d7b-d0d1-360c-a107-2dfb9287af41/nybravestfcu.org/nybravestfcu_org.zip-file-tree.txt
ufresources.com,"UF Resources Corporation is a privately held holding company based in University Park, Florida, offering administration, information technology and other support services. We make extensive use of technology to leverage our resources to provide effic...",2024-05-09 13:26:00,8184,Published,,NA
rjcorp.in,"RJ Corp has emerged as a powerhouse multinational company with flourishing businesses in a range of sectors which include beverages, quick service restaurants (QSR), ice-cream, dairy products, retail, healthcare, and education. The Group is reputed f...",2024-05-09 13:18:00,7873,Published,254.82,| http://lockbit33chewwx25efq6dgkhkw4u7nefudq4ijkuamjfd7x73on6dyd.onion/secret/95d210309fc60e11290a3110870ce75f-a9ac76a9-fcfd-3cd4-aa6b-e3b0d8da30cd/rjcorp.in/rjcorp.in.7z-file-tree.txt
acla-werke.com,ACLA-WERKE offer a comprehensive range of high-grade squeeges for all cases of the daily screen printing practice which set a standard in the screen printing world thanks to a long experience in the application. The screen printer has a choice betwee...,2024-05-09 13:03:00,7822,Published,39.8,| http://lockbit33chewwx25efq6dgkhkw4u7nefudq4ijkuamjfd7x73on6dyd.onion/secret/0a5a2a4ea4a6eebf35193567b52666c9-b99e591c-4a52-368f-b733-32ae070138d7/acla-werke.com/acla.zip-file-tree.txt
crinetics.com,"Crinetics is here for endocrine disease patients who are eager to find therapies that provide effective disease control and more simplicity in their lives. We have failed to reach an agreement with the Crinetics organization, given their unscrupul...",2024-05-09 13:01:00,8157,Published,32.1,| http://lockbit33chewwx25efq6dgkhkw4u7nefudq4ijkuamjfd7x73on6dyd.onion/secret/9891a574140d635917cc5594a0e36357-f4181e09-6edc-38e5-b3d2-afe911add680/crinetics.com/crinetics.com.7z-file-tree.txt
tegaindustries.com,"Tega is a global leader in designing and manufacturing of ‘critical-to-operate’ consumables for the mining, mineral processing and material handling industries.",2024-05-09 11:45:00,10260,Published,,NA
vm3fincas.es,"Since 1980 we have offered comprehensive advice on the management, administration and sale of real estate. Our multidisciplinary team allows us to provide a highly qualified service covering all property needs. VM3 Fincas works for your peace of mind...",2024-05-09 11:38:00,10879,Published,,NA
garage-cretot.fr,Automotive Service & Collision Repair Consumer Services,2024-05-09 11:34:00,9793,Published,,NA
cttxpress.com,"As a thought leader in the logistics industry, CTT Express structurally invests in trend research and solution development.",2024-05-09 11:32:00,9932,Published,,NA
iitm.ac.in,,2024-05-09 11:29:00,10178,Published,,NA
doublehorse.in,"Our brand double horse sells a variety of fast-moving consumer goods (FMCG) such as premium rice, instant mixes, health items, and culinary pastes ready-to-cook and ready-to-eat items that promise quality and healthy eating habits. Our dedication lie...",2024-05-09 11:29:00,9917,Published,,NA
vm3fincas.es,"Since 1980 we have offered comprehensive advice on the management, administration and sale of real estate. Our multidisciplinary team allows us to provide a highly qualified service covering all property needs. VM3 Fincas works for your peace of mind...",2024-05-09 11:26:00,10033,Published,,NA
dpkv.cz,"Dopravní podnik Karlovy Vary, a. s. is a traditional operator of public transport in Karlovy Vary.",2024-05-09 11:23:00,9157,Published,,NA
innophaseinc.com,InnoPhase is a fabless semiconductor company specializing in innovative wireless solutions.,2024-05-09 10:50:00,7609,Published,12.1,| http://lockbit7z2jwcskxpbokpemdxmltipntwlkmidcll2qirbu7ykg46eyd.onion/secret/5a46f03f33ab19b2cf34593d7852bd76-e5a8d8a6-6a22-39f7-b3b2-29c30b95db60/innophaseinc.com/ino.tgz-file-tree.txt
brfibra.com,Acompanhamento e pronta resposta aos clientes. A BR.Digital é sua parceira para transformar a tecnologia em uma solução simples para a sua empresa. SoluçõesConsulte por Setores. Valores que fazem da BR.Digital uma família: Visão.,2024-05-09 09:59:00,7497,Published,86.21,| http://lockbit33chewwx25efq6dgkhkw4u7nefudq4ijkuamjfd7x73on6dyd.onion/secret/c141b231f6f0fa14fbedfe1350959b9c-6ee6c219-ca79-35ca-951c-9ec340c1a0bb/brfibra.com/brfibra.com.7z-file-tree.txt
vstar.in,"V-Star Creations is an Indian manufacturer of inner wear. It is the subsidiary of V-Guard Industries V-Star Creations was founded in 1995 by SheelaKochouseph, the wife of Kochouseph Chittilappilly, founder and chairman of V-Guard Industries and a cha...",2024-05-09 09:58:00,9197,Published,,NA
interfashion.it,"INTERFASHION founded in 1992, and aquired by STRAVA S.r.l. in March 2023, is a design, production and distribution company based in Rimini, Italy. Over the years, Interfashion produced brands such as Marithè+François Girbaud, GGigli and I'm Isola Mar...",2024-05-09 09:58:00,7000,Published,177.31,| http://lockbit33chewwx25efq6dgkhkw4u7nefudq4ijkuamjfd7x73on6dyd.onion/secret/b634a1cd0e3738f935d04f45a81f4262-8685ab82-e883-3815-bdc6-2f50f386c3a1/interfashion.it/interfashion.it.7z-file-tree.txt
binder.de,"Your success starts with our solutions. At Binder, we develop repositionable and reclosable fastening systems for a wide range of industries. With solutions that meet the highest technical requirements, we help our customers to operate successfully a...",2024-05-09 09:56:00,7693,Published,23.7,| http://lockbit33chewwx25efq6dgkhkw4u7nefudq4ijkuamjfd7x73on6dyd.onion/secret/5d2e65a0479555e00a6da58a8e5af6b0-dc8552bd-66fb-3ed8-a1bf-58eb07b9a61c/binder.de/BIND.Personal.7z-file-tree.txt| http://lockbit33chewwx25efq6dgkhkw4u7nefudq4ijkuamjfd7x73on6dyd.onion/secret/5d2e65a0479555e00a6da58a8e5af6b0-dc8552bd-66fb-3ed8-a1bf-58eb07b9a61c/binder.de/BIND.Zertifikate.zip-file-tree.txt| http://lockbit33chewwx25efq6dgkhkw4u7nefudq4ijkuamjfd7x73on6dyd.onion/secret/5d2e65a0479555e00a6da58a8e5af6b0-dc8552bd-66fb-3ed8-a1bf-58eb07b9a61c/binder.de/sekr.7z-file-tree.txt
evw.k12.mn.us,"The EVW School District prides itself in having schools that have earned a positive reputation for high standards and rigor in academics, arts, and athletics.",2024-05-09 09:56:00,9412,Published,,NA
dsglobaltech.com,"DS Global Technology, a 1-Stop ICT Service Provider, integrate end to end ICT and communcation engineering and software development solution for SME and larger enterprise. Our skilled engineers are well trained and certified to perform complex integr...",2024-05-09 09:52:00,9020,Published,,NA
elements-ing.com,"Fondé en 2004 sous le nom de RFR éléments, Eléments Ingénieries est un acteur reconnu en environnement, énergie et fluides.",2024-05-09 09:45:00,9762,Published,,NA
itss.com.tr,,2024-05-09 09:41:00,10031,Published,,NA
uniter.net,"Uniter offers textile labelling solutions for clothing, footwear and accessories.",2024-05-09 09:37:00,10100,Published,,NA
truehomesusa.com,"True Homes is a semi-custom home builder in North and South Carolina, offering a variety of floorplans, communities and personalization options. Find your new True Home today and explore their blog, awards and broker partnerships.",2024-05-09 09:34:00,7689,Published,844.56,| http://lockbit33chewwx25efq6dgkhkw4u7nefudq4ijkuamjfd7x73on6dyd.onion/secret/a250da9ea5f1f17994f7b6cb26dcb267-d3280d37-5aca-37ad-84ac-3df5d18821d8/truehomesusa.com/truehomesusa.com.7z-file-tree.txt| http://lockbit33chewwx25efq6dgkhkw4u7nefudq4ijkuamjfd7x73on6dyd.onion/secret/a250da9ea5f1f17994f7b6cb26dcb267-d3280d37-5aca-37ad-84ac-3df5d18821d8/truehomesusa.com/truehomesusa.com_part2.7z-file-tree.txt
rushenergyservices.com,info@rushenergyservices.com Your Name (required) Your Email (required) Your Message. Rush Energy Services takes your privacy seriously. Information collected through this website will not be shared with any third party. Send Message. Rush Energy Serv...,2024-05-09 09:32:00,7525,Published,12.5,| http://lockbit33chewwx25efq6dgkhkw4u7nefudq4ijkuamjfd7x73on6dyd.onion/secret/379d2d0e414a7e335c2048810d79310e-f6e60507-0627-3a91-a469-a0b9f61e06f8/rushenergyservices.com/rushenergyservices.com.7z-file-tree.txt
livia.in,"Livia Polymer Products Pvt. Ltd. is one of the leading PET bottle manufacturers in India engaged in the manufacture of premium PET and PP containers, jars and bottles in various sizes, shapes and colours for numerous applications.",2024-05-09 09:27:00,8960,Published,,NA
spu.ac.th,Sripatum University is committed to be ICT Campus through continuously deploying appropriate technology and developing media for educational purposes. It is the directive of the university to encourage the use of information technology in all the cou...,2024-05-09 09:19:00,9875,Published,,NA
rfca.com,"Since Robinson, Farmer, Cox (RFC) was founded in 1953, the employees and members of RFC have taken great pride in maintaining our commitment of service to our clients. RFC began as a governmental audit and consulting practice in Charlottesville, Virg...",2024-05-09 09:17:00,7400,Published,87.91,| http://lockbit7z2jwcskxpbokpemdxmltipntwlkmidcll2qirbu7ykg46eyd.onion/secret/e5dd935dd8fee0e49713ef505be8c0f6-c370c249-b1a7-3532-82d9-2f2dc3c493c1/rfca.com/rfca.com.7z-file-tree.txt
mutualclubunion.com.ar,masunion@mutualclubunion.com.ar promocion@mutualclubunion.com.ar . Casa Central: Av. Independencia 324 - Sunchales (Sta Fe) Información al usuario financiero. Atención al usuario de servicios financieros +Unión. Una tarjeta de crédito local con todos...,2024-05-09 09:15:00,7421,Published,217.12,| http://lockbit7z2jwcskxpbokpemdxmltipntwlkmidcll2qirbu7ykg46eyd.onion/secret/68786564b38c47a69dda9bea786f4649-586895c9-503d-3b75-82f9-27741c2e88e6/mutualclubunion.com.ar/mutualclubunion.com.ar.7z-file-tree.txt
snk.sk,Slovenská národná knižnica is a company that operates in the Libraries industry.,2024-05-09 09:14:00,7638,Published,,NA
college-stemarie-elven.org,Collge Sainte Marie,2024-05-09 09:14:00,9745,Published,,NA
