Company,Company Description,Date Victimised,Number of Clicks,Status
highwaystrust.com,Highways Infrastructure Trust operates as an infrastructure investment trust. The Company invests in roadways and highways projects. Highways Infrastructure Trust serves customers in India.,2024-05-25 11:07:00,13801,Published
cafesnovell.com,"The structure of the Novell Group is made up of several companies oriented to the different business units: Restaurants , with service in both bean and ground coffee and capsules; Retail , aimed at domestic consumption and large stores; Catering , re...",2024-05-25 11:06:00,13944,Published
sunpetro.com,SunPetro takes pride in having established itself as India’s second largest private oil producer.,2024-05-25 11:02:00,13906,Published
kharafiglobal.com,Kharafi Global was established in 1993 by founding family members Waleed Al-Kharafi and Haidar Al-Naqeeb to develop and operate food beverage operations in Kuwait and neighboring Gulf countries.,2024-05-25 11:01:00,13614,Published
mgops.sedziszow-mlp.pl,The Social Welfare Center conducts its statutory activities based on applicable regulations. We grant monetary and non-monetary benefits.,2024-05-25 10:56:00,13879,Published
pressurejet.com,"PressureJet is ready to prove ""THE BEST QUALITY"" among all manufactures in India and also guarantes ""THE MOST REASONABLE PRICE""",2024-05-25 10:53:00,13221,Published
multigroup.info,"Multi Group distributes industrial kitchen equipment. The Company offers a wide range of refrigerators, deep freezers, ovens, cooking stoves, electric grills, dish washers, and accessories. Multi Group serves customers in France.",2024-05-25 10:48:00,13215,Published
valleylandtitleco.com,"Once you have invested in a home, you may want additional information on how to keep it looking beautiful all year long. Valley Land Title Co. makes it easy for you to successfully complete any home improvement project by providing you with important...",2024-05-23 22:31:00,12451,Published
londondrugs.com,"London Drugs is a Canadian retail pharmacy chain based in Richmond, British Columbia. As of June 2021, the chain has 78 stores in the provinces of British Columbia, Alberta, Saskatchewan, and Manitoba. In addition to pharmacy services, London Drugs l...",2024-05-23 06:56:00,13463,Published
telekom.com,"Deutsche Telekom AG, trading as Deutsche Telekom is a German telecommunications company headquartered in Bonn and is the largest telecommunications provider in Europe by revenue. It was formed in 1995 when Deutsche Bundespost, a state monopoly at the...",2024-05-22 17:34:00,16169,Published
powertestdyno.com,"Power Test. Test & Measurement Equipment, Manufacturing. Revenue $32.6 Million 5 Terabytes of private information. 4500000 files. Passports, bank statements, credit cards, blueprints, personal information of clients and employees and much more.",2024-05-22 16:31:00,12659,Published
originalfootwear.com,"Original Footwear is the leading manufacturer of occupational and tactical footwear for military, law enforcement and first responders. Founded in 1999, and based in Morrison. Tennessee, Original Footwear is the parent of Altama, Original S.W.A.T and...",2024-05-21 19:16:00,17575,Published
ramfoam.com,"Ramfoam manufacture and engineer foam for all aspects of the sports and leisure industries. We supply raw materials through to finished products, branded or unbranded, to Corporate clients, private and social clubs, schools, universities and even to...",2024-05-21 15:26:00,11963,Published
qualityplumbingassociates.com,"Quality Plumbing Associates, Inc. is committed to providing our clients and customers with the best possible value, quality and workmanship available in the industry. We will strive to be pioneers and leaders in the plumbing field by continually educ...",2024-05-20 14:13:00,10628,Published
carcajou.fr,"Groupe CARCAJOU : engineering and industrial equipment designer 270 gigabytes of data were stolen, including: Photo and video of the equipment produced, information about purchases and partners, insurance on ETREM/ALTAIIRE/SERIMECA (Carcajou is the...",2024-05-18 16:47:00,12750,Published
heartlandhealthcenter.org,Heartland Health Center is your home for healthcare. Our providers practice using an integrated approach. This means that staff work as a team to address all aspects of your health.,2024-05-18 13:50:00,13966,Published
sunwave.com.cn,2023-08-07 [公司新闻] 倒计时3天丨Sunwave三十周年庆典暨全球合作伙伴大会，即将绽放精彩! 关于三维 三维通信股份有限公司是国际主流的无线通信解决方案供应商，行业公认的无线信号覆盖、无线专网通信、无线信号安全、卫星通信服务领域的专家。,2024-05-16 12:06:00,23593,Published
acla.de,Als einer der führenden europäischen Hersteller von technischen Artikeln aus Polyurethan-Elastomeren bieten die ACLA-WERKE GMBH für zahlreiche Einsatzgebiete anwendungsorientierte und wirtschaftliche Problemlösungen an.,2024-05-14 09:35:00,9856,Published
21stcenturyvitamins.com,"https://mega.nz/folder/E3kmAZyT#KkvAaGlF3g0Pud4cwhxZpg The remaining data is bought in private. 21st Century, one of the largest international manufacturers of dietary supplements",2024-05-14 07:41:00,12417,Published
wichita.gov,UPDATE: A lot of city's data including 500GB mssql databases available for sell if no negotiation reached until 15th. Msg offers. UPDATE2: DATA IS SOLD Wichita is the most populous city in the U.S. state of Kansas and the county seat of Sedgwick...,2024-05-14 07:34:00,14052,Published
oseranhahn.com,"Company data will be available via a link at the bottom of the page. Oseran Hahn P.S. is a legal firm that offers a variety of services in the field of law. The company's practice areas include Business and Corporate Law, Litigation, and Condo L...",2024-05-13 13:54:00,11892,Published
hbmolding.com,Company data will be available via a link at the bottom of the page. HB Molding was founded in 1998 and originally located in the south side of Louisville. Due to our ability to quickly react to customer demands and opportunities we have grown t...,2024-05-13 13:40:00,10048,Published
contest.omg,"Объявляю конкурс Для участия в конкурсе необходимо связаться с родственниками или бедолагой, который скорее всего не удачно миксанул крипту в обмен на мою и привлёк к себе внимание ФБР, а вместе с ним и награду в 10 миллионов долларов за свою го...",2024-05-10 18:10:00,12729,Published
colonialsd.org,https://mega.nz/folder/l60i2aLR#1pTmoxhVwJrSvVhJ1V3F5g We are publishing sample partial (~50GB) from the data of Colonial School District. We have more 500GB available to sell. Contact us for a deal before 26th May with offers. If we do not receiv...,2024-05-10 06:31:00,11868,Published
incegroup.com,"ABOUT INERGROUP. We improve, manage, and deliver labor-intensive processes within our customers' manufacturing and distribution facilities. With our fixed cost pricing model and managed workforce deliverables, our Engineers work directly with your op...",2024-05-09 17:43:00,12111,Published
iaconnecticut.com,"Welcome to the Insurance Association of Connecticut. For over 50 years, the Insurance Association of Connecticut (IAC) has been the voice of insurers doing business in Connecticut. We represent the interests of insurers both large and small, foreign...",2024-05-09 17:42:00,11410,Published
indigo.ca,"Shop for books, gifts, and more at Indigo.ca, the online destination for Canada's biggest bookstore. Find new releases, bestsellers, exclusives, and more in various formats and genres.",2024-05-09 17:40:00,11016,Published
gruppobeltrame.com,"Il Gruppo. Attivo dal 1896 nel settore siderurgico, AFV Gruppo Beltrame è sinonimo di eccellenza e innovazione nella produzione di laminati mercantili e profili speciali per molteplici ambiti di impiego: costruzioni edili, cantieristica navale, macch...",2024-05-09 17:37:00,11625,Published
equatortrustees.com,"Equator Trustees Limited is licensed by the Seychelles Financial Services Authority (FSA) as a Corporate and Trustee Service Provider, and has offices in Victoria, the capital city of Seychelles on the island of Mahe. Call Us: +248 422 6205. Fax Us:...",2024-05-09 17:36:00,10605,Published
ecotruck.com.br,"A EcoTruck® fornece uma série de Tecnológicas para gestão ao mercado de Transporte, assegurando o mais moderno e eficiente sistema de soluções integradas para redução de custos com pneus, combustíveis e manutenção. As Ferramentas, Programas e Produto...",2024-05-09 17:35:00,10066,Published
cultivarnet.com.br,"Com uma equipe administrativa e comercial experiente, dedicada, proativa e competente a Cultivar se destaca também por seu amplo portfólio, com diversos fornecedores nos segmentos de agricultura e pecuária, indo desde os fertilizantes e corretivos, a...",2024-05-09 17:33:00,10343,Published
ckfinc.com,"January 31, 2023 - CKF, Inc. Strengthens Position in Sustainable Packaging Market Sector with $10 million Capital InvestmentJanuary 31, 2023 - CKF, Inc. Strengthens Position in Sustainable Packaging Market Sector with $10 million Capital Investment N...",2024-05-09 17:32:00,10020,Published
besttaxfiler.com,Yupp TV coupon Free $20.00 (www.Yupptv.com) Free. ITIN Application (worth of $29.99 service) (for Certification filing only) Free. FBAR (worth of $29.99 service) Free. Extension Filing (worth of $19.99 service) Free. 7 years assistance to resolve you...,2024-05-09 17:30:00,9966,Published
amsoft.cl,"Soluciones tecnológicas que impulsan tu negocio.Somos tu partner para transformar tu negocio de la mano de la tecnología; desarrollamos tu próxima aplicación, seremos tu equipo de profesionales, te asesoramos para dar el salto digital. Leer más Sobre...",2024-05-09 17:29:00,9915,Published
faacgroup.com,"Fabbrica Automatismi Apertura Cancelli (FAAC) was founded in 1965 and immediately became synonymous with automation for gates all around the world. Quality, safety, reliability, satisfaction, passion and research are the values on which the company l...",2024-05-09 17:27:00,9760,Published
worldlearning.org,"EDUCATION. A global development and exchange organization delivering education programs in more than 150 countries. Built on 90 years of expertise, our bottom-up and top-down approach serves individuals and communities at all levels.We have the uniqu...",2024-05-09 17:26:00,9569,Published
wisconsinindustrialcoatings.com,"Turn to the experienced professionals at Wisconsin Industrial Coatings for superior quality industrial coating and sandblasting services. Our facility includes 105,000 square feet of shop space and 12 overhead cranes with a maximum capacity of 50,000...",2024-05-09 17:24:00,9652,Published
mckimcreed.com,"McKim & Creed! You have 14 days left to avoid the devastating consequences of having your data published. We are ready to update your data that contains the following: - Personal data of your employees, customers and partners - Positive drug tes...",2024-05-09 16:54:00,9322,Published
nampak.com,"We will use the contacts we gain for our future phishing campaigns. Nampak has been attacked at 20.03.24 so partners and affiliates can check how they care about you. Nampak is Africa’s leading diversified packaging manufacturer, and has been listed...",2024-05-09 16:53:00,9386,Published
taylorlaw.net,"Taylor Law Offices, P.C. was established in 1980 as a general practice law firm and is located in Effingham, Illinois. We have seven attorneys with more than ninety years experience providing legal services to individuals and business clients through...",2024-05-09 16:25:00,9443,Published
kjf-augsburg.de,"Die KJF Augsburg ist eines der größten Sozialunternehmen in Bayern. Wir sind Träger von über 80 Einrichtungen und Diensten in Schwaben und dem angrenzenden Oberbayern. Ob Kita, Berufsbildungswerk, Schule oder Klinik – die KJF Augsburg ist in fast all...",2024-05-09 16:20:00,9457,Published
disb.dc.gov,05/19/2021 DC health insurance marketplace: history and news of the state's exchange: 04/22/2021 DISB Celebrates April as Financial Literacy Month with Free Resources for District Residents: 04/19/2021 Insurance in a Time of Transition: Highlights Fr...,2024-05-09 16:18:00,9637,Published
tascoplumbing.com,"TASCO Plumbing & Mechanical Corp is a company that operates in the Construction industry. It employs 51-100 people and has $10M-$25M of revenue. The company is headquartered in Hialeah, Florida.",2024-05-09 16:13:00,9044,Published
tu-ilmenau.de,"Eine moderne, zukunftsfähige Universität benötigt einen internationalen Campus mit einem weltoffenen Umfeld, in dem Menschen in ihrer Vielfalt akzeptiert werden und Grundrechte sowie Wissenschaftsfreiheit nicht in Frage gestellt werden.",2024-05-09 14:53:00,15077,Published
uslinen.com,"We are a family-owned, professionally managed provider of uniforms, mats, and towels that values a positive customer experience. Honesty, integrity, and respect are the driving forces behind our services. We believe in accountability, reliability, an...",2024-05-09 14:51:00,13938,Published
sesenergy.org,"As one of New England's original energy management companies, Secure Energy has been a trusted vendor partner, aggregator, and authorized broker for leading national suppliers since the infancy of the energy management industry. Let our team with 175...",2024-05-09 14:49:00,12893,Published
lenmed.co.za,Maputo Private Hospital is Mozambique’s first multidisciplinary hospital. It is equipped with cutting edge facilities and is located in the heart of Maputo. The hospital offers services in both English & Portuguese.,2024-05-09 14:49:00,15166,Published
dagma.com.ar,"NUESTROS VALORES ""Con visión y perseverancia de crecimiento"" Nos basamos en la conﬁanza, el respeto y la lealtad para con nuestros empleados y clientes, porque entendemos que son la base para construir juntos.",2024-05-09 14:48:00,7916,Published
kimmelcleaners.com,100gb,2024-05-09 14:45:00,13460,Published
ccofva.com,"Based in Richmond, Virginia, we function like a family, with each related company working together. Our experienced management team provides you with in-depth knowledge and can develop customized solutions for your particular needs.",2024-05-09 14:41:00,7556,Published
ctc-corp.net,"For over 115 years, we have built and maintained partnerships with our customers by providing solutions that are essential to their business. With our versatile offering of rental service, laundry and dry cleaning service and janitorial products, we...",2024-05-09 14:40:00,13431,Published
casajove.com,"Vídeo corporatiu de Casa Jové. Amb 140 anys d'història, reafirmem el nostre compromís per fer del món un lloc millor, just, sostenible, socialment responsable, on prevalgui l'ètica i el compromís impregni les nostres accions. Servei tècnic reparació...",2024-05-09 14:37:00,7195,Published
torrepacheco.es,"Torre-Pacheco es un municipio español de la Región de Murcia, enclavado en la llanura del Campo de Cartagena, a 8 km de las playas del Mar Menor. Con 39 037 habitantes, es el sexto municipio de la Región en número de habitantes.",2024-05-09 14:35:00,7660,Published
habeco.com.vn,"HABECO cam kết uống có trách nhiệm. Đó là lý do tại sao chúng tôi cần đảm bảo rằng bạn ở trên độ tuổi uống rượu hợp pháp và được phép xem trang web này một cách hợp pháp. Bằng cách nhấp vào xác nhận ""Tôi đã đủ 18 tuổi"" là bạn đồng ý với các điều khoả...",2024-05-09 14:22:00,7606,Published
easternshipbuilding.com,"Commercial Shipbuilding. For more than 45 years, Eastern has delivered over 350 vessels for commercial clients. Our quality of construction and commitment to customers are key to our success. Let us build your next state-of-the-art craft. Learn More.",2024-05-09 14:17:00,7425,Published
redwoodcoastrc.org,"This website uses cookies to improve your experience while you navigate through the website. Out of these, the cookies that are categorized as necessary are stored on your browser as they are essential for the working of basic functionalities of the...",2024-05-09 14:14:00,7326,Published
gpaa.gov.za,"The Government Pensions Administration Agency (GPAA) administers pensions on behalf of its primary clients, the Government Employees Pension Fund (GEPF) and National Treasury You can contact the main system administrator on the contacts below, wai...",2024-05-09 14:05:00,7521,Published
universalservicesms.com,"About Us. Universal Services LLC offers the unique capability of in-house design, fabrication, and installation; saving cost, schedule, and coordination. Since 2004, Universal has provided quality electrical, mechanical, structural, and CNC Machining...",2024-05-09 14:01:00,7344,Published
rmhfranchise.com,"RMH Vision. RMH Franchise strives to be a multi-brand restaurant company with a dynamic culture, focused on operational excellence and engaged team members who create value for our guests and deliver a superior return to our investors.",2024-05-09 13:59:00,7516,Published
ksa-architecture.com,"KSA is a different breed of architecture firm. We are a team of skilled technicians and consultants with decades of expertise in sustainable design. top of page. Solving problems. Building trust. ""You gave us a building that has exceeded our grandest...",2024-05-09 13:55:00,7166,Published
themisbourne.co.uk,"The Misbourne School is a coeducational secondary school and sixth form located in Great Missenden, Buckinghamshire, England. The school has approximately 1020 students, and the sixth form has around 170 students, offering A-Levels as well as BTEC qu...",2024-05-09 13:52:00,7358,Published
calvia.com,"L'Ajuntament de Calvià és l'administració local del municipi de Calvià, a Mallorca. Consulta els serveis, les notícies i el registre electrònic.",2024-05-09 13:44:00,7509,Published
nybravestfcu.org,"Manage your finances better with a Checking Account from NY Bravest FCU. With our Internet Teller, managing your money has never been easier. Quickly check your balance, review transactions, and balance your checkbook all in one place!",2024-05-09 13:31:00,7203,Published
ufresources.com,"UF Resources Corporation is a privately held holding company based in University Park, Florida, offering administration, information technology and other support services. We make extensive use of technology to leverage our resources to provide effic...",2024-05-09 13:26:00,7565,Published
rjcorp.in,"RJ Corp has emerged as a powerhouse multinational company with flourishing businesses in a range of sectors which include beverages, quick service restaurants (QSR), ice-cream, dairy products, retail, healthcare, and education. The Group is reputed f...",2024-05-09 13:18:00,7289,Published
acla-werke.com,ACLA-WERKE offer a comprehensive range of high-grade squeeges for all cases of the daily screen printing practice which set a standard in the screen printing world thanks to a long experience in the application. The screen printer has a choice betwee...,2024-05-09 13:03:00,7262,Published
crinetics.com,"Crinetics is here for endocrine disease patients who are eager to find therapies that provide effective disease control and more simplicity in their lives. We have failed to reach an agreement with the Crinetics organization, given their unscrupul...",2024-05-09 13:01:00,7538,Published
tegaindustries.com,"Tega is a global leader in designing and manufacturing of ‘critical-to-operate’ consumables for the mining, mineral processing and material handling industries.",2024-05-09 11:45:00,9599,Published
vm3fincas.es,"Since 1980 we have offered comprehensive advice on the management, administration and sale of real estate. Our multidisciplinary team allows us to provide a highly qualified service covering all property needs. VM3 Fincas works for your peace of mind...",2024-05-09 11:38:00,10137,Published
garage-cretot.fr,Automotive Service & Collision Repair Consumer Services,2024-05-09 11:34:00,9110,Published
cttxpress.com,"As a thought leader in the logistics industry, CTT Express structurally invests in trend research and solution development.",2024-05-09 11:32:00,9256,Published
iitm.ac.in,,2024-05-09 11:29:00,9459,Published
doublehorse.in,"Our brand double horse sells a variety of fast-moving consumer goods (FMCG) such as premium rice, instant mixes, health items, and culinary pastes ready-to-cook and ready-to-eat items that promise quality and healthy eating habits. Our dedication lie...",2024-05-09 11:29:00,9264,Published
vm3fincas.es,"Since 1980 we have offered comprehensive advice on the management, administration and sale of real estate. Our multidisciplinary team allows us to provide a highly qualified service covering all property needs. VM3 Fincas works for your peace of mind...",2024-05-09 11:26:00,9500,Published
dpkv.cz,"Dopravní podnik Karlovy Vary, a. s. is a traditional operator of public transport in Karlovy Vary.",2024-05-09 11:23:00,8475,Published
innophaseinc.com,InnoPhase is a fabless semiconductor company specializing in innovative wireless solutions.,2024-05-09 10:50:00,7034,Published
brfibra.com,Acompanhamento e pronta resposta aos clientes. A BR.Digital é sua parceira para transformar a tecnologia em uma solução simples para a sua empresa. SoluçõesConsulte por Setores. Valores que fazem da BR.Digital uma família: Visão.,2024-05-09 09:59:00,6880,Published
vstar.in,"V-Star Creations is an Indian manufacturer of inner wear. It is the subsidiary of V-Guard Industries V-Star Creations was founded in 1995 by SheelaKochouseph, the wife of Kochouseph Chittilappilly, founder and chairman of V-Guard Industries and a cha...",2024-05-09 09:58:00,8547,Published
interfashion.it,"INTERFASHION founded in 1992, and aquired by STRAVA S.r.l. in March 2023, is a design, production and distribution company based in Rimini, Italy. Over the years, Interfashion produced brands such as Marithè+François Girbaud, GGigli and I'm Isola Mar...",2024-05-09 09:58:00,6503,Published
binder.de,"Your success starts with our solutions. At Binder, we develop repositionable and reclosable fastening systems for a wide range of industries. With solutions that meet the highest technical requirements, we help our customers to operate successfully a...",2024-05-09 09:56:00,7081,Published
evw.k12.mn.us,"The EVW School District prides itself in having schools that have earned a positive reputation for high standards and rigor in academics, arts, and athletics.",2024-05-09 09:56:00,8733,Published
dsglobaltech.com,"DS Global Technology, a 1-Stop ICT Service Provider, integrate end to end ICT and communcation engineering and software development solution for SME and larger enterprise. Our skilled engineers are well trained and certified to perform complex integr...",2024-05-09 09:52:00,8347,Published
elements-ing.com,"Fondé en 2004 sous le nom de RFR éléments, Eléments Ingénieries est un acteur reconnu en environnement, énergie et fluides.",2024-05-09 09:45:00,9081,Published
itss.com.tr,,2024-05-09 09:41:00,9377,Published
uniter.net,"Uniter offers textile labelling solutions for clothing, footwear and accessories.",2024-05-09 09:37:00,9464,Published
truehomesusa.com,"True Homes is a semi-custom home builder in North and South Carolina, offering a variety of floorplans, communities and personalization options. Find your new True Home today and explore their blog, awards and broker partnerships.",2024-05-09 09:34:00,7104,Published
rushenergyservices.com,info@rushenergyservices.com Your Name (required) Your Email (required) Your Message. Rush Energy Services takes your privacy seriously. Information collected through this website will not be shared with any third party. Send Message. Rush Energy Serv...,2024-05-09 09:32:00,6947,Published
livia.in,"Livia Polymer Products Pvt. Ltd. is one of the leading PET bottle manufacturers in India engaged in the manufacture of premium PET and PP containers, jars and bottles in various sizes, shapes and colours for numerous applications.",2024-05-09 09:27:00,8276,Published
spu.ac.th,Sripatum University is committed to be ICT Campus through continuously deploying appropriate technology and developing media for educational purposes. It is the directive of the university to encourage the use of information technology in all the cou...,2024-05-09 09:19:00,9152,Published
rfca.com,"Since Robinson, Farmer, Cox (RFC) was founded in 1953, the employees and members of RFC have taken great pride in maintaining our commitment of service to our clients. RFC began as a governmental audit and consulting practice in Charlottesville, Virg...",2024-05-09 09:17:00,6828,Published
mutualclubunion.com.ar,masunion@mutualclubunion.com.ar promocion@mutualclubunion.com.ar . Casa Central: Av. Independencia 324 - Sunchales (Sta Fe) Información al usuario financiero. Atención al usuario de servicios financieros +Unión. Una tarjeta de crédito local con todos...,2024-05-09 09:15:00,6833,Published
snk.sk,Slovenská národná knižnica is a company that operates in the Libraries industry.,2024-05-09 09:14:00,7085,Published
college-stemarie-elven.org,Collge Sainte Marie,2024-05-09 09:14:00,9007,Published
cargotrinidad.com,"Logistics Management, Freight Forwarding, Air/Ocean Import and Export, Crating and Packing",2024-05-09 08:59:00,9962,Published
peninsulacrane.com,Peninsula Crane and Rigging serving entire Northern California and Nevada Area for over 39 years.,2024-05-09 08:50:00,10064,Published
vinatiorganics.com,"World’s largest manufacturer of IBB and ATBS, Vinati Organics Limited (VOL) blends innovation with chemistry to deliver value-added products to its varied clientele.",2024-05-09 08:49:00,8755,Published
