Company,Company Description,Date Victimised,Number of Clicks,Status
rhp.com.br,We've got information about more than 70000 patients staff contractors investors internal information,2024-09-04 21:29:00,6789,Published
gbricambi.it,"9 mila testate motore. 25 mila pompe e migliaia di altri prodotti: questi sono i numeri che distinguono la produzione di GB Ricambi, azienda italiana con sede a",2024-08-30 09:39:00,5808,Published
fanningfanning.com,"Engineering services for Mechanical, Electrical, Plumbing design and plant layout, HVAC, lighting, power, energy conservation and management, utilities",2024-08-30 09:38:00,5767,Published
akanea.com,"AKANEA, éditeur de logiciels pour la gestion et logistique : transport routier, transport international maritime et aérien, agroalimentaire et douane.",2024-08-30 09:37:00,5888,Published
jutebag.co.uk,"Jute Trading Ltd, Unit 370, Centennial Park, Centennial Avenue, Elstree Borehamwood, WD6 3TJ, UK. Phone: 01923 537 433. Email: sales@jutebag.co.uk. JuteBag Grey",2024-08-30 09:36:00,5320,Published
designintoto.com.au,"Intoto is a communications agency specialising in below-the-line services across a diverse range of categories from brand identity, photography, and design",2024-08-30 09:35:00,4611,Published
robesoncoso.org,"Sheriff Burnis Wilkins Sheriff Burnis Wilkins is a 40+ year sworn law enforcement Officer serving with city, county, state and federal agencies.",2024-08-30 09:34:00,4017,Published
acdcexpress.com,"ACDC Express is a South African Electrical Retail and Wholesale Franchise, specializing in Everything Electrical.",2024-08-29 17:36:00,4473,Published
pkf.com.au,"PKF Australia Limited is a member of PKF Global, the network of member firms of PKF International Limited, each of which is a separately owned legal entity and ...",2024-08-29 15:54:00,4389,Published
inces.com,inces.com,2024-08-29 15:54:00,4315,Published
huntongroup.com,"Hunton Group is a synergistic group of Companies focused on innovative systems, comprehensive solutions, and Trane's high-quality products.",2024-08-29 15:53:00,3988,Published
hphood.com,"Products: Milk, Ice Cream, Cottage Cheese, Sour Cream, Cream Eggnog, Recipes, Store Locator, Girl drinking Hood Milk, Girl drinking Hood milk.",2024-08-29 15:52:00,4257,Published
bridgestoneamericas.com,"Since its founding in 1931, Bridgestone is committed to innovating improvements for the world around us. We strive for what sets new standards.",2024-08-29 15:51:00,4324,Published
albanybank.com,Personal Banking Business Internet Banking Promo Business Internet Banking Managing your business finances is easier than ever!,2024-08-29 15:50:00,4204,Published
sampoernaagro.com,"Founded in 1993 and headquartered in South Sumatra, Indonesia, PT Sampoerna Agro Tbk is a palm oil manufacturer. They engage in the production of p...",2024-08-29 15:30:00,4279,Published
tdsb.on.ca,"The Toronto District School Board, also known under the acronym of TDSB, is the largest school Board in Canada and the fourth largest in North America",2024-08-29 15:28:00,4214,Published
alconca.com.ve,Granja Alconca CA is a company that operates in the Animals & Livestock industry. It employs 20to49 people and has 1Mto5M of revenue,2024-08-29 15:26:00,4186,Published
policiaauxiliarcusaem.com.mx,"Greetings! Today we are posting here the new company, ""POLICIAAUXILIARCUSAEM.MX"". Company Description: Government-funded private police auxiliary. Headquarters: 26-A Street No. 4, San Juan Ixtacala Industrial Subdivision, Tlalnepantla de Baz...",2024-08-16 20:57:00,8466,Published
ultragasmexico.com,"Ultragas México Organization began in 2013 by acquiring the companies Gas del Valle de Tollocan, SA de CV, Distribuidora Mexicana de Gas LP SA de CV and Compañía de Gas del Centro, SA de CV.",2024-08-12 11:21:00,8802,Published
taylorcrane.com,"Taylor Crane & Rigging, Inc. is committed to providing our clients with the very best in service, equipment and personnel. With this commitment, we will satisfy our clients’ needs in a safe, competitive, and responsive manner.",2024-08-12 11:20:00,8884,Published
soken-ce.co.jp,"Since its founding in 1948, the Soken Kagaku Group has developed unique technologies in fields such as home appliances, automobiles, and building materials, based on the founding spirit of ``Let's be the best company, no matter how small, and contrib...",2024-08-12 11:18:00,8829,Published
sitrack.com,"By using our services, you’ll be able to control and ensure the welfare of your capital, reducing costs, observing and making its operation effective.",2024-08-12 11:15:00,7398,Published
shinwajpn.co.jp,Supported by engineering power Shinwa is supported by the engineering power of trading company and manufacturer functions.A solution partner that responds to manufacturing issues.,2024-08-12 11:14:00,6201,Published
mogaisrael.com,"Import and export of various high-quality products for the food and chemical industry with Kashrut Le’Mehadrin, such as dried vegetables, leaves, spices and food additives",2024-08-12 11:12:00,6102,Published
maximumresearch.com,"MAXimum Research, Inc. is a market research firm with over 300 CATI stations. Our facility houses a100 CATI station phone room, in addition to 200+ remote agents across the US. Based in Southern New Jersey, just minutes from Philadelphia, MAXimum Res...",2024-08-12 11:06:00,6147,Published
kioti.com,"Since the first KIOTI tractor was introduced in the U.S. in 1986, KIOTI has aligned itself among the nation’s leading tractor brands. KIOTI remains steadfastly committed to the advancement and growth of tractor technology, value and service. And in t...",2024-08-12 11:05:00,5870,Published
indoramaventures.com,Indorama Ventures is a world-class sustainable chemical company making great products for society.,2024-08-12 11:04:00,5750,Published
hatsinteriors.com,"Hats Interiors is a family-owned business specializing in high-quality, custom furniture, joinery, and fit-outs. Our designs blend modern style with timeless craftsmanship, all meticulously created in our factory with a focus on sustainability and et...",2024-08-12 11:03:00,5838,Published
grc-c.co.il,"Company G. R. si. Consultants Ltd. (formerly Audit Plus Ltd.) has been operating since 2007 in the areas of internal audit, internal control and risk management and assessment. The company employs lawyers, economists, internal auditors and profession...",2024-08-12 11:01:00,5825,Published
eif.org.na,"The Environmental Investment Fund (EIF) is a fund created by Act 13 of 2001 of the Parliament of the Republic of Namibia with the overall aim of continuing this great legacy by supporting individuals, projects and communities that ensure the sustaina...",2024-08-12 11:00:00,5781,Published
coreengg.com,"Core Engineering LLC was founded in 2007, in Corpus Christi, TX. We have grown over the last few years, expanding our services over several states. We are a full-service engineering firm with a multi-discipline team of highly-motivated professionals.",2024-08-12 10:58:00,5670,Published
champion.com.co,International freight forwarding & logistics providers,2024-08-12 10:57:00,5779,Published
centralepaysanne.lu,"Founded in 1944, the Central Paysanne Luxembourgeoise, the largest and oldest professional organisation for farmers, winemakers and gardeners, is headed by a nine-member board",2024-08-12 10:56:00,5773,Published
carlfischer.com,Helping educators and musicians,2024-08-12 10:55:00,5748,Published
auburnpikapp.org,Our chapter at Auburn University implements the standards and executes the challenges set forth by the PI KAPPA PHI fraternity in order to develop exceptionally educated and modern leaders.,2024-08-12 10:54:00,5670,Published
anwaltskanzlei-kaufbeuren.de,"HERZLICH WILLKOMMEN IN DER KANZLEI PVZ POHL, VÖLSCH, ZINNER. Wir sind eine seit 1994 in Kaufbeuren ansässige Kanzlei. Unsere Rechtsanwälte beraten und vertreten sowohl Privatpersonen, mittelständische Unternehmen als auch lokale Gebietskörperschaften...",2024-08-12 10:28:00,5654,Published
udhaiyamdhall.com,"Shri Lakshmi Agro Foods Private Limited is one of the leading food processing companies in India, having its state of the art processing unit at Thiruvotriyur Chennai in about 3.15 acres of land. It has a strong presence in the market for the past 85...",2024-08-12 10:25:00,5705,Published
tetco.com,"TETCO, Inc. is a San Antonio-based company, owned and operated by the Tom E. Turner family for more than 60 years. Food service franchises, petrochemical distribution, and heavy truck and trailer repairs are the company’s primary revenue sources, wit...",2024-08-12 10:22:00,5690,Published
ipsenlogistics.com,"We are a holding company with interests in the field of international transport services, including industrial export packing.",2024-08-12 10:22:00,5421,Published
inouemfg.com,"INOUE MFG., INC.",2024-08-12 10:17:00,5580,Published
ciasc.mx,"Our firm Consultants and Researchers in Administration, S.C. was founded in 1993. Today we specialize in Credit Investigation and Portfolio Recovery services through extrajudicial and judicial means",2024-08-12 10:16:00,5578,Published
cdtmedicus.pl,"The Medicus Diagnostic and Therapy Center has 19 specialized clinics where patients can receive professional advice from doctors. specialists, and thereby take care of the health of yourself and your loved ones",2024-08-12 10:15:00,5562,Published
bildco.ae,Abu Dhabi National Building Materials Co.,2024-08-12 10:14:00,5411,Published
vitema.vi.gov,"FEMA, VITEMA Complete Exercises to Prepare for Hurricane Season. From May 20 to May 24, the Government of the Virgin Islands and federal partners participated in a series of response and recovery workshops along with a hurricane readiness response ex...",2024-08-11 12:19:00,5812,Published
vinatiorganics.com,Vinati Organics Limited (VOL) is one of the largest manufacturers of specialty chemical and organic intermediaries with a sustained market presence spanning over 35 countries in the world.,2024-08-11 12:17:00,5714,Published
vikrantsprings.com,Vikrant Springs is a leading manufacturer and exporter of custom made MULTI-LEAF and PARABOLIC SPRINGS with an experience of over 35 years.,2024-08-11 12:15:00,5614,Published
unisi.it,"Il sito ufficiale dell'Università di Siena offre informazioni su corsi, eventi, orientamento e servizi. Scopri le novità, le iniziative e le opportunità per studenti e docenti.",2024-08-11 12:14:00,5473,Published
acsistemas.com,"View Antonio Y Columbiano Informatica (www.acsistemas.com) location in Andalusia, Spain , revenue, industry and description. Find related and similar companies as well as employees by title and much more.",2024-08-11 12:07:00,11694,Published
thaiagri.com,"With our high quality product, TAF has customers in over 70 countries span over 6 continents, namely America, Europe, Middle East, Africa, Asia, Oceania. Quality goods are shipped through modern and punctual transportation channels.",2024-08-11 11:57:00,5082,Published
snapethorpeprimary.co.uk,WELCOME. Welcome to Snapethorpe Primary School. Since we started at Snapethorpe in Autumn 2023 Ms. Lewis - the Deputy Head Teacher - and I have experienced a very warm and welcoming school and we want everyone who already attends or arrives in Snapet...,2024-08-11 11:55:00,5000,Published
sislocar.com,"integrated logistics services. We offer tailored solutions that encompass customs warehouses, international transportation, and customs services. Our modern and secure warehouses, along with our extensive network of international partners, ensure pun...",2024-08-11 11:53:00,4841,Published
ondozabal.com,"Internacionalización y diversificación de sectores. Ondozabal Group ha evolucionado en el mercado en los últimos años, abriendo sus fronteras y apoyando el crecimiento internacional. Con más de un 32% de tasa de exportación, estamos presentes en vari...",2024-08-11 11:52:00,4858,Published
museu-goeldi.br,"O Museu Paraense Emílio Goeldi é uma instituição de pesquisa vinculada ao Ministério da Ciência, Tecnologia, Inovações e Comunicações do Brasil. Está localizado na cidade de Belém, Estado do Pará, região amazônica. Desde sua fundação, em 1866, suas a...",2024-08-11 11:49:00,4514,Published
mpeprevencion.com,"Gestión integral de la prevención. GRUPO MPE ofrece, como Servicio de Prevención de Riesgos Laborales, un Servicio Integral a todos sus. clientes. Para ello, cuenta con personal técnico altamente cualificado en las especialidades de. Seguridad en el...",2024-08-11 11:48:00,4762,Published
kowessex.co.uk,"Kings is a high achieving 13-18 years school. Exam results are consistently high year-on-year, with students making outstanding progress from Key Stage 2 to 4, and after the Sixth Form many students go on to top universities. Accolades and league tab...",2024-08-11 11:47:00,4564,Published
hotel-ostella.com,"The 4-star Ostella hotel is a real jewel, open all year round, comfortable and spacious rooms and luxury suites, wellness center, gym, jacuzzi pool, restaurant, lounge area and bar. For a relaxing stay on the Island of Beauty.",2024-08-11 11:44:00,4655,Published
hetero.com,"At Hetero, our every action seeks to inspire human belief in accessibility and affordability of life-saving medicines across the world. With unparalleled strengths in pharmaceutical research, manufacturing, and marketing, we are positioned to serve p...",2024-08-11 11:42:00,4420,Published
garage-cretot.fr,"Garage Cretot expert du véhicule professionnels : camion, semi-remorque, utilitaires plus de quarante années d'expertise à votre service",2024-08-11 11:41:00,4436,Published
essinc.com,"Long-duration Energy Storage | ESS, Inc. Accelerates Renewables. Long-duration storage is critical to create a decarbonized grid powered by renewable energy. ESS solutions, available now, enable the growing penetration of renewables and can deliver c...",2024-08-11 11:40:00,4145,Published
equinoxinc.org,"Equinox serves adolescents and adults struggling with chemical dependency; survivors of domestic violence and their children as well as elderly victims of domestic abuse; adolescents and adults, along with their families, who are living with mental i...",2024-08-11 11:38:00,4292,Published
depenning.com,"Who we are. Founded in 1856, De Penning & De Penning is the oldest established firm of intellectual property lawyers in India and remains at the forefront in protecting our clients' intellectual assets in a fast-changing and competitive market.",2024-08-11 11:36:00,4199,Published
cinealbeniz.com,cinealbeniz.com,2024-08-11 11:32:00,4303,Published
call4health.com,"Compassion is more than a slogan. The company was founded with a commitment to ensure patients and their families are treated with respect, empathy and compassion on every call. We believe in customer service excellence. The foundation of our busines...",2024-08-11 11:27:00,4279,Published
brockington.leisc.sch.uk,"We are a forward-looking and inclusive Church of England Academy. Central to all we do is our mission statement 'learning to live life to the full'. Taken from John 10:10, it is our aim that all students at Brockington College are able to flourish ac...",2024-08-11 11:25:00,4263,Published
asafoot.com,Our team at A Step Ahead Foot & Ankle Center is dedicated to offering you excellence in first step foot care. Our facilities have been designed to provide you with the utmost in comfort and convenience. A Step Ahead Foot & Ankle Center utilizes in-ho...,2024-08-11 11:19:00,4151,Published
alian.mx,"We are a provider of comprehensive solutions to a global market through injection molding of plastics and secondary operations. With a history of over 25 years, Alian is fully prepared to supply the plastic component and assembly needs that you requ...",2024-08-11 11:14:00,4133,Published
joliet86.org,"Joliet Public Schools District 86 provides a high-quality, inclusive, and equitable education for students to grow, lead, and thrive by empowering staff, collaborating with families, and embracing our diverse community.",2024-08-11 10:34:00,11151,Published
nationaldentex.com,"Data part #1 National Dentex is a full-service dental lab partner that offers a wide range of services, products and solutions for dentists and their patients. Whether you need crowns, bridges, veneers, implants or orthodontics, National Dentex can...",2024-08-11 10:33:00,36939,Published
dunaway.com,"Dunaway's work with the Permian Basin MPO started in the summer of 2020, when Dunaway was selected to identify the preferred route for the Permian Basin Regional Multi-Use Trail that would unify the communities of Midland and Odessa, Texas. Read More...",2024-08-11 10:33:00,8659,Published
manusa.com,"Discover the energy saving achieved by installing Manusa automatic doors, the fastest on the market. Doorwifi. Open to the future. Control and manage all your intelligent access systems in an easy and safe manner from your phone! Discover all the adv...",2024-08-11 10:33:00,9393,Published
rehub.ie,"Rehab Group Follow 7,317 3,747. Rehab Group is a charity that champions the value of diversity and inclusion for people with a disability or with additional support needs in their communities. ; Rehab Group @RehabGroup ·. 8 Feb. Safe to Create, a Dig...",2024-08-11 10:33:00,9472,Published
cms.law,"CMS lawyers are pleased to be attending the ITechLaw World Technology Law Conference 2024 held in Washington on 8-10 May. Below you can find an overview of our attending partners, representing a large range of jurisdictions and practice areas. To arr...",2024-08-11 10:32:00,6342,Published
agencavisystems.com,"Agencavi Systems is specialized in the complex and challenging field of industrial connections and supplies wiring, cables, connectors, accessories, complete kits, simple control panels and junction boxes.",2024-08-11 10:04:00,3830,Published
keuka.edu,"Keuka College is a private college in Keuka Park, New York, situated on Keuka Lake. Founded in 1890, the college emphasizes experiential learning as well as career and pre-professional education. It is classified among ""Master's Colleges and Universi...",2024-08-11 06:45:00,3777,Published
gorrias-mercedes-benz.fr,"Le Groupe Gorrias Mercedes-Benz est distributeur de camions, véhicules industriels, véhicules utilitaires. Les marques : Mercedes-Benz, Fuso, Setra, Evobus, OmniPlus. Ventes de véhicules neufs et d'occasions aux particuliers et professionnels. Servic...",2024-08-11 06:43:00,3864,Published
oyaksgs.com.tr,"Greetings! Today we are posting here the new company, ""OYAK Defense and Security Systems Inc."". Company Description: Oyak Savunma Ve Guvenlik Sistemleri A.S. is an enterprise located in Turkiye, with the main office in Ankara. The company opera...",2024-08-11 06:38:00,47510,Published
ema-eda.com,"Established in 1989 by Manny Marcano, EMA Design Automation is a leader in product development solutions ranging from electrical CAD tools, data management and PLM systems, services, training, and technical support. EMA is a Cadence® Channel Partn...",2024-08-11 06:34:00,3225,Published
kauffmanschool.org,The Ewing Marion Kauffman School is a free public charter school open to all students living in the Kansas City Public School District. The school is a three-school campus (two middle schools and a high school) of mission-driven college preparatory s...,2024-08-11 06:31:00,3154,Published
bnsgroup.co.uk,"Greetings! Today we are posting here the new company, ""BNS GROUP Ltd"". Company Description: Founded over twenty years ago B&S GROUP has grown into a organisation focused on serving the needs of independent pharmacy. Headquarters: London, En...",2024-08-11 06:28:00,20242,Published
ernesthealth.com,"Ernest Health hospitals are located throughout the United States in Arizona, California, Colorado, Idaho, Indiana, Montana, New Mexico, Ohio, South Carolina, Texas, Utah, Wisconsin, and Wyoming. Each hospital is managed locally to best meet the needs...",2024-08-11 06:17:00,8945,Published
morningstarco.com,"The Morning Star Company is a Woodland, California-based agribusiness and food processing company founded in 1970. The company was originally founded as a trucking outfit by Chris Rufer, who remains the sole owner. Morning Star processes about 40% of...",2024-08-11 06:13:00,34819,Published
allcare-med.com,"Shady Grove, MD. 16250 Frederick Road, Gaithersburg MD 20877. Coming Soon. Welcome to AllCare, providing expert primary care and accessible urgent care services. Get convenient, quality care at walk-in clinics near you.",2024-08-11 06:05:00,2588,Published
utc-silverstone.co.uk,"Silverstone UTC is a purpose built centre of excellence for young people wanting to break into the specialist fields of High Performance Engineering and Business with Events Management. It is based in the very heart of British Motorsport, at the Silv...",2024-08-11 06:04:00,2835,Published
twpunionschools.org,"The Union Public School District is a comprehensive community public school district that serves students in pre-kindergarten through twelfth grade from Union Township, in Union County, New Jersey, United States. As of the 2018–19 school year, the di...",2024-08-11 06:03:00,2718,Published
jmjcorporation.com,"Skip the online order from the retailer and get a good deal with them! - Jonathan B. Button. We're here to help! Simply call 804-270-7400 to discuss your requirements. JMJ Workplace Interiors in Richmond, VA, will bring your office vision to life wit...",2024-08-11 06:02:00,2821,Published
countyins.com,"The County Group are one of the UK's Top 25 Brokers, specialising in personal and commercial insurance. We have access to a full suite of insurance solutions.The County Group is comprised of over 35 community focused, local insurance brokers, and wel...",2024-08-11 06:02:00,2882,Published
srg-plc.com,We supply market leading retailers and wholesalers across the world with a range of private label and SRG branded products.,2024-08-11 05:54:00,2792,Published
thede-culpepper.com,"Protecting Your Legacy. The lawyers of Thede Culpepper focus their practices in the areas of estate and trust planning and administration, real estate, business, tax, compensation planning, and representing the needs of tax-exempt charitable organiza...",2024-08-11 05:53:00,2691,Published
skanlog.com,"In 2023, Skanlog successfully acquired all storage and distribution activities for alcoholic beverages in Sweden from Hillebrand Gori. This strategic move encompasses the takeover of Hillebrand Gori's warehouse and office in Jordbro, Stockholm, and X...",2024-08-11 05:51:00,2711,Published
emanic.net,"Electronic Maintenance Associates, Inc. (dba EMA) provides products, services, training, and more related to Medium Voltage Variable Frequency Drives. Celebrating our 33rd year, over 98% of our customers say they are ""very satisfied"" with EMA; that's...",2024-08-11 05:49:00,2772,Published
southernspecialtysupply.com,"With over 30 years of experience our dedicated sales team is here to help you with all of your supply needs for the oil and gas industry. Providing quality products and service, our team is here to provide knowledge and support for offshore, onshore,...",2024-08-11 05:49:00,2708,Published
rollingfields.com,"Rolling Fields Elder Care Community - Conneautville, PA. Watch on. Living at your own pace is the cornerstone for a happy life. At Rolling Fields you have the freedom to be as relaxed or as active as you choose to be. Our philosophy of care puts the...",2024-08-11 05:48:00,2682,Published
qespavements.com,"QES takes pride in expressing each value in our name: Quality Engineering Solutions. We provide solutions to challenges in the pavement and transportation field using the latest proven engineering technology, with a strong emphasis on the quality and...",2024-08-11 05:43:00,2709,Published
daubertchemical.com,"Since 1935, Daubert Chemical Company has focused on being the industry's ""silent partner"" as a provider and supplier of rust preventive coatings, industrial greases, sound deadening coatings, laminating adhesives, as well as a variety of corrosion in...",2024-08-11 05:43:00,17228,Published
morrisgroupint.com,"Morris Group International includes 28 divisions and partnerships and 27 locations worldwide. From stainless steel toilets, engineered plumbing and drainage products, and vacuum plumbing systems to drinking fountains and electric water heaters, our p...",2024-08-11 05:42:00,12839,Published
pricemodern.com,"Price Modern transforms the way people think, collaborate and perform by creating modern office designs for smarter, happier and more productive work environments. Price Modern was founded in 1904 and is headquartered out of Baltimore, Maryland. 11...",2024-08-11 05:41:00,20483,Published
churchill-linen.com,"Churchill Linen Service is family owned and operated for over 80 years, servicing Massachusetts, Rhode Island, Southern New Hampshire, Connecticut, New York, New Jersey, and Philadelphia.",2024-08-11 05:34:00,2665,Published
johnllowery.com,"John L. Lowery & Associates, Inc. was organized in 1964 to provide versatile and comprehensive engineering and technical services for the petrochemical industry. We have grown and now employ all levels of professional and technical personnel such as...",2024-08-11 05:30:00,2595,Published
sullivansteelservice.com,"Our central location allows quick shipping and receiving along with quick access to our shipping ports for our steel deliveries. 85 Route 31 North. Pennington, NJ 08534. fax: 1-609-530-1140. • Contact Sullivan Today •. • Request Quote •. Newsletter....",2024-08-11 05:28:00,2241,Published
divaris.com,From Our Experts. Three Concepts Worth Considering. Pandemic Retail Strategies. Locations. Tenant Portal. Award Winning. Forward Thinking. Results Driven. Divaris is Moving Commercial Real Estate Forward.,2024-08-11 05:24:00,2752,Published
