sagaciousresearch.com,"Sagacious IP offers customized solutions to meet your individual needs. Based on our long-standing expertise, we strategically address your business challenges and propose novel solutions. Our consulting approach rather than a report-only tactic driv...",2024-08-11 04:19:00,3237,Published,0.23,| http://lockbit33chewwx25efq6dgkhkw4u7nefudq4ijkuamjfd7x73on6dyd.onion/secret/566962d4b68989250fb468f8352f3256-03532bde-474c-3f7b-b25f-d4a4d08283bf/sagaciousresearch.com/sagaciousresearch.com.7z-file-tree.txt
kronospublic.com,"Kronos Corporate Group is a dynamic organization dedicated to innovation and portfolio diversification across multiple sectors. The journey began in 1986 by Pantelis Athinis, with the founding of Kronos Press Distribution Agency the first company in...",2024-08-10 11:42:00,3438,Published,,NA
dunaway.com,"Dunaway offers construction inspection, civil engineering, structural engineering, planning, landscape architecture and survey services. See their featured projects, news and insights, and career opportunities.",2024-08-04 13:21:00,5280,Published,0.13,| http://lockbit7z2jwcskxpbokpemdxmltipntwlkmidcll2qirbu7ykg46eyd.onion/secret/4b48a11d8fc81ecce948384feec1ae95-0ade45af-3b91-3dbd-aaee-892e4281935e/dunaway.com/dunaway.com.7z-file-tree.txt
kierlcpa.com,"Get In Touch. At T. Philip Kierl Jr. & Associates, CPA's, we've been serving the accounting needs of Oklahoma City, OK and the surrounding areas for years. If you need help managing any aspect of your home or business's finances, we want to hear from...",2024-08-04 11:53:00,5450,Published,53.2,| http://lockbit7z55tuwaflw2c7torcryobdvhkcgvivhflyndyvcrexafssad.onion/secret/efb45c054378dd014e1d8c25572e5f78-ecefc0ab-aa1e-33f4-9289-5307929a7c9e/kierlcpa.com/kierlcpa.com.7z-file-tree.txt
alliedtelesis.com,"271GB https://mega.nz/folder/Znsj3QZI#fu7f5tXpy7CiRLv3mQf2ZQ On June 17, we will post data from all offices in Europe and Asia. and in another week we will start posting data about the company’s projects and partners such as https://www.marvell.com...",2024-08-01 20:28:00,25815,Published,,NA
at-global.com,"500+gb https://mega.nz/folder/4qdwVIKR#uMVVp4g0U7VjBAo7UCNT5w The company www.alliedtelesis.com had offices in America (3 offices), Europe, Asia, China, Singapore and so on. We hacked into their network and took data from this company www.at-globa...",2024-08-01 20:28:00,5961,Published,,NA
marvell.com,"500+gb https://mega.nz/folder/4qdwVIKR#uMVVp4g0U7VjBAo7UCNT5w The company www.alliedtelesis.com had offices in America (3 offices), Europe, Asia, China, Singapore and so on. We hacked into their network and took data from this company www.at-globa...",2024-08-01 20:28:00,7017,Published,,NA
qftemb.com,"This factory is owned by continental.com. Continental develops pioneering technologies and services for sustainable and connected mobility of people and their goods. Founded in 1871, the technology company offers safe, efficient, intelligent and affo...",2024-07-31 13:21:00,5467,Published,,NA
lavalpoincon.com,"Your partner in the production of metal parts since 1980. At LPM, we combine expertise, innovation, and commitment to transform your challenges into success. Our mission is to revolutionize the way you run your production, whether through the design...",2024-07-28 12:52:00,4595,Published,304.62,| http://lockbit33chewwx25efq6dgkhkw4u7nefudq4ijkuamjfd7x73on6dyd.onion/secret/dd970ecc218605551d80d5ef7de8e2d3-6e28710d-89db-3ec5-becc-5cae4ab1a2d9/lavalpoincon.com/lavalpoincon.com.7z-file-tree.txt
sirva.com,"Sirva Worldwide, Inc. provides HR and mobility professionals with the resources, guidance, and support they need to achieve the best possible relocation for talent, and for the companies that move them.",2024-07-28 12:45:00,43128,Published,1032.68,| http://lockbit7z55tuwaflw2c7torcryobdvhkcgvivhflyndyvcrexafssad.onion/secret/6e5f121f63ed8f682245056814dbf515-83c97f68-bda9-3ea2-bd60-0a5d95f2656f/sirva.com/sirva.tgz-file-tree.txt| http://lockbit7z55tuwaflw2c7torcryobdvhkcgvivhflyndyvcrexafssad.onion/secret/6e5f121f63ed8f682245056814dbf515-83c97f68-bda9-3ea2-bd60-0a5d95f2656f/sirva.com/sirva2.tgz-file-tree.txt| http://lockbit7z55tuwaflw2c7torcryobdvhkcgvivhflyndyvcrexafssad.onion/secret/6e5f121f63ed8f682245056814dbf515-83c97f68-bda9-3ea2-bd60-0a5d95f2656f/sirva.com/sirva3.tgz-file-tree.txt| http://lockbit7z55tuwaflw2c7torcryobdvhkcgvivhflyndyvcrexafssad.onion/secret/6e5f121f63ed8f682245056814dbf515-83c97f68-bda9-3ea2-bd60-0a5d95f2656f/sirva.com/sirva4.tgz-file-tree.txt| http://lockbit7z55tuwaflw2c7torcryobdvhkcgvivhflyndyvcrexafssad.onion/secret/6e5f121f63ed8f682245056814dbf515-83c97f68-bda9-3ea2-bd60-0a5d95f2656f/sirva.com/sirva5.tgz-file-tree.txt
kendrion.com,"Kendrion is a global company that provides innovative solutions for electrification, automation and mobility. It offers products and services for various markets, such as agricultural, aviation, building, energy, medical and railway.",2024-07-28 12:43:00,8860,Published,20.8,| http://lockbit7z55tuwaflw2c7torcryobdvhkcgvivhflyndyvcrexafssad.onion/secret/8294fc3173f276a3d4b385f3479f3659-e7ea350d-29f1-3c9f-b0dc-2b2e5bb54601/kendrion.com/kendrion.com.7z-file-tree.txt
ccimp.com,"Préparation opérationnelle à l'emploi : des compétences sur un plateau ! Pour soutenir les entreprises en manque de profils adaptés sur certains postes, la CCI Aix-Marseille-Provence, via son entité CCI Formation, propose le dispositif de Préparation...",2024-07-28 12:42:00,9572,Published,235.12,| http://lockbit7z55tuwaflw2c7torcryobdvhkcgvivhflyndyvcrexafssad.onion/secret/cbcef2feaad41eab3112aba666d19645-fa8f22bd-6e99-37e5-8e7a-c8d09220e405/ccimp.com/ccimp.tgz-file-tree.txt
juvaskin.com,"Reach out and set up an in-person consultation with an expert member of our cosmetic dermatological staff to learn more about what JUVA Skin & Laser Center can do for you! Schedule. For the best in dermatology, laser treatments, body contouring, and...",2024-07-28 12:31:00,4347,Published,,NA
eastern-sales.com,"East Hardware opened its doors in 1967, servicing the general public and heavy mining industry with quality products and excellent service. In 1999, Eastern Sales began its operations with the same level of commitment, serving the industrial markets...",2024-07-28 12:29:00,4424,Published,,NA
ciberviaxesespecial.net,981216600 info@ciberviaxes.net Ciberviaxes especial Viajes para ti ABANCA Espacio +60 Afundación Toscana ¡Clica y conoce las características de este fantástico viaje! Croacia ¡Clica y conoce las características de este fantástico viaje! País Vasco ¡C...,2024-07-28 12:28:00,4453,Published,155.2,| http://lockbit7z55tuwaflw2c7torcryobdvhkcgvivhflyndyvcrexafssad.onion/secret/e48ae74da063631092728edf232c7dd6-478d58d3-d2d3-3a32-8fb7-7df9eb758b59/ciberviaxes.net/archive/ciberviaxes.net_.7z-file-tree.txt
agapefrance.org,"Aider chacun, là où il est, à découvrir, vivre et partager la foi en Jésus",2024-07-28 12:26:00,4378,Published,,NA
pbw-india.com,"HISTORY. Late Shri R. C. Patel, founder of Patel Brass Works was one of the first entrepreneurs to set up manufacturing facilities at Rajkot. Established in 1948 as a small foundry, PBW started its operations by producing castings for brass items. In...",2024-07-28 12:22:00,4240,Published,,NA
kvie.org,"KVIE is a PBS member television station in Sacramento, California, United States. The station is owned by KVIE, Inc., a community-based non-profit organization. KVIE's studios are located on West El Camino Avenue in the Natomas district of Sacramento...",2024-07-28 12:15:00,4134,Published,591.35,| http://lockbit7z6qinyhhmibvycu5kwmcvgrbpvtztkvvmdce5zwtucaeyrqd.onion/secret/3998ac32bec97f48c925c884738eb718-5c3c00db-59f4-3201-b9a3-0ba64481e583/kvie.org/kvie.org.7z-file-tree.txt
frilot.com,"Frilot LLC. Frilot LLC is a law firm located in New Orleans, Louisiana and offers full service representation in all areas of litigation on a local, regional and national basis. We act as business advisors and strategic partners for a wide range of p...",2024-07-28 12:10:00,4218,Published,432.33,| http://lockbit24pegjquuwbmwjlvyivmyaujf33kvlepcxyncnugm3zw73myd.onion/secret/0682612d3e672eb2acd89941348140bc-25df4a2b-8e3b-3e3b-b2ca-3565a93b726a/frilot.com/frilot.com.7z-file-tree.txt
kns.com,Full data leak 20 tb,2024-07-27 20:53:00,3810,Published,,NA
e21c.co.uk,"UPDATED!!! DATA!!! E21c - Business Information. Education · United Kingdom · 99 Employees. A message from our CEO: Education for the 21st Century is driven by a determination to create welcoming and open schools for the local community, where ever...",2024-07-26 21:35:00,7215,Published,,NA
petroassist.co.uk,"UPDATED!!! Very private and confident data! PETROTEC GROUP Billions private files from whole group servers. Tomorrow blog will updated. Equipped with 100% own technology, the Petrotec Group focuses on the distribution of Fuel Dispensers, Ca...",2024-07-26 21:30:00,4089,Published,,NA
olea.com,Olea Kiosks Resources for every step of the way. See Olea Kiosk designs in action and get a feel for self-service. Understand how self-service can be used to enhance productivity. Review our best practices to ensure your deployment is successful. Ole...,2024-07-26 17:39:00,9132,Published,48.8,| http://lockbit7z55tuwaflw2c7torcryobdvhkcgvivhflyndyvcrexafssad.onion/secret/0966b7c527ca8b2b011718b70a01a448-0372812b-31ea-36b9-8cbf-26cb776a1823/olea.com/olea.com.7z-file-tree.txt
cloudminds.com,"Cloudminds is a cloud intelligent robot operator. We provide professional robot operation services to clients from various industries and have launched service robot solutions such as welcoming robots using cloud intelligence, security patrol robots,...",2024-07-26 17:35:00,9174,Published,334.63,| http://lockbit7z55tuwaflw2c7torcryobdvhkcgvivhflyndyvcrexafssad.onion/secret/b6e5f14d42bd32ed9ebf7a5eb81a1efb-f948fc92-f1b2-3c27-a255-025cd23989ee/cloudminds.com/cloudminds.com.7z-file-tree.txt
jdbchina.com,"JDB Group is a Chinese manufacturer of nonalcoholic beverages, headquartered in Dongguan, Guangdong province in the People's Republic of China. Its herbal tea products are among the most popular beverages in China, competing with brands like Pepsi an...",2024-07-26 17:33:00,9095,Published,352.43,| http://lockbit7z55tuwaflw2c7torcryobdvhkcgvivhflyndyvcrexafssad.onion/secret/199229e4981d36d647e144e3f2cede94-2d80e93c-ce8a-3e58-8f85-938cd071d037/jdbchina.com/jdbchina.com.7z-file-tree.txt
hpo.pe,"HPO - HEAVEN PETROLEUM OPERATORS | 4440 seguidores en LinkedIn. Somos conocimiento, experiencia, calidad y resultados. | HPO",2024-07-26 17:31:00,3200,Published,2.6,| http://lockbit7z55tuwaflw2c7torcryobdvhkcgvivhflyndyvcrexafssad.onion/secret/03e1e32f163875f503c44a1d50ed2498-71c9e99c-9edb-38d2-a5ac-5b5b13ec09fc/hpo.pe/hpo.pe.7z-file-tree.txt
nationaldentex.com,"Data part #4 SQL,DOC National Dentex is a full-service dental lab partner that offers a wide range of services, products and solutions for dentists and their patients. Whether you need crowns, bridges, veneers, implants or orthodontics, National Dent...",2024-07-26 17:29:00,3460,Published,1265.2,| http://lockbit7z55tuwaflw2c7torcryobdvhkcgvivhflyndyvcrexafssad.onion/secret/92547204e55becd54f3dcdf683596674-58be7935-1349-3116-aa64-6d4956e1dbb5/nationaldentex.com/DOC.7z-file-tree.txt| http://lockbit7z55tuwaflw2c7torcryobdvhkcgvivhflyndyvcrexafssad.onion/secret/92547204e55becd54f3dcdf683596674-58be7935-1349-3116-aa64-6d4956e1dbb5/nationaldentex.com/SQL.7z-file-tree.txt
richmont.edu,"Clinical Director of the Richmont Trauma Center and Assistant Professor. Licensed Professional Counselor, Approved Clinical Supervisor. Ph.D. Counselor Education & Supervision, Mercer University; M.A. Marriage & Family Therapy with certificates in Ch...",2024-07-26 16:37:00,3526,Published,25.9,| http://lockbit24pegjquuwbmwjlvyivmyaujf33kvlepcxyncnugm3zw73myd.onion/secret/0eb8ab2f62b9ecf345c478955b57a191-c0dd697f-f1d3-3b11-bf84-7968b7dad790/richmont.edu/richmont.edu.7z-file-tree.txt
aei.cc,"Acre-Feet of Pool Volume. I-Move KY I-265, I-64 & I-71 Design Build. Louisville, Jefferson, Kentucky. AEI was the lead design firm for a four-year, $180 million design-build construction project including improvements to I-265, I-64 and I-71 through...",2024-07-26 16:29:00,36426,Published,67.41,| http://lockbit7z55tuwaflw2c7torcryobdvhkcgvivhflyndyvcrexafssad.onion/secret/628cfb7030c39946591cd658e7e2e738-40f99338-bb7a-3a45-9920-2c89f2eb1da9/aei.cc/aei.cc.7z-file-tree.txt
gitiusa.com,"Singapore-based Giti Tire Group, one of the largest tire companies in the world, has been in the tire business since 1951. Giti Tire operates eight manufacturing plants and produces a broad range of tire products, serving major original equipment veh...",2024-07-26 16:28:00,33745,Published,116.41,| http://lockbit7z55tuwaflw2c7torcryobdvhkcgvivhflyndyvcrexafssad.onion/secret/d441e8d5f8e1c60d292747b37557a674-b09e8248-92d4-3dd3-9acf-fb48742ce5d4/gitiusa.com/gitiusa.com.7z-file-tree.txt
carsonteam.com,"Carson has been a Northwestern leader in energy & transportation solutions for over 85 years. Today, we operate heavily in Oregon, Washington, Idaho, and California. We keep growing by providing best-in-class service and drastically improving the sav...",2024-07-26 16:26:00,36103,Published,82.51,| http://lockbit7z55tuwaflw2c7torcryobdvhkcgvivhflyndyvcrexafssad.onion/secret/00099e9763961a911518f99222d11fc8-e6f402d7-9bb2-3217-865f-0ee61d6adb47/carsonteam.com/carsonteam.com.7z-file-tree.txt
bkf-fleuren.de,Unser Familienunternehmen BKF A. Fleuren GmbH wurde im Jahr 1974/75 als Fensterbauunternehmen gegründet und zählt heute rund 100 Mitarbeiter. Auf einer Produktionsfläche von über 20.000 Quadratmetern produzieren wir modernste Kunststofffenster und -T...,2024-07-26 16:00:00,3503,Published,145.49,| http://lockbit7z55tuwaflw2c7torcryobdvhkcgvivhflyndyvcrexafssad.onion/secret/20bb57481707aae663013466e6587b90-95e54613-2081-3f08-96df-296119865413/kf-fleuren.de/bfkfleuren1.tgz-file-tree.txt| http://lockbit7z55tuwaflw2c7torcryobdvhkcgvivhflyndyvcrexafssad.onion/secret/20bb57481707aae663013466e6587b90-95e54613-2081-3f08-96df-296119865413/kf-fleuren.de/bfkfleuren2.tgz-file-tree.txt| http://lockbit7z55tuwaflw2c7torcryobdvhkcgvivhflyndyvcrexafssad.onion/secret/20bb57481707aae663013466e6587b90-95e54613-2081-3f08-96df-296119865413/kf-fleuren.de/kf-fleuren.de.7z-file-tree.txt
planethomelending.com,"Planet Home Lending offers home loans for purchase, refinance, cash-out, and renovation. See customer reviews, competitive rates, and career opportunities at Planet.",2024-07-26 15:55:00,8904,Published,10.8,| http://lockbit7z55tuwaflw2c7torcryobdvhkcgvivhflyndyvcrexafssad.onion/secret/e9880735a0381cf85b99c3982b6e8208-899688f7-5027-3c37-9034-fee9b9789345/planethomelending.com/planethomelending_com.zip-file-tree.txt
bnpmedia.com,"Established in 1926, we are a fourth-generation, family-run media enterprise based in Birmingham, Michigan. BNP Media is the trusted choice of millions of B2B professionals globally, providing superior information through a diverse range of reliable...",2024-07-26 15:53:00,8067,Published,333.33,| http://lockbit7z55tuwaflw2c7torcryobdvhkcgvivhflyndyvcrexafssad.onion/secret/b102380e2be62f63ea84f07436434654-efca2c33-e333-346b-acc7-c885db0924ab/bnpmedia.com/bnpmedia.com.7z-file-tree.txt
atcdi.com.cn,"The Kapari Water Supply Project, successfully implemented by ATCDI, brings clean water access to the remote Kapari Village in Abau District, Central Province.",2024-07-26 08:40:00,3358,Published,616.95,| http://lockbit24pegjquuwbmwjlvyivmyaujf33kvlepcxyncnugm3zw73myd.onion/secret/5c027ac355e44b82f6c1c35aef0c120e-d0146872-8033-34c0-9c2e-719e9fe12e65/atcdi.com.cn/atcdi.com.cn.7z-file-tree.txt
homelandvinyl.com,"Find all the information you need to know in our homeowners guide. Homeland Vinyl Products, Inc. creates a wide range of high quality residential and commercial vinyl products including vinyl fence, vinyl deck, vinyl railing, and specialty products.",2024-07-26 08:33:00,3394,Published,267.32,| http://lockbit24pegjquuwbmwjlvyivmyaujf33kvlepcxyncnugm3zw73myd.onion/secret/95bcac40ff12849967f1b6e4210ed0f9-051b6f31-5083-3a6e-b23e-ef110c870782/homelandvinyl.com/homelandvinyl.com.7z-file-tree.txt
sandytownshippolice.org,"Sandy Township Police is proud to partner with and serve our distinct neighborhoods of Oklahoma, West Sandy, West Liberty, Kiwanis Park, Adrian, Iselin Heights, Singing Hills, Clear Run, Indian Hills, Sabula, and Treasure Lake. The Sandy Township Pol...",2024-07-26 08:29:00,3316,Published,72.21,| http://lockbit24pegjquuwbmwjlvyivmyaujf33kvlepcxyncnugm3zw73myd.onion/secret/78b5dbb883a6d1377fe89312732f2a22-e7072db9-2172-3869-98fd-6533ba82eacc/sandytownshippolice.org/sandytownshippolice.org.7z-file-tree.txt
glnf.fr,La Grande Loge nationale française est une obédience maçonnique française fondée en 1913 sous le nom de « Grande Loge nationale indépendante et régulière pour la France et ses colonies,2024-07-25 17:28:00,2844,Published,0.15,| http://lockbit24pegjquuwbmwjlvyivmyaujf33kvlepcxyncnugm3zw73myd.onion/secret/8f255ab075dba47e0e3d2b1b0bda253b-bdd750c6-dbd1-3f5c-ac18-3621a7c72158/glnf.fr/GLNF.zip-file-tree.txt
fbrlaw.com,"UPDATED!!! All business life of company available inside Quickbook files. Fusco, Brandenstein & Rada, P.C. Your Experienced Workers’ Compensation and Social Security Disability Attorneys Are you unable to work or has your income been impacte...",2024-07-24 18:15:00,6322,Published,,NA
tccfleet.com,"TCC’s history began in 1917 with, the founder of Tai Chong Hsiang Steamship Company, Mr. C.S. Koo’s establishment of Tai Chong Hsiang Customs Brokerage Company in 1917. Leaving behind a poverty-stricken childhood, Mr. C.S. Koo was determined to set o...",2024-07-22 15:46:00,8428,Published,,NA
kns.com,"Kulicke & Soffa Ticker NASDAQ: KLIC Founded in 1951 and headquartered in Singapore, Kulicke & Soffa is a semiconductor and electronics manufacturing company. ### In light of the unexpected termination of negotiations and the emergence of new...",2024-07-22 15:38:00,7795,Published,760.16,| http://lockbit24pegjquuwbmwjlvyivmyaujf33kvlepcxyncnugm3zw73myd.onion/secret/57018bd13bd5b72c88e9e3a3efe47ecf-1c87099f-63cb-3a48-bc83-579201e8287f/kns.com/files.7z-file-tree.txt| http://lockbit24pegjquuwbmwjlvyivmyaujf33kvlepcxyncnugm3zw73myd.onion/secret/57018bd13bd5b72c88e9e3a3efe47ecf-1c87099f-63cb-3a48-bc83-579201e8287f/kns.com/kns.com.part001.rar-file-tree.txt| http://lockbit24pegjquuwbmwjlvyivmyaujf33kvlepcxyncnugm3zw73myd.onion/secret/57018bd13bd5b72c88e9e3a3efe47ecf-1c87099f-63cb-3a48-bc83-579201e8287f/kns.com/kns.com.part002.rar-file-tree.txt| http://lockbit24pegjquuwbmwjlvyivmyaujf33kvlepcxyncnugm3zw73myd.onion/secret/57018bd13bd5b72c88e9e3a3efe47ecf-1c87099f-63cb-3a48-bc83-579201e8287f/kns.com/kns.com.part003.rar-file-tree.txt| http://lockbit24pegjquuwbmwjlvyivmyaujf33kvlepcxyncnugm3zw73myd.onion/secret/57018bd13bd5b72c88e9e3a3efe47ecf-1c87099f-63cb-3a48-bc83-579201e8287f/kns.com/kns.com.part004.rar-file-tree.txt| http://lockbit24pegjquuwbmwjlvyivmyaujf33kvlepcxyncnugm3zw73myd.onion/secret/57018bd13bd5b72c88e9e3a3efe47ecf-1c87099f-63cb-3a48-bc83-579201e8287f/kns.com/kns.com.part005.rar-file-tree.txt| http://lockbit24pegjquuwbmwjlvyivmyaujf33kvlepcxyncnugm3zw73myd.onion/secret/57018bd13bd5b72c88e9e3a3efe47ecf-1c87099f-63cb-3a48-bc83-579201e8287f/kns.com/kns.com.part006.rar-file-tree.txt| http://lockbit24pegjquuwbmwjlvyivmyaujf33kvlepcxyncnugm3zw73myd.onion/secret/57018bd13bd5b72c88e9e3a3efe47ecf-1c87099f-63cb-3a48-bc83-579201e8287f/kns.com/kns.com.part007.rar-file-tree.txt| http://lockbit24pegjquuwbmwjlvyivmyaujf33kvlepcxyncnugm3zw73myd.onion/secret/57018bd13bd5b72c88e9e3a3efe47ecf-1c87099f-63cb-3a48-bc83-579201e8287f/kns.com/kns.com.part008.rar-file-tree.txt| http://lockbit24pegjquuwbmwjlvyivmyaujf33kvlepcxyncnugm3zw73myd.onion/secret/57018bd13bd5b72c88e9e3a3efe47ecf-1c87099f-63cb-3a48-bc83-579201e8287f/kns.com/kns.com.part009.rar-file-tree.txt| http://lockbit24pegjquuwbmwjlvyivmyaujf33kvlepcxyncnugm3zw73myd.onion/secret/57018bd13bd5b72c88e9e3a3efe47ecf-1c87099f-63cb-3a48-bc83-579201e8287f/kns.com/kns.com.part010.rar-file-tree.txt| http://lockbit24pegjquuwbmwjlvyivmyaujf33kvlepcxyncnugm3zw73myd.onion/secret/57018bd13bd5b72c88e9e3a3efe47ecf-1c87099f-63cb-3a48-bc83-579201e8287f/kns.com/kns.com.part011.rar-file-tree.txt| http://lockbit24pegjquuwbmwjlvyivmyaujf33kvlepcxyncnugm3zw73myd.onion/secret/57018bd13bd5b72c88e9e3a3efe47ecf-1c87099f-63cb-3a48-bc83-579201e8287f/kns.com/kns.com.part012.rar-file-tree.txt| http://lockbit24pegjquuwbmwjlvyivmyaujf33kvlepcxyncnugm3zw73myd.onion/secret/57018bd13bd5b72c88e9e3a3efe47ecf-1c87099f-63cb-3a48-bc83-579201e8287f/kns.com/kns.com.part013.rar-file-tree.txt| http://lockbit24pegjquuwbmwjlvyivmyaujf33kvlepcxyncnugm3zw73myd.onion/secret/57018bd13bd5b72c88e9e3a3efe47ecf-1c87099f-63cb-3a48-bc83-579201e8287f/kns.com/kns.com.part014.rar-file-tree.txt| http://lockbit24pegjquuwbmwjlvyivmyaujf33kvlepcxyncnugm3zw73myd.onion/secret/57018bd13bd5b72c88e9e3a3efe47ecf-1c87099f-63cb-3a48-bc83-579201e8287f/kns.com/kns.com.part015.rar-file-tree.txt| http://lockbit24pegjquuwbmwjlvyivmyaujf33kvlepcxyncnugm3zw73myd.onion/secret/57018bd13bd5b72c88e9e3a3efe47ecf-1c87099f-63cb-3a48-bc83-579201e8287f/kns.com/kns.com.part016.rar-file-tree.txt| http://lockbit24pegjquuwbmwjlvyivmyaujf33kvlepcxyncnugm3zw73myd.onion/secret/57018bd13bd5b72c88e9e3a3efe47ecf-1c87099f-63cb-3a48-bc83-579201e8287f/kns.com/kns.com.part017.rar-file-tree.txt| http://lockbit24pegjquuwbmwjlvyivmyaujf33kvlepcxyncnugm3zw73myd.onion/secret/57018bd13bd5b72c88e9e3a3efe47ecf-1c87099f-63cb-3a48-bc83-579201e8287f/kns.com/kns.com.part018.rar-file-tree.txt| http://lockbit24pegjquuwbmwjlvyivmyaujf33kvlepcxyncnugm3zw73myd.onion/secret/57018bd13bd5b72c88e9e3a3efe47ecf-1c87099f-63cb-3a48-bc83-579201e8287f/kns.com/kns.com.part019.rar-file-tree.txt| http://lockbit24pegjquuwbmwjlvyivmyaujf33kvlepcxyncnugm3zw73myd.onion/secret/57018bd13bd5b72c88e9e3a3efe47ecf-1c87099f-63cb-3a48-bc83-579201e8287f/kns.com/kns.com.part020.rar-file-tree.txt| http://lockbit24pegjquuwbmwjlvyivmyaujf33kvlepcxyncnugm3zw73myd.onion/secret/57018bd13bd5b72c88e9e3a3efe47ecf-1c87099f-63cb-3a48-bc83-579201e8287f/kns.com/kns.com.part021.rar-file-tree.txt| http://lockbit24pegjquuwbmwjlvyivmyaujf33kvlepcxyncnugm3zw73myd.onion/secret/57018bd13bd5b72c88e9e3a3efe47ecf-1c87099f-63cb-3a48-bc83-579201e8287f/kns.com/kns.com.part022.rar-file-tree.txt| http://lockbit24pegjquuwbmwjlvyivmyaujf33kvlepcxyncnugm3zw73myd.onion/secret/57018bd13bd5b72c88e9e3a3efe47ecf-1c87099f-63cb-3a48-bc83-579201e8287f/kns.com/kns.com.part023.rar-file-tree.txt| http://lockbit24pegjquuwbmwjlvyivmyaujf33kvlepcxyncnugm3zw73myd.onion/secret/57018bd13bd5b72c88e9e3a3efe47ecf-1c87099f-63cb-3a48-bc83-579201e8287f/kns.com/kns.com.part024.rar-file-tree.txt| http://lockbit24pegjquuwbmwjlvyivmyaujf33kvlepcxyncnugm3zw73myd.onion/secret/57018bd13bd5b72c88e9e3a3efe47ecf-1c87099f-63cb-3a48-bc83-579201e8287f/kns.com/kns.com.part025.rar-file-tree.txt| http://lockbit24pegjquuwbmwjlvyivmyaujf33kvlepcxyncnugm3zw73myd.onion/secret/57018bd13bd5b72c88e9e3a3efe47ecf-1c87099f-63cb-3a48-bc83-579201e8287f/kns.com/kns.com.part026.rar-file-tree.txt| http://lockbit24pegjquuwbmwjlvyivmyaujf33kvlepcxyncnugm3zw73myd.onion/secret/57018bd13bd5b72c88e9e3a3efe47ecf-1c87099f-63cb-3a48-bc83-579201e8287f/kns.com/kns.com.part027.rar-file-tree.txt| http://lockbit24pegjquuwbmwjlvyivmyaujf33kvlepcxyncnugm3zw73myd.onion/secret/57018bd13bd5b72c88e9e3a3efe47ecf-1c87099f-63cb-3a48-bc83-579201e8287f/kns.com/kns.com.part028.rar-file-tree.txt| http://lockbit24pegjquuwbmwjlvyivmyaujf33kvlepcxyncnugm3zw73myd.onion/secret/57018bd13bd5b72c88e9e3a3efe47ecf-1c87099f-63cb-3a48-bc83-579201e8287f/kns.com/kns.com.part029.rar-file-tree.txt| http://lockbit24pegjquuwbmwjlvyivmyaujf33kvlepcxyncnugm3zw73myd.onion/secret/57018bd13bd5b72c88e9e3a3efe47ecf-1c87099f-63cb-3a48-bc83-579201e8287f/kns.com/kns.com.part030.rar-file-tree.txt| http://lockbit24pegjquuwbmwjlvyivmyaujf33kvlepcxyncnugm3zw73myd.onion/secret/57018bd13bd5b72c88e9e3a3efe47ecf-1c87099f-63cb-3a48-bc83-579201e8287f/kns.com/kns.com.part031.rar-file-tree.txt| http://lockbit24pegjquuwbmwjlvyivmyaujf33kvlepcxyncnugm3zw73myd.onion/secret/57018bd13bd5b72c88e9e3a3efe47ecf-1c87099f-63cb-3a48-bc83-579201e8287f/kns.com/kns.com.part032.rar-file-tree.txt| http://lockbit24pegjquuwbmwjlvyivmyaujf33kvlepcxyncnugm3zw73myd.onion/secret/57018bd13bd5b72c88e9e3a3efe47ecf-1c87099f-63cb-3a48-bc83-579201e8287f/kns.com/kns.com.part033.rar-file-tree.txt| http://lockbit24pegjquuwbmwjlvyivmyaujf33kvlepcxyncnugm3zw73myd.onion/secret/57018bd13bd5b72c88e9e3a3efe47ecf-1c87099f-63cb-3a48-bc83-579201e8287f/kns.com/kns.com.part034.rar-file-tree.txt| http://lockbit24pegjquuwbmwjlvyivmyaujf33kvlepcxyncnugm3zw73myd.onion/secret/57018bd13bd5b72c88e9e3a3efe47ecf-1c87099f-63cb-3a48-bc83-579201e8287f/kns.com/kns.com.part035.rar-file-tree.txt| http://lockbit24pegjquuwbmwjlvyivmyaujf33kvlepcxyncnugm3zw73myd.onion/secret/57018bd13bd5b72c88e9e3a3efe47ecf-1c87099f-63cb-3a48-bc83-579201e8287f/kns.com/kns.com.part036.rar-file-tree.txt| http://lockbit24pegjquuwbmwjlvyivmyaujf33kvlepcxyncnugm3zw73myd.onion/secret/57018bd13bd5b72c88e9e3a3efe47ecf-1c87099f-63cb-3a48-bc83-579201e8287f/kns.com/kns.com.part037.rar-file-tree.txt| http://lockbit24pegjquuwbmwjlvyivmyaujf33kvlepcxyncnugm3zw73myd.onion/secret/57018bd13bd5b72c88e9e3a3efe47ecf-1c87099f-63cb-3a48-bc83-579201e8287f/kns.com/kns.com.part038.rar-file-tree.txt
customssupport.be,"We are specialised in - Import, export, and transit - Goods Classification - Customs Consultancy",2024-07-18 16:18:00,5104,Published,,NA
barkingwell.gr,"Barking Well Media was founded by the Greek entrepreneur Nikos Koklonis, who was selected by Fortune magazine for its ""40 under 40"" list as one of the top entrepreneurs of 2015 in Greece under 40 years old.",2024-07-18 14:57:00,7530,Published,,NA
