Company,Company Description,Date Victimised,Number of Clicks,Status
orsiniimballaggi.com,"Manufacturing, Packaging Services, Self-Storage, Shipping",2024-05-09 08:48:00,9080,Published
grupopm.com,"Grupo PM is a Marketing agency.Together they gather more than 50 years of joint-experience in Marketing, Advertising, Sales, Promotion and above all planning and development of Market strategies, used to position our clients and their products in the...",2024-05-09 08:48:00,9400,Published
randi-group.com,"Randi Group, Natural Products Extracted from Grapes Values that bring us together as a group",2024-05-09 08:44:00,8414,Published
totto.com,Nalsani SAS is a company with nationally-focused eCommerce activity.,2024-05-09 08:41:00,8761,Published
salmonesaysen.cl,Salmones Aysén S.A. es una empresa Salmonera enfocada 100% en el cultivo y comercialización del Salmón del Pacífico,2024-05-09 08:39:00,8253,Published
ajcfood.com,"AJC Brands. Our brands mean business. AJC branded products are sold in 100+ countries. Together they total 400+ products. AJC International is a global leader in the procurement and sale of frozen meat, poultry, pork, seafood and vegetable products.",2024-05-08 18:07:00,6984,Published
bancodevenezuela.com,"Conoce los productos y servicios que ofrece el Banco de Venezuela, como la cuenta digital, la cuenta en divisas, el mesa de cambio, el menudeo y el programa EmprendeBDV. Descarga la BDVApp y paga al instante con el QR.",2024-05-06 15:16:00,12185,Published
gammarenax.ch,gammaRenax ist ein leistungsfähiger Qualitätsanbieter integraler Facility Services mit mehr als 2'110 Mitarbeitenden an 16 Standorten in allen Regionen der Schweiz. Mit einem Portfolio von über 1'600 Objekten und einem Jahresumsatz von 81 Millionen F...,2024-05-06 15:12:00,8618,Published
oraclinical.com,"With 85+ approvals to date, whatever your challenge, we're here to ensure success. Discover how we make work better for our workforce. We provide the vision and experience to help guide your Ophthalmic product from preclinical stages through commerci...",2024-05-06 15:10:00,8377,Published
rammutual.com,"Your Partner in Protection. RAM is proud to be a leading reinsurer to the township mutual industry. In addition to our excellent member service program, RAM offers a full line of personal and commercial insurance products available in both Minnesota...",2024-05-06 15:09:00,8315,Published
gslelectric.com,Read about the Salt Lake City Airport Phase 2 Project in Utah,2024-05-06 15:08:00,8121,Published
harwoodlloyd.com,"Eileen Kuzma is Counsel in Harwood Lloyd's General Litigation and Wills, Trusts and Estates Departments, with a concentration in appellate matters, legal research and brief writing, encompassing a wide array of practice areas. Ms. Kuzma has extensive...",2024-05-06 15:07:00,8096,Published
etships.com,"For more information, please visit our recruiting profile on Facebook: Recruit Transport or call us today at (419) 464-9450 Ext. 4! www.etships.com. 1. Expeditus Transport, LLC | 872 followers on ...",2024-05-06 15:06:00,8121,Published
ville-bouchemaine.fr,"Prof express - Révisions Brevet/Bac Des enseignants de l'Éducation nationale, disponibles pour vos enfants, afin de réviser le Brevet ou le BAC et bénéficier de leurs conseils pour... Lire la suite; Réouverture de l'Aire d'Accueil de Camping-Car L'ai...",2024-05-06 15:04:00,8427,Published
sonoco.com,"Sonoco Products Company is an American provider of diversified consumer packaging, industrial products, protective packaging, and packaging supply chain services and the world's largest producer of composite cans, tubes, and cores.",2024-05-06 15:02:00,8416,Published
thebiglifegroup.com,"The Big Life group is a social enterprise that fights inequality by offering various services and support to people and places. Learn more about their values, history, people, news and how to find support near you.",2024-05-06 15:01:00,7921,Published
elarabygroup.com,"Wish ListAdd to Compare. HAMA High Speed HDMI™ Cable Plug-Plug Ethernet 90° Plug 1.5m Black HAM ... 5.0. EGP680. Add to Cart. Welcome to Elaraby Group in Egypt. Buy online Discover a wide range of home appliances and TVs of brands Toshiba, Sharp, Tor...",2024-05-06 14:59:00,8616,Published
qintess.com,Learn more about Qintess. We are focused on business transformation. We innovate. We think outside the box. We simplify technology and offer its best to our customers. Learn more about Qintess. PT | EN | ES +55 11 2899-6000 contact@qintess.com Área d...,2024-05-06 14:57:00,8492,Published
newsupri.com.br,"A Newsupri é uma empresa especialista em prover soluções inovadoras em infraestrutura de TI. São 35 anos de inovação e experiência, atendendo a Região Nordeste através de um time com mais de 30 profissionais altamente qualificados. Nossos parceiros p...",2024-05-06 14:54:00,8055,Published
senacrs.com.br,"O Senac-RS oferece cursos livres, técnicos, de graduação, pós-graduação, extensões, idiomas e ensino médio em 18 áreas do conhecimento. Veja depoimentos, descontos, parcerias, eventos, notícias e artigos sobre o Senac-RS.",2024-05-06 14:52:00,7991,Published
aev-iledefrance.fr,Agence des espaces verts d'Ile de France - Île-de-France Nature,2024-05-06 14:44:00,8028,Published
piramal.com,"Piramal Group is a leading Global Business Conglomerate with diverse interests in Pharma, Financial Services, Real Estate, and Glass Packaging; nurturing social initiatives through Piramal Foundation",2024-05-06 14:39:00,7542,Published
remagroup.com,"Company. REMA Group, with locations in Germany, China and the USA, is one of the international technological leaders in the field of high-current contact systems. We develop and produce connector systems for charging electric vehicles, high-current c...",2024-05-06 14:04:00,7505,Published
grand-indonesia.com,"Grand Indonesia is an integrated multipurpose complex at Thamrin Road in Central Jakarta, Indonesia. The 640,000 m² complex consists of a huge shopping mall, office tower Menara BCA, high end serviced residential tower Kempinski Residences and the fi...",2024-05-06 13:59:00,7458,Published
carespring.com,"At Carespring, we are committed to providing top-quality health care management services to our patients. Whether you need skilled nursing, independent living, assisted living, memory care facilities, or rehabilitative services, we have the expertise...",2024-05-06 13:55:00,7465,Published
usherbrooke.ca,"L'Université de Sherbrooke offre plus de 400 programmes. Elle se distingue par des méthodes d'apprentissage pratiques, des thèmes porteurs propulsant ses unités de recherche, une stratégie forte d'innovation, de partenariat et d'entrepreneuriat, des...",2024-05-06 13:50:00,7915,Published
signiflow.com,"Signiflow is a digital signature & approval workflow system that neatly slots into any enterprise ecosystem, to deliver critical last-mile workflow efficiency. SigniFlow Advanced eSignature Document Workflow Software ensures total compliance with glo...",2024-05-06 13:48:00,7331,Published
syntax-architektur.at,Die Definition der Syntax (der Muster und Regeln) der projektspezifischen Rahmenbedingungen sehen wir als grundlegendes Ziel unserer Arbeit. Diese Definition führt zu optimalen formalen und strukturell organisierten Beziehungsprinzipien. Die Qualität...,2024-05-06 13:45:00,7514,Published
qstartlabs.com,"Software. Development. For. Startups. Begin your startup journey with QStart Labs—your dedicated tech team for web, mobile, and AI application development. Better than that we also blend cutting-edge technology with strategic insight, propelling your...",2024-05-06 13:44:00,7471,Published
netspectrum.ca,"Netspectrum offers Fibre, Cable, Wireless and DSL Internet services to communities in Northern Ontario. Learn about their packages, blog posts and customer service on their website.",2024-05-06 13:41:00,7456,Published
cdev.gc.ca,Budget 2024 announced the launch of the Indigenous Loan Guarantee Program to unlock access to capital for Indigenous communities and help remove historical barriers to Indigenous equity investment in natural resources and energy projects.,2024-05-06 13:37:00,7421,Published
isee.biz,"The IGEPv2 board is a low-power, fanless single-board computer based on the OMAP 3 series of ARM-compatible processors. It is developed and produced by Spanish corporation ISEE and is the second IGEP platform in the series. The IGEPv2 is open hardwar...",2024-05-06 13:32:00,7356,Published
epr-groupe.fr,"Le Groupe EPR, acteur majeur de la sécurité depuis 1994, se compose de diverses sociétés toutes spécialisées dans le domaine de la gestion du risque à destination de tous types de clients, et s'appuie sur plusieurs partenariats privilégiés pour offri...",2024-05-06 13:31:00,7632,Published
directradiology.com,"Founded in January 2012, Direct Radiology is a physician-owned and operated teleradiology practice comprising more than 115 radiologists working in close partnership with 390+ facilities across the country.",2024-05-06 13:30:00,7116,Published
cpashin.com,"David Shin & Co., CPA. For your valuable life. Menu. Home; Contact Us; Blog; 블로그; NPO Talk; App Download",2024-05-06 13:28:00,7565,Published
bpce.com,"We've engineered everything from African, Antarctic, and Australian penguin habitats to sustainable and resilient public safety buildings. When you choose to work with Bridgers & Paxton, you can be confident that we will steward your project from sta...",2024-05-06 13:23:00,7413,Published
aw-lawyers.com,"Amsellem-Weitz Law Firm :: Home. 1 2 3. Amsellem&Weitz offers its clients legal advice services as well as support in their real estate transactions and negotiations, representation during their civil, and commercial operations and defense of their r...",2024-05-06 13:06:00,7246,Published
arcus.pl,"1. Zapoznałem się z polityką prywatności.. 2. Wyrażam zgodę na przekazywanie informacji handlowych od Arcus S.A., z siedzibą przy ul. Kolejowej 5/7, 01-217 Warszawa, KRS 0000271167, NIP 526-03-08-803 oraz Spółek wchodzących w skład grupy kapitałowej...",2024-05-06 13:05:00,7472,Published
yucatan.gob.mx,"Conoce las noticias, programas, servicios y atractivos turísticos de Yucatán. Accede a la cuenta pública, el diario oficial, los pagos en línea y más información del gobierno estatal.",2024-05-06 13:01:00,7368,Published
hebeler.com,"Our talented team of electricians offers superior design, installation, and service for technology systems and their vital infrastructure, within the industrial, manufacturing, commercial, and institutional markets.",2024-05-06 12:59:00,7070,Published
getcloudapp.com,CloudApp is a cross-platform screen capture and screen recording desktop client that supports online storage and sharing. CloudApp full and partial screen recordings export to.mp4 format. Full or partial screen image captures export to either JPG or...,2024-05-06 12:56:00,7395,Published
parat-techology.com,"Working at PARAT should be a pleasure and give meaning to one's work life. We recognize that plastic technology is currently facing significant challenges, while at the same time, it can constitute the answer to the current sustainability issues. Tha...",2024-05-06 12:55:00,7164,Published
chuzefitness.com,"We aim to keep our perspective and our sense of humor at all times. After all, this isn't brain surgery. Check out Chuze on Facebook & Instagram. Chuze Fitness is a local gym featuring low prices and state of the art facilities & equipment. We welcom...",2024-05-06 12:15:00,6998,Published
geotechenv.com,Our global presence ensures that we stay ahead of the curve in this ever-evolving field. You can stay up-to-date on where we are by connecting with us online or subscribing to our mailing list. Geotech History. Contact Sales. Upcoming Dates. Contact...,2024-05-06 12:13:00,7084,Published
foxsemicon.com,"Fiti is one of the few vertically integrated semiconductor equipment manufacturers in the semiconductor industry, based on its precision machining and component manufacturing capabilities adopting advanced assembly, electrical & mechanical integratio...",2024-05-06 12:07:00,7397,Published
alfiras.com,"Al Firas General Contracting | 8,706 followers on LinkedIn. Neat Builder for a Neat Society | Established in 1988, Al Firas is a leading contracting company based in Abu Dhabi.",2024-05-06 11:58:00,7236,Published
irc.be,Hardware Services. IRC kan u een breed scala aan diensten bieden door onze hoge mate van ervaring en expertise op verschillende vlakken. Wij bieden een complete en kwalitatief hoogwaardige dienstverlening aan binnen een vertrouwelijke omgeving waar w...,2024-05-06 11:51:00,7388,Published
htcinc.com,Talk To Our Experts. Full Name*. Company*. Work Email ID*. Phone No*. How can we help you? All fields marked with * are mandatory. HTC Global Services provides IT and Business Process Services and Solutions that help businesses make digital change ha...,2024-05-06 11:50:00,7340,Published
svenskakyrkan.se,"Svenska kyrkan erbjuder gudstjänster, dop, vigsel, begravning, stöd och vägledning i kristen tro. Här kan du också läsa om Svenska kyrkans arbete för fred, rättvisa och hjälp i Sverige och världen.",2024-05-06 11:48:00,7901,Published
smbw.com.au,Scientific has an unrivalled commitment to quality customer service and impeccable prestige smash repair. It's this high standard that has seen this family business thrive since our humble beginnings in Sydney in 1969. The Scientific team is made up...,2024-05-06 11:37:00,7153,Published
denave.com,"Denave is a full-fledged B2B Telesales service provider enabling businesses to focus on higher- level tasks and achieving revenue results at affordable cost. Apart from the revenue achievements, Denave has provided us with insights on opportunity pro...",2024-05-06 11:31:00,7053,Published
tdt.aero,"Anasayfa - TD Team. World Class Aircraft Maintenance. TD Team aircraft line maintenance company was established in 2007. TD Team, successfully taking its place among the 100 fastest growing companies in Turkey, has the authorizations of SHT-145, OTAR...",2024-05-06 11:27:00,7424,Published
kras.hr,"Dani komunikacija 2024: Kraš je drugu godinu zaredom Oglašivač godine! 15. 04. 2024. Kraš se iz Rovinja vraća sa čak tri zlata i dva srebra - Frondi, Bajadera i Ki-Ki potvrdili su izvrsnost domaćeg konditorskog proizvođača. Više.",2024-05-06 11:23:00,7280,Published
eviivo.com,eviivo Login - The Original All-in-One Booking Suite Hello again! Sign in to your eviivo suite account to view you booking calendar.,2024-05-06 11:21:00,7162,Published
sunray.com,"Manage your lien and bond claim rights with confidence and avoid costly mistakes! Create free account. No credit card needed. SunRay is the most trusted construction documentation service! File your Mechanic's Lien, Bond Claim, Notice to Owner, Preli...",2024-05-06 11:18:00,7347,Published
sunnydesigns.com,"Sunny Designs Home offers a wide range of furniture and accessories for the dining, bar, game, entertainment, occasional, home office, bedroom and accent areas of the home. Browse their products by category, find a dealer near you, or contact them fo...",2024-05-06 11:02:00,7209,Published
ptow.com,"OB GYN Clinic in Roanoke VA | Physicians to Women | Obstetrics ... Physicians to Women, a division of MAWC, has specialized in obstetric and gynecologic care in Roanoke, Virginia since 1940. We serve patients in the Roanoke Valley, Salem, Vinton, Bo...",2024-05-06 11:01:00,7204,Published
peachtree-medical.com,"Peachtree Medical - Providing the ""Best Affordable Care"" Send an email to peachtree.medical.clinic@gmail.com or leave a message at 832 327 7700. We open at 7 am and our team will treat your request the quickest possible. You can also leave a message...",2024-05-06 10:57:00,7255,Published
atlanticeye.net,"Atlantic Eye Center - LASIK, Cataract Surgery in New Jersey (NJ) 207 Stone Harbor Blvd Cape May Court House, NJ 08210 (Get Directions) call: 609-465-1616 Optical: 609-465-0850",2024-05-06 10:54:00,7067,Published
central.k12.or.us,"Monmouth Elementary School is a company that operates in the Education industry. It employs 51-100 people and has $10M-$25M of revenue. The company is headquartered in Monmouth, Oregon.",2024-05-06 10:38:00,7005,Published
sbsofbak.com,"About SBS of Bakersfield, Inc. SBS of Bakersfield specializes in document-based technology solutions. SBS of Bakersfield helps companies improve document workflow, compliance, and copier/printer budgeting needs through creative solutions. SBS of B...",2024-04-30 14:10:00,12050,Published
ottlite.com,OttLite was founded in 1989 by Dr. John Nash Ott to bring the power of natural daylight indoors through his one-of-a-kind natural daylight bulb,2024-04-30 08:24:00,13690,Published
ch-cannes.fr,"Bus du cœur des femmes publié le 15/03/2024 [BUS DU CŒUR] ️ Les maladies cardio-vasculaires sont encore la première cause de mortalité chez les femmes en France, tuant chaque jour 200 Françaises, soit 75 000 femmes par an, soit l'équivalent de la pop...",2024-04-29 21:02:00,11680,Published
eurosko.com,"Eurosko, the largest shoe chain in Scandinavia, aims to provide the best possible shopping experience for its customers, especially children, with inspiring stores, knowledgeable staff and a wide range of products. For several generations, the family...",2024-04-29 21:00:00,17919,Published
dc.gov,"THE DATA WAS SOLD IN PRIVATE. WILL NOT BE PUBLISHED. 1st batch of data: https://mega.nz/folder/lyUHGAoC#g1Qwh-OSXI4hRJq4l0J-Sw A bad negotiator disappeared at the end of the deal, so we are starting to release huge amount of sensitive data....",2024-04-22 22:44:00,26818,Published
rehab.ie,"We don't think that it's a good idea to ignore privacy of your customers. For more than 70 years, the Rehab Group has been working to break down the barriers that prevent people with disabilities from living ordinary lives in their communities. Thro...",2024-04-19 20:33:00,27008,Published
craigwire.com,"Craig Wire Products Craig Wire Products was founded on December 7, 2007. The company was founded with the express purpose of providing the electrical industry with a reliable and consistent source of emergency and short run magnet wire. Craig W...",2024-04-17 13:51:00,18242,Published
tristatetruckandequip.com,"Very private data was stolen. Tri-State Truck & Equipment Tri-State Truck and Equipment, Inc. has aligned itself with a small but premium group of manufacturers in order to better serve its customer base with quality products, competitive servi...",2024-04-17 13:47:00,17934,Published
specialoilfield.com,"Special Oilfield Services Co LLC. (SOS) is a joint venture between Mohsin Haider Darwish LLC (www.mhdoman.com), one of the largest business housesin Oman and Al Mansoori Specialised Engineering (www.almansoori.biz/) of AbuDhabi, one of the largest na...",2024-04-16 04:23:00,17213,Published
oraclecms.com,"OracleCMS’s services encompass call centres in Adelaide, Perth, Brisbane, Melbourne, and Sydney. Regardless of where your business operates in Australia, our contact centre solutions are designed to keep you connected efficiently. Our growth as a lea...",2024-04-16 00:25:00,23193,Published
jeyesfluid.co.uk,"Jeyes Fluid is a brand of disinfectant fluid for external use only. It is predominantly used for removing bacteria, while gardeners have found it effective at cleaning paths, patios, greenhouses, driveways, and drains - particularly of moss. With cau...",2024-04-15 12:12:00,18731,Published
tmt-mc.jp,TMT Machinery the group of companies www.tmt-mc.jp www.cfc-design.co.jp http://www.kamitsu.co.jp/ was hacked and we stole a lot of drawings and data 300 gigabytes of confidential data customer data. Industrial Machinery & Equipment · Japan TMT MA...,2024-04-15 03:22:00,40396,Published
ndpaper.com,"Established in 1995 with headquarters in Dongguan City, Guangdong Province, Nine Dragons Paper (Holdings) Limited was listed on the Hong Kong Stock Popular Searches Nine Dragons Paper (Holdings) Ltd ND Paper ND Paper LLC ND Paper Inc Nine Drago...",2024-04-15 02:25:00,22859,Published
countryvillahealth.com,"https://mega.nz/folder/Nmc3ULQa#qAl9nX0jzgnd1ixbGNggcA Country Villa Service Corp., which does business as Country Villa Health Service, owns and operates about 50 skilled nursing and assisted living centers across California, with about half loca...",2024-04-13 17:57:00,18428,Published
wblight.com,"https://mega.nz/folder/BulV0LLK#z7j6tj0PCcqoe4Xkmd3Cbw With over 110 years under our belt, Wiedenbach Brown is one of the most established names in the lighting business. But we're also one of the most forward-thinking brands in the game. Our inno...",2024-04-13 17:40:00,23889,Published
dkpvlaw.com,"https://mega.nz/folder/t6FEhaTS#WtcbM08aDEU8k_HwdgkPSw Deeley King Pang & Van Etten, LLP was founded in 1985 by William Deeley and Dennis W. King on two key principles. The attorneys and staff at Deeley King Pang & Van Etten, LLP are committed...",2024-04-13 17:40:00,23253,Published
crinetics.com,"Crinetics is here for endocrine disease patients who are eager to find therapies that provide effective disease control and more simplicity in their lives. We have failed to reach an agreement with the Crinetics organization, given their unscrupul...",2024-04-11 04:13:00,39694,Published
anovahealth.com,"Anova Health is a company that offers a complete system of innovative health care technologies for the patient-centered integrative practitioner. It provides products, education, coaching and support for functional, biological, regenerative and energ...",2024-04-09 15:52:00,19664,Published
lavelle.com,"For over 100 years, Lavelle has taken a leading role as a United States rubber and plastics manufacturer. 665 Mchenry St Burlington, Wisconsin 53105, United States Employees: 201 - 500 revenue: $500M Kathryn Turke Vice President, Sales (OEM...",2024-04-08 21:13:00,20627,Published
earnesthealth.com,Welcome to Ernest Health. Ernest Health is a network of rehabilitation and long-term acute care hospitals. Ernest Health hospitals provide specialized medical and rehabilitative services to patients recovering from disabilities caused by injuries or...,2024-04-06 06:45:00,22003,Published
truehomes.com,Click the link in our bio to leave us a review⭐️ 📲 Ready to start the journey towards your dream home? Visit www.TrueHomes.com or give us a call at (704)-448-6458 today! 🏠 🎬The Karver at North District #2024Kickoff #TrueHomes #TrueHomesUSA #MoreL...,2024-04-05 17:53:00,20630,Published
worthenind.com,"At Worthen Industries, we manufacture specialty adhesives, coatings, coated products, and thermoplastic extrusion for dynamic markets. But we specialize in sustainable innovation—by applying technology, green chemistry, and customer-first approach to...",2024-03-31 12:22:00,31004,Published
sbmandco.com,"SBM & Co supplies clients with trusted advice on a wide range of accountancy and tax queries. We also provide support to businesses and individuals in a variety of specialist sectors, including art dealers, charities, manufacturers, retailers and who...",2024-03-31 12:21:00,30629,Published
krueth.de,"Ever since 1969, innovative technologies and the tradesmen’s skills have marked KRÜTH’s path toward modern surfacing of tools. EtchingEngraving, Laser-EtchingEngraving and 3D-LaserEngraving demonstrate the innovative drive and the success of a family...",2024-03-27 08:17:00,24366,Published
pcscivilinc.com,"PCS Civil, Inc. is a leader in Heavy Civil Construction services in Florida. Originally known as Pepper Contracting, PCS was incorporated on December 21, 1993 with the mission to set the bar higher for all roadway, utility, and concrete companies in...",2024-03-27 08:13:00,23742,Published
npgandour.com,Nouvelle Parfumerie Gandour is a company that operates in the Internet industry. It employs 101-250 people and has $25M-$50M of revenue.,2024-03-26 17:44:00,38996,Published
agribank.com.na,"Agricultural Bank of Namibia | 3,380 followers on LinkedIn. Your all Season Bank | Agribank is a State-Owned Enterprise with the mandate to promote the growth and development of agriculture through affordable and innovative financing. Agribank has be...",2024-03-26 16:44:00,26673,Published
regencymedia.com.au,"Founded in 1991, Five Mile has been a bedrock of relevant, accessible, and affordable content for children and their families in the Australian book industry. Sold by the founder in 2006, the business operated under Bonnier Publishing for over 10 ye...",2024-03-25 23:41:00,27372,Published
silganholdings.com,"Silgan Holdings is a Connecticut-based American manufacturing company that produces consumer goods packaging. The company was founded in 1987 by two former executives of Continental Can, Phil Silver and Greg Horrigan – their names contributing to the...",2024-03-25 23:23:00,33377,Published
northerncasket.com,"Northern Casket produced it' s first casket on February 2, 1927. Throughout more than 80 years of manufacturing, Northern has worked very hard to produce goods of superior quality of materials, construction and workmanship.",2024-03-21 14:05:00,29072,Published
pathologie-bochum.de,"Das im Institut für Pathologie bearbeitete Untersuchungsgut (Histologie, Zytologie, Molekularpathologie) wird uns von Ärzten aller Fachrichtungen übersandt. Über das Ergebnis der von uns durchgeführten Untersuchungen ergeht ein schriftlicher Befun...",2024-03-21 13:57:00,28871,Published
sunholdings.net,"RMH Franchise, founded in 2012 and headquartered in Atlanta, Georgia, operates as a franchisee of chain restaurants. The Company offers burgers, chicken, steaks, pasta, seafood, and beverages. We have 1.5tb sensitive data. Call me to tox Katie Hec...",2024-03-19 19:17:00,51880,Published
