cargotrinidad.com,"Logistics Management, Freight Forwarding, Air/Ocean Import and Export, Crating and Packing",2024-05-09 08:59:00,10658,Published,,NA
peninsulacrane.com,Peninsula Crane and Rigging serving entire Northern California and Nevada Area for over 39 years.,2024-05-09 08:50:00,10775,Published,,NA
vinatiorganics.com,"World’s largest manufacturer of IBB and ATBS, Vinati Organics Limited (VOL) blends innovation with chemistry to deliver value-added products to its varied clientele.",2024-05-09 08:49:00,9415,Published,,NA
orsiniimballaggi.com,"Manufacturing, Packaging Services, Self-Storage, Shipping",2024-05-09 08:48:00,9746,Published,,NA
grupopm.com,"Grupo PM is a Marketing agency.Together they gather more than 50 years of joint-experience in Marketing, Advertising, Sales, Promotion and above all planning and development of Market strategies, used to position our clients and their products in the...",2024-05-09 08:48:00,10097,Published,,NA
randi-group.com,"Randi Group, Natural Products Extracted from Grapes Values that bring us together as a group",2024-05-09 08:44:00,9061,Published,,NA
totto.com,Nalsani SAS is a company with nationally-focused eCommerce activity.,2024-05-09 08:41:00,9481,Published,,NA
salmonesaysen.cl,Salmones Aysén S.A. es una empresa Salmonera enfocada 100% en el cultivo y comercialización del Salmón del Pacífico,2024-05-09 08:39:00,8870,Published,,NA
ajcfood.com,"AJC Brands. Our brands mean business. AJC branded products are sold in 100+ countries. Together they total 400+ products. AJC International is a global leader in the procurement and sale of frozen meat, poultry, pork, seafood and vegetable products.",2024-05-08 18:07:00,7540,Published,20.2,| http://lockbit7z2jwcskxpbokpemdxmltipntwlkmidcll2qirbu7ykg46eyd.onion/secret/bc06fc46ab9bc93392c9ca38abac4f63-937b0995-9a24-3a2d-9d88-e449dfa2d3dc/ajcfood.com/ajcfood_com.zip-file-tree.txt
bancodevenezuela.com,"Conoce los productos y servicios que ofrece el Banco de Venezuela, como la cuenta digital, la cuenta en divisas, el mesa de cambio, el menudeo y el programa EmprendeBDV. Descarga la BDVApp y paga al instante con el QR.",2024-05-06 15:16:00,12761,Published,,NA
gammarenax.ch,gammaRenax ist ein leistungsfähiger Qualitätsanbieter integraler Facility Services mit mehr als 2'110 Mitarbeitenden an 16 Standorten in allen Regionen der Schweiz. Mit einem Portfolio von über 1'600 Objekten und einem Jahresumsatz von 81 Millionen F...,2024-05-06 15:12:00,9195,Published,,NA
oraclinical.com,"With 85+ approvals to date, whatever your challenge, we're here to ensure success. Discover how we make work better for our workforce. We provide the vision and experience to help guide your Ophthalmic product from preclinical stages through commerci...",2024-05-06 15:10:00,8963,Published,,NA
rammutual.com,"Your Partner in Protection. RAM is proud to be a leading reinsurer to the township mutual industry. In addition to our excellent member service program, RAM offers a full line of personal and commercial insurance products available in both Minnesota...",2024-05-06 15:09:00,8920,Published,,NA
gslelectric.com,Read about the Salt Lake City Airport Phase 2 Project in Utah,2024-05-06 15:08:00,8693,Published,,NA
harwoodlloyd.com,"Eileen Kuzma is Counsel in Harwood Lloyd's General Litigation and Wills, Trusts and Estates Departments, with a concentration in appellate matters, legal research and brief writing, encompassing a wide array of practice areas. Ms. Kuzma has extensive...",2024-05-06 15:07:00,8667,Published,,NA
etships.com,"For more information, please visit our recruiting profile on Facebook: Recruit Transport or call us today at (419) 464-9450 Ext. 4! www.etships.com. 1. Expeditus Transport, LLC | 872 followers on ...",2024-05-06 15:06:00,8703,Published,,NA
ville-bouchemaine.fr,"Prof express - Révisions Brevet/Bac Des enseignants de l'Éducation nationale, disponibles pour vos enfants, afin de réviser le Brevet ou le BAC et bénéficier de leurs conseils pour... Lire la suite; Réouverture de l'Aire d'Accueil de Camping-Car L'ai...",2024-05-06 15:04:00,9004,Published,,NA
sonoco.com,"Sonoco Products Company is an American provider of diversified consumer packaging, industrial products, protective packaging, and packaging supply chain services and the world's largest producer of composite cans, tubes, and cores.",2024-05-06 15:02:00,9019,Published,,NA
thebiglifegroup.com,"The Big Life group is a social enterprise that fights inequality by offering various services and support to people and places. Learn more about their values, history, people, news and how to find support near you.",2024-05-06 15:01:00,8446,Published,,NA
elarabygroup.com,"Wish ListAdd to Compare. HAMA High Speed HDMI™ Cable Plug-Plug Ethernet 90° Plug 1.5m Black HAM ... 5.0. EGP680. Add to Cart. Welcome to Elaraby Group in Egypt. Buy online Discover a wide range of home appliances and TVs of brands Toshiba, Sharp, Tor...",2024-05-06 14:59:00,9247,Published,,NA
qintess.com,Learn more about Qintess. We are focused on business transformation. We innovate. We think outside the box. We simplify technology and offer its best to our customers. Learn more about Qintess. PT | EN | ES +55 11 2899-6000 contact@qintess.com Área d...,2024-05-06 14:57:00,9084,Published,,NA
newsupri.com.br,"A Newsupri é uma empresa especialista em prover soluções inovadoras em infraestrutura de TI. São 35 anos de inovação e experiência, atendendo a Região Nordeste através de um time com mais de 30 profissionais altamente qualificados. Nossos parceiros p...",2024-05-06 14:54:00,8616,Published,,NA
senacrs.com.br,"O Senac-RS oferece cursos livres, técnicos, de graduação, pós-graduação, extensões, idiomas e ensino médio em 18 áreas do conhecimento. Veja depoimentos, descontos, parcerias, eventos, notícias e artigos sobre o Senac-RS.",2024-05-06 14:52:00,8561,Published,,NA
aev-iledefrance.fr,Agence des espaces verts d'Ile de France - Île-de-France Nature,2024-05-06 14:44:00,8606,Published,,NA
piramal.com,"Piramal Group is a leading Global Business Conglomerate with diverse interests in Pharma, Financial Services, Real Estate, and Glass Packaging; nurturing social initiatives through Piramal Foundation",2024-05-06 14:39:00,8129,Published,,NA
remagroup.com,"Company. REMA Group, with locations in Germany, China and the USA, is one of the international technological leaders in the field of high-current contact systems. We develop and produce connector systems for charging electric vehicles, high-current c...",2024-05-06 14:04:00,8068,Published,,NA
grand-indonesia.com,"Grand Indonesia is an integrated multipurpose complex at Thamrin Road in Central Jakarta, Indonesia. The 640,000 m² complex consists of a huge shopping mall, office tower Menara BCA, high end serviced residential tower Kempinski Residences and the fi...",2024-05-06 13:59:00,8011,Published,,NA
carespring.com,"At Carespring, we are committed to providing top-quality health care management services to our patients. Whether you need skilled nursing, independent living, assisted living, memory care facilities, or rehabilitative services, we have the expertise...",2024-05-06 13:55:00,8002,Published,,NA
usherbrooke.ca,"L'Université de Sherbrooke offre plus de 400 programmes. Elle se distingue par des méthodes d'apprentissage pratiques, des thèmes porteurs propulsant ses unités de recherche, une stratégie forte d'innovation, de partenariat et d'entrepreneuriat, des...",2024-05-06 13:50:00,8520,Published,,NA
signiflow.com,"Signiflow is a digital signature & approval workflow system that neatly slots into any enterprise ecosystem, to deliver critical last-mile workflow efficiency. SigniFlow Advanced eSignature Document Workflow Software ensures total compliance with glo...",2024-05-06 13:48:00,7892,Published,3.3,| http://lockbit7z2jwcskxpbokpemdxmltipntwlkmidcll2qirbu7ykg46eyd.onion/secret/95b3b3552ceed8b42b2404026eab44b7-be331853-c83a-3842-97b5-f06d3ebd7d06/signiflow.com/signiflow.com.7z-file-tree.txt
syntax-architektur.at,Die Definition der Syntax (der Muster und Regeln) der projektspezifischen Rahmenbedingungen sehen wir als grundlegendes Ziel unserer Arbeit. Diese Definition führt zu optimalen formalen und strukturell organisierten Beziehungsprinzipien. Die Qualität...,2024-05-06 13:45:00,8105,Published,,NA
qstartlabs.com,"Software. Development. For. Startups. Begin your startup journey with QStart Labs—your dedicated tech team for web, mobile, and AI application development. Better than that we also blend cutting-edge technology with strategic insight, propelling your...",2024-05-06 13:44:00,8029,Published,,NA
netspectrum.ca,"Netspectrum offers Fibre, Cable, Wireless and DSL Internet services to communities in Northern Ontario. Learn about their packages, blog posts and customer service on their website.",2024-05-06 13:41:00,8041,Published,,NA
cdev.gc.ca,Budget 2024 announced the launch of the Indigenous Loan Guarantee Program to unlock access to capital for Indigenous communities and help remove historical barriers to Indigenous equity investment in natural resources and energy projects.,2024-05-06 13:37:00,7970,Published,,NA
isee.biz,"The IGEPv2 board is a low-power, fanless single-board computer based on the OMAP 3 series of ARM-compatible processors. It is developed and produced by Spanish corporation ISEE and is the second IGEP platform in the series. The IGEPv2 is open hardwar...",2024-05-06 13:32:00,7908,Published,,NA
epr-groupe.fr,"Le Groupe EPR, acteur majeur de la sécurité depuis 1994, se compose de diverses sociétés toutes spécialisées dans le domaine de la gestion du risque à destination de tous types de clients, et s'appuie sur plusieurs partenariats privilégiés pour offri...",2024-05-06 13:31:00,8229,Published,,NA
directradiology.com,"Founded in January 2012, Direct Radiology is a physician-owned and operated teleradiology practice comprising more than 115 radiologists working in close partnership with 390+ facilities across the country.",2024-05-06 13:30:00,7674,Published,,NA
cpashin.com,"David Shin & Co., CPA. For your valuable life. Menu. Home; Contact Us; Blog; 블로그; NPO Talk; App Download",2024-05-06 13:28:00,8140,Published,,NA
bpce.com,"We've engineered everything from African, Antarctic, and Australian penguin habitats to sustainable and resilient public safety buildings. When you choose to work with Bridgers & Paxton, you can be confident that we will steward your project from sta...",2024-05-06 13:23:00,7996,Published,,NA
aw-lawyers.com,"Amsellem-Weitz Law Firm :: Home. 1 2 3. Amsellem&Weitz offers its clients legal advice services as well as support in their real estate transactions and negotiations, representation during their civil, and commercial operations and defense of their r...",2024-05-06 13:06:00,7800,Published,,NA
arcus.pl,"1. Zapoznałem się z polityką prywatności.. 2. Wyrażam zgodę na przekazywanie informacji handlowych od Arcus S.A., z siedzibą przy ul. Kolejowej 5/7, 01-217 Warszawa, KRS 0000271167, NIP 526-03-08-803 oraz Spółek wchodzących w skład grupy kapitałowej...",2024-05-06 13:05:00,8037,Published,,NA
yucatan.gob.mx,"Conoce las noticias, programas, servicios y atractivos turísticos de Yucatán. Accede a la cuenta pública, el diario oficial, los pagos en línea y más información del gobierno estatal.",2024-05-06 13:01:00,7957,Published,,NA
hebeler.com,"Our talented team of electricians offers superior design, installation, and service for technology systems and their vital infrastructure, within the industrial, manufacturing, commercial, and institutional markets.",2024-05-06 12:59:00,7641,Published,,NA
getcloudapp.com,CloudApp is a cross-platform screen capture and screen recording desktop client that supports online storage and sharing. CloudApp full and partial screen recordings export to.mp4 format. Full or partial screen image captures export to either JPG or...,2024-05-06 12:56:00,7984,Published,,NA
parat-techology.com,"Working at PARAT should be a pleasure and give meaning to one's work life. We recognize that plastic technology is currently facing significant challenges, while at the same time, it can constitute the answer to the current sustainability issues. Tha...",2024-05-06 12:55:00,7743,Published,,NA
chuzefitness.com,"We aim to keep our perspective and our sense of humor at all times. After all, this isn't brain surgery. Check out Chuze on Facebook & Instagram. Chuze Fitness is a local gym featuring low prices and state of the art facilities & equipment. We welcom...",2024-05-06 12:15:00,7577,Published,,NA
geotechenv.com,Our global presence ensures that we stay ahead of the curve in this ever-evolving field. You can stay up-to-date on where we are by connecting with us online or subscribing to our mailing list. Geotech History. Contact Sales. Upcoming Dates. Contact...,2024-05-06 12:13:00,7658,Published,,NA
foxsemicon.com,"Fiti is one of the few vertically integrated semiconductor equipment manufacturers in the semiconductor industry, based on its precision machining and component manufacturing capabilities adopting advanced assembly, electrical & mechanical integratio...",2024-05-06 12:07:00,7941,Published,,| http://lockbit7z2jwcskxpbokpemdxmltipntwlkmidcll2qirbu7ykg46eyd.onion/secret/5bf5af863fdfa92621a3bffaed6af2ef-5e186eac-cbb9-3a92-970d-3e6641faf1b8/usa-fiti.com/usa-fiti.com.7z-file-tree.txt
alfiras.com,"Al Firas General Contracting | 8,706 followers on LinkedIn. Neat Builder for a Neat Society | Established in 1988, Al Firas is a leading contracting company based in Abu Dhabi.",2024-05-06 11:58:00,7797,Published,0.09,| http://lockbit7z2jwcskxpbokpemdxmltipntwlkmidcll2qirbu7ykg46eyd.onion/secret/bf9e5eb901042d543540b289f7da1ec1-5e2ebcf6-8c7b-3a76-9140-33d3fa6597c8/alfiras.com/alfiras.com.7z-file-tree.txt
irc.be,Hardware Services. IRC kan u een breed scala aan diensten bieden door onze hoge mate van ervaring en expertise op verschillende vlakken. Wij bieden een complete en kwalitatief hoogwaardige dienstverlening aan binnen een vertrouwelijke omgeving waar w...,2024-05-06 11:51:00,7990,Published,,NA
htcinc.com,Talk To Our Experts. Full Name*. Company*. Work Email ID*. Phone No*. How can we help you? All fields marked with * are mandatory. HTC Global Services provides IT and Business Process Services and Solutions that help businesses make digital change ha...,2024-05-06 11:50:00,7925,Published,,NA
svenskakyrkan.se,"Svenska kyrkan erbjuder gudstjänster, dop, vigsel, begravning, stöd och vägledning i kristen tro. Här kan du också läsa om Svenska kyrkans arbete för fred, rättvisa och hjälp i Sverige och världen.",2024-05-06 11:48:00,8493,Published,336.33,| http://lockbit7z2jwcskxpbokpemdxmltipntwlkmidcll2qirbu7ykg46eyd.onion/secret/0273a9dafb2f7e95b1bd30db0bad9cc4-fdea0925-e400-3ceb-be39-342fc664db6e/svenskakyrkan.se/svenskakyrkan.7z-file-tree.txt
smbw.com.au,Scientific has an unrivalled commitment to quality customer service and impeccable prestige smash repair. It's this high standard that has seen this family business thrive since our humble beginnings in Sydney in 1969. The Scientific team is made up...,2024-05-06 11:37:00,7717,Published,21.0,| http://lockbit7z2jwcskxpbokpemdxmltipntwlkmidcll2qirbu7ykg46eyd.onion/secret/d4645ee1dc3cd02699f31b43830590de-cbf269fd-23ab-3855-a0f5-4da603a30571/smbw.com.au/smbw.com.au.7z-file-tree.txt
denave.com,"Denave is a full-fledged B2B Telesales service provider enabling businesses to focus on higher- level tasks and achieving revenue results at affordable cost. Apart from the revenue achievements, Denave has provided us with insights on opportunity pro...",2024-05-06 11:31:00,7620,Published,,NA
tdt.aero,"Anasayfa - TD Team. World Class Aircraft Maintenance. TD Team aircraft line maintenance company was established in 2007. TD Team, successfully taking its place among the 100 fastest growing companies in Turkey, has the authorizations of SHT-145, OTAR...",2024-05-06 11:27:00,8007,Published,,NA
kras.hr,"Dani komunikacija 2024: Kraš je drugu godinu zaredom Oglašivač godine! 15. 04. 2024. Kraš se iz Rovinja vraća sa čak tri zlata i dva srebra - Frondi, Bajadera i Ki-Ki potvrdili su izvrsnost domaćeg konditorskog proizvođača. Više.",2024-05-06 11:23:00,7860,Published,,NA
eviivo.com,eviivo Login - The Original All-in-One Booking Suite Hello again! Sign in to your eviivo suite account to view you booking calendar.,2024-05-06 11:21:00,7715,Published,,NA
sunray.com,"Manage your lien and bond claim rights with confidence and avoid costly mistakes! Create free account. No credit card needed. SunRay is the most trusted construction documentation service! File your Mechanic's Lien, Bond Claim, Notice to Owner, Preli...",2024-05-06 11:18:00,7928,Published,,NA
sunnydesigns.com,"Sunny Designs Home offers a wide range of furniture and accessories for the dining, bar, game, entertainment, occasional, home office, bedroom and accent areas of the home. Browse their products by category, find a dealer near you, or contact them fo...",2024-05-06 11:02:00,7797,Published,,NA
ptow.com,"OB GYN Clinic in Roanoke VA | Physicians to Women | Obstetrics ... Physicians to Women, a division of MAWC, has specialized in obstetric and gynecologic care in Roanoke, Virginia since 1940. We serve patients in the Roanoke Valley, Salem, Vinton, Bo...",2024-05-06 11:01:00,7751,Published,,NA
peachtree-medical.com,"Peachtree Medical - Providing the ""Best Affordable Care"" Send an email to peachtree.medical.clinic@gmail.com or leave a message at 832 327 7700. We open at 7 am and our team will treat your request the quickest possible. You can also leave a message...",2024-05-06 10:57:00,7810,Published,,NA
atlanticeye.net,"Atlantic Eye Center - LASIK, Cataract Surgery in New Jersey (NJ) 207 Stone Harbor Blvd Cape May Court House, NJ 08210 (Get Directions) call: 609-465-1616 Optical: 609-465-0850",2024-05-06 10:54:00,7648,Published,,NA
central.k12.or.us,"Monmouth Elementary School is a company that operates in the Education industry. It employs 51-100 people and has $10M-$25M of revenue. The company is headquartered in Monmouth, Oregon.",2024-05-06 10:38:00,7563,Published,223.42,| http://lockbit33chewwx25efq6dgkhkw4u7nefudq4ijkuamjfd7x73on6dyd.onion/secret/0e3cc2efb82d423a0e83fcc5a8e027aa-3e62aac4-8ece-31ff-8330-387585ee178e/central.k12.or.us/central.k12.or.us.7z-file-tree.txt
sbsofbak.com,"About SBS of Bakersfield, Inc. SBS of Bakersfield specializes in document-based technology solutions. SBS of Bakersfield helps companies improve document workflow, compliance, and copier/printer budgeting needs through creative solutions. SBS of B...",2024-04-30 14:10:00,12641,Published,,NA
ottlite.com,OttLite was founded in 1989 by Dr. John Nash Ott to bring the power of natural daylight indoors through his one-of-a-kind natural daylight bulb,2024-04-30 08:24:00,14338,Published,58.8,| http://lockbit33chewwx25efq6dgkhkw4u7nefudq4ijkuamjfd7x73on6dyd.onion/secret/14c4fdaf54b5d014c6e8c066d221ae48-fc37eca0-a818-3581-8a11-6b6044559cf4/ottlite.com/ottlite.com.7z-file-tree.txt
ch-cannes.fr,"Bus du cœur des femmes publié le 15/03/2024 [BUS DU CŒUR] ️ Les maladies cardio-vasculaires sont encore la première cause de mortalité chez les femmes en France, tuant chaque jour 200 Françaises, soit 75 000 femmes par an, soit l'équivalent de la pop...",2024-04-29 21:02:00,12275,Published,61.7,| http://lockbit33chewwx25efq6dgkhkw4u7nefudq4ijkuamjfd7x73on6dyd.onion/secret/17331453ba1ce7c981bc2e90a78daba5-daf2b218-6851-30f6-a621-454da5ea9ec2/ch-cannes.fr/ch-cannes.fr.tgz-file-tree.txt
eurosko.com,"Eurosko, the largest shoe chain in Scandinavia, aims to provide the best possible shopping experience for its customers, especially children, with inspiring stores, knowledgeable staff and a wide range of products. For several generations, the family...",2024-04-29 21:00:00,18424,Published,45.2,| http://lockbit33chewwx25efq6dgkhkw4u7nefudq4ijkuamjfd7x73on6dyd.onion/secret/5908f25548ac8fc6dadade6837078f1a-a326d463-c00c-372f-b188-c061439de8a7/eurosko.com/eurosko.com.7z-file-tree.txt
dc.gov,"THE DATA WAS SOLD IN PRIVATE. WILL NOT BE PUBLISHED. 1st batch of data: https://mega.nz/folder/lyUHGAoC#g1Qwh-OSXI4hRJq4l0J-Sw A bad negotiator disappeared at the end of the deal, so we are starting to release huge amount of sensitive data....",2024-04-22 22:44:00,27456,Published,,NA
rehab.ie,"We don't think that it's a good idea to ignore privacy of your customers. For more than 70 years, the Rehab Group has been working to break down the barriers that prevent people with disabilities from living ordinary lives in their communities. Thro...",2024-04-19 20:33:00,27659,Published,5.9,| http://lockbit33chewwx25efq6dgkhkw4u7nefudq4ijkuamjfd7x73on6dyd.onion/secret/919ccf78381f873bf6ea2faa197b6978-e9e1f0e6-1fe3-3534-ba89-6627d50fd1d1/rehub.ie/rehub.tgz-file-tree.txt
craigwire.com,"Craig Wire Products Craig Wire Products was founded on December 7, 2007. The company was founded with the express purpose of providing the electrical industry with a reliable and consistent source of emergency and short run magnet wire. Craig W...",2024-04-17 13:51:00,18814,Published,,NA
tristatetruckandequip.com,"Very private data was stolen. Tri-State Truck & Equipment Tri-State Truck and Equipment, Inc. has aligned itself with a small but premium group of manufacturers in order to better serve its customer base with quality products, competitive servi...",2024-04-17 13:47:00,18510,Published,,NA
specialoilfield.com,"Special Oilfield Services Co LLC. (SOS) is a joint venture between Mohsin Haider Darwish LLC (www.mhdoman.com), one of the largest business housesin Oman and Al Mansoori Specialised Engineering (www.almansoori.biz/) of AbuDhabi, one of the largest na...",2024-04-16 04:23:00,17758,Published,35.8,| http://lockbit33chewwx25efq6dgkhkw4u7nefudq4ijkuamjfd7x73on6dyd.onion/secret/cc60bc285f990d3b0d2d2581f9ff8d37-163f4baa-e240-3a3c-bcfc-ba11446921c7/specialoilfield.com/specialoilfield.com.7z-file-tree.txt
oraclecms.com,"OracleCMS’s services encompass call centres in Adelaide, Perth, Brisbane, Melbourne, and Sydney. Regardless of where your business operates in Australia, our contact centre solutions are designed to keep you connected efficiently. Our growth as a lea...",2024-04-16 00:25:00,23841,Published,66.61,| http://lockbit33chewwx25efq6dgkhkw4u7nefudq4ijkuamjfd7x73on6dyd.onion/secret/b1d53ed43c2a4e3532e5e5e0eb3d422c-24524fbd-7f58-3047-8b27-00a14d7c0e37/oraclecms.com/oraclecms.tgz-file-tree.txt
jeyesfluid.co.uk,"Jeyes Fluid is a brand of disinfectant fluid for external use only. It is predominantly used for removing bacteria, while gardeners have found it effective at cleaning paths, patios, greenhouses, driveways, and drains - particularly of moss. With cau...",2024-04-15 12:12:00,19278,Published,,NA
tmt-mc.jp,TMT Machinery the group of companies www.tmt-mc.jp www.cfc-design.co.jp http://www.kamitsu.co.jp/ was hacked and we stole a lot of drawings and data 300 gigabytes of confidential data customer data. Industrial Machinery & Equipment · Japan TMT MA...,2024-04-15 03:22:00,41051,Published,,NA
ndpaper.com,"Established in 1995 with headquarters in Dongguan City, Guangdong Province, Nine Dragons Paper (Holdings) Limited was listed on the Hong Kong Stock Popular Searches Nine Dragons Paper (Holdings) Ltd ND Paper ND Paper LLC ND Paper Inc Nine Drago...",2024-04-15 02:25:00,23455,Published,,NA
countryvillahealth.com,"https://mega.nz/folder/Nmc3ULQa#qAl9nX0jzgnd1ixbGNggcA Country Villa Service Corp., which does business as Country Villa Health Service, owns and operates about 50 skilled nursing and assisted living centers across California, with about half loca...",2024-04-13 17:57:00,18983,Published,,NA
wblight.com,"https://mega.nz/folder/BulV0LLK#z7j6tj0PCcqoe4Xkmd3Cbw With over 110 years under our belt, Wiedenbach Brown is one of the most established names in the lighting business. But we're also one of the most forward-thinking brands in the game. Our inno...",2024-04-13 17:40:00,24462,Published,,NA
dkpvlaw.com,"https://mega.nz/folder/t6FEhaTS#WtcbM08aDEU8k_HwdgkPSw Deeley King Pang & Van Etten, LLP was founded in 1985 by William Deeley and Dennis W. King on two key principles. The attorneys and staff at Deeley King Pang & Van Etten, LLP are committed...",2024-04-13 17:40:00,23823,Published,,NA
crinetics.com,"Crinetics is here for endocrine disease patients who are eager to find therapies that provide effective disease control and more simplicity in their lives. We have failed to reach an agreement with the Crinetics organization, given their unscrupul...",2024-04-11 04:13:00,40342,Published,,NA
anovahealth.com,"Anova Health is a company that offers a complete system of innovative health care technologies for the patient-centered integrative practitioner. It provides products, education, coaching and support for functional, biological, regenerative and energ...",2024-04-09 15:52:00,20238,Published,229.2,| http://lockbit33chewwx25efq6dgkhkw4u7nefudq4ijkuamjfd7x73on6dyd.onion/secret/00fae1baa150f82e1e2d4d70e3f9f313-debf9f60-13b9-34ff-83d2-91f07211008f/anovahealth.com/anovahealth.com.7z-file-tree.txt
lavelle.com,"For over 100 years, Lavelle has taken a leading role as a United States rubber and plastics manufacturer. 665 Mchenry St Burlington, Wisconsin 53105, United States Employees: 201 - 500 revenue: $500M Kathryn Turke Vice President, Sales (OEM...",2024-04-08 21:13:00,21198,Published,,NA
