Company,Company Description,Date Victimised,Number of Clicks,Status
clinicatezza.com.pe,"Clinica Tezza - Cuidamos al enfermo como una madre cuida a su único hijo enfermo. «Cuidamos al enfermo como una madre cuida a su único hijo enfermo.». La Congregación Hijas de San Camilo cumple su misión a nivel mundial. En Europa está en Italia, don...",2024-08-11 05:22:00,2755,Published
fremontschools.net,"Fremont Ross High School is a public high school in Fremont, Ohio, United States. It is the only high school in the Fremont City School District, and one of two high schools in Fremont, the other being Saint Joseph Central Catholic High School. The s...",2024-08-11 05:18:00,2671,Published
exol-lubricants.com,"since 1984. Exol Lubricants is the largest independent lubricants company in the UK, manufacturing and supplying a range of lubricants and associated products to industry, agriculture, transport, automotive and garage sectors. Exol Lubricants is comm...",2024-08-11 05:15:00,2594,Published
slpcolombus.com,Sunday 7-9pm Theme Kick-Off (TKO) Meeting 1 hour Discipleship Group Meeting 1 hour Tuesday 7-9pm Word & Prayer Training 1 hour Missional Training 1 hour Thursday 7-8pm Men's and Women's Time OR Campus Time 1 hour TKO's will be held via YouTube Livest...,2024-08-11 05:13:00,2691,Published
lesbureauxdelepargne.com,"Ces performances s'entendent dividendes réinvestis, nettes de frais de gestion du fonds, hors frais liés au contrat d'assurance vie ou de capitalisation (frais de souscription, frais sur versement, frais de gestion annuels ou frais d'arbitrage), hors...",2024-08-11 05:12:00,2590,Published
soprema.com,"SOPREMA has been developing and diversifying its activities by including, over the years, additional operations to its traditional trade. By becoming the world leader in waterprooﬁng solutions, the group is today a key player in the construction sect...",2024-08-11 05:09:00,2780,Published
polycab.com,"Polycab (Revenue in 2023 (TTM): $2.01 B) is engaged in the business of manufacturing and selling wires and cables and fast moving electrical goods ‘FMEG’ under the ‘POLYCAB’ brand. Apart from wires and cables, we manufacture and sell FMEG products su...",2024-08-11 05:07:00,37009,Published
allweatheraa.com,All Weather Architectural Aluminum offers extensive options of custom windows and doors to fit even the most creative of projects. We look forward to working with you. AWAA Doors & Windows - Explore our award-winning contemporary designs including sl...,2024-08-11 05:04:00,2601,Published
legacycpas.com,"Balancing Commitment & Experience. Legacy Professionals LLP is a unique niche-focused certified public accounting firm that balances a strong commitment to client success with decades of experience in serving employee benefit plans, labor organizatio...",2024-08-11 05:01:00,2635,Published
luisoliveras.com,Luis oliveras. Embutidos tradicionales del prepirineo. Sabor y tradición desde 1933. Descubre nuestra gama de embutidos.,2024-08-11 04:57:00,2724,Published
sierraconstruction.ca,"Sierra Construction is a general contracting firm located in Kenora, Ontario. We specialize in commercial, residential and industrial construction. 400 gb of our confidential data come here.▍",2024-08-11 04:47:00,20064,Published
ablinc.com,"ABL utilizes its strong core of product development expertise, GMP manufacturing and analytical testing capabilities toward advancing your candidate vaccines and therapeutics through preclinical and clinical development. ABL's experts are producing a...",2024-08-11 04:45:00,2565,Published
dmmerch.com,DM Merchandising is the best online wholesale marketplace for business owners looking for clothing & products that will sell. See how we can help today.,2024-08-11 04:21:00,2698,Published
sagaciousresearch.com,"Sagacious IP offers customized solutions to meet your individual needs. Based on our long-standing expertise, we strategically address your business challenges and propose novel solutions. Our consulting approach rather than a report-only tactic driv...",2024-08-11 04:19:00,2617,Published
kronospublic.com,"Kronos Corporate Group is a dynamic organization dedicated to innovation and portfolio diversification across multiple sectors. The journey began in 1986 by Pantelis Athinis, with the founding of Kronos Press Distribution Agency the first company in...",2024-08-10 11:42:00,2819,Published
dunaway.com,"Dunaway offers construction inspection, civil engineering, structural engineering, planning, landscape architecture and survey services. See their featured projects, news and insights, and career opportunities.",2024-08-04 13:21:00,4706,Published
kierlcpa.com,"Get In Touch. At T. Philip Kierl Jr. & Associates, CPA's, we've been serving the accounting needs of Oklahoma City, OK and the surrounding areas for years. If you need help managing any aspect of your home or business's finances, we want to hear from...",2024-08-04 11:53:00,4830,Published
alliedtelesis.com,"271GB https://mega.nz/folder/Znsj3QZI#fu7f5tXpy7CiRLv3mQf2ZQ On June 17, we will post data from all offices in Europe and Asia. and in another week we will start posting data about the company’s projects and partners such as https://www.marvell.com...",2024-08-01 20:28:00,25077,Published
at-global.com,"500+gb https://mega.nz/folder/4qdwVIKR#uMVVp4g0U7VjBAo7UCNT5w The company www.alliedtelesis.com had offices in America (3 offices), Europe, Asia, China, Singapore and so on. We hacked into their network and took data from this company www.at-globa...",2024-08-01 20:28:00,5327,Published
marvell.com,"500+gb https://mega.nz/folder/4qdwVIKR#uMVVp4g0U7VjBAo7UCNT5w The company www.alliedtelesis.com had offices in America (3 offices), Europe, Asia, China, Singapore and so on. We hacked into their network and took data from this company www.at-globa...",2024-08-01 20:28:00,6398,Published
qftemb.com,"This factory is owned by continental.com. Continental develops pioneering technologies and services for sustainable and connected mobility of people and their goods. Founded in 1871, the technology company offers safe, efficient, intelligent and affo...",2024-07-31 13:21:00,4864,Published
lavalpoincon.com,"Your partner in the production of metal parts since 1980. At LPM, we combine expertise, innovation, and commitment to transform your challenges into success. Our mission is to revolutionize the way you run your production, whether through the design...",2024-07-28 12:52:00,3959,Published
sirva.com,"Sirva Worldwide, Inc. provides HR and mobility professionals with the resources, guidance, and support they need to achieve the best possible relocation for talent, and for the companies that move them.",2024-07-28 12:45:00,42278,Published
kendrion.com,"Kendrion is a global company that provides innovative solutions for electrification, automation and mobility. It offers products and services for various markets, such as agricultural, aviation, building, energy, medical and railway.",2024-07-28 12:43:00,8261,Published
ccimp.com,"Préparation opérationnelle à l'emploi : des compétences sur un plateau ! Pour soutenir les entreprises en manque de profils adaptés sur certains postes, la CCI Aix-Marseille-Provence, via son entité CCI Formation, propose le dispositif de Préparation...",2024-07-28 12:42:00,8954,Published
juvaskin.com,"Reach out and set up an in-person consultation with an expert member of our cosmetic dermatological staff to learn more about what JUVA Skin & Laser Center can do for you! Schedule. For the best in dermatology, laser treatments, body contouring, and...",2024-07-28 12:31:00,3733,Published
eastern-sales.com,"East Hardware opened its doors in 1967, servicing the general public and heavy mining industry with quality products and excellent service. In 1999, Eastern Sales began its operations with the same level of commitment, serving the industrial markets...",2024-07-28 12:29:00,3770,Published
ciberviaxesespecial.net,981216600 info@ciberviaxes.net Ciberviaxes especial Viajes para ti ABANCA Espacio +60 Afundación Toscana ¡Clica y conoce las características de este fantástico viaje! Croacia ¡Clica y conoce las características de este fantástico viaje! País Vasco ¡C...,2024-07-28 12:28:00,3794,Published
agapefrance.org,"Aider chacun, là où il est, à découvrir, vivre et partager la foi en Jésus",2024-07-28 12:26:00,3753,Published
pbw-india.com,"HISTORY. Late Shri R. C. Patel, founder of Patel Brass Works was one of the first entrepreneurs to set up manufacturing facilities at Rajkot. Established in 1948 as a small foundry, PBW started its operations by producing castings for brass items. In...",2024-07-28 12:22:00,3636,Published
kvie.org,"KVIE is a PBS member television station in Sacramento, California, United States. The station is owned by KVIE, Inc., a community-based non-profit organization. KVIE's studios are located on West El Camino Avenue in the Natomas district of Sacramento...",2024-07-28 12:15:00,3543,Published
frilot.com,"Frilot LLC. Frilot LLC is a law firm located in New Orleans, Louisiana and offers full service representation in all areas of litigation on a local, regional and national basis. We act as business advisors and strategic partners for a wide range of p...",2024-07-28 12:10:00,3592,Published
kns.com,Full data leak 20 tb,2024-07-27 20:53:00,3186,Published
e21c.co.uk,"UPDATED!!! DATA!!! E21c - Business Information. Education · United Kingdom · 99 Employees. A message from our CEO: Education for the 21st Century is driven by a determination to create welcoming and open schools for the local community, where ever...",2024-07-26 21:35:00,6440,Published
petroassist.co.uk,"UPDATED!!! Very private and confident data! PETROTEC GROUP Billions private files from whole group servers. Tomorrow blog will updated. Equipped with 100% own technology, the Petrotec Group focuses on the distribution of Fuel Dispensers, Ca...",2024-07-26 21:30:00,3471,Published
olea.com,Olea Kiosks Resources for every step of the way. See Olea Kiosk designs in action and get a feel for self-service. Understand how self-service can be used to enhance productivity. Review our best practices to ensure your deployment is successful. Ole...,2024-07-26 17:39:00,8512,Published
cloudminds.com,"Cloudminds is a cloud intelligent robot operator. We provide professional robot operation services to clients from various industries and have launched service robot solutions such as welcoming robots using cloud intelligence, security patrol robots,...",2024-07-26 17:35:00,8609,Published
jdbchina.com,"JDB Group is a Chinese manufacturer of nonalcoholic beverages, headquartered in Dongguan, Guangdong province in the People's Republic of China. Its herbal tea products are among the most popular beverages in China, competing with brands like Pepsi an...",2024-07-26 17:33:00,8495,Published
hpo.pe,"HPO - HEAVEN PETROLEUM OPERATORS | 4440 seguidores en LinkedIn. Somos conocimiento, experiencia, calidad y resultados. | HPO",2024-07-26 17:31:00,2616,Published
nationaldentex.com,"Data part #4 SQL,DOC National Dentex is a full-service dental lab partner that offers a wide range of services, products and solutions for dentists and their patients. Whether you need crowns, bridges, veneers, implants or orthodontics, National Dent...",2024-07-26 17:29:00,2901,Published
richmont.edu,"Clinical Director of the Richmont Trauma Center and Assistant Professor. Licensed Professional Counselor, Approved Clinical Supervisor. Ph.D. Counselor Education & Supervision, Mercer University; M.A. Marriage & Family Therapy with certificates in Ch...",2024-07-26 16:37:00,2903,Published
aei.cc,"Acre-Feet of Pool Volume. I-Move KY I-265, I-64 & I-71 Design Build. Louisville, Jefferson, Kentucky. AEI was the lead design firm for a four-year, $180 million design-build construction project including improvements to I-265, I-64 and I-71 through...",2024-07-26 16:29:00,35791,Published
gitiusa.com,"Singapore-based Giti Tire Group, one of the largest tire companies in the world, has been in the tire business since 1951. Giti Tire operates eight manufacturing plants and produces a broad range of tire products, serving major original equipment veh...",2024-07-26 16:28:00,33163,Published
carsonteam.com,"Carson has been a Northwestern leader in energy & transportation solutions for over 85 years. Today, we operate heavily in Oregon, Washington, Idaho, and California. We keep growing by providing best-in-class service and drastically improving the sav...",2024-07-26 16:26:00,35493,Published
bkf-fleuren.de,Unser Familienunternehmen BKF A. Fleuren GmbH wurde im Jahr 1974/75 als Fensterbauunternehmen gegründet und zählt heute rund 100 Mitarbeiter. Auf einer Produktionsfläche von über 20.000 Quadratmetern produzieren wir modernste Kunststofffenster und -T...,2024-07-26 16:00:00,2847,Published
planethomelending.com,"Planet Home Lending offers home loans for purchase, refinance, cash-out, and renovation. See customer reviews, competitive rates, and career opportunities at Planet.",2024-07-26 15:55:00,8265,Published
bnpmedia.com,"Established in 1926, we are a fourth-generation, family-run media enterprise based in Birmingham, Michigan. BNP Media is the trusted choice of millions of B2B professionals globally, providing superior information through a diverse range of reliable...",2024-07-26 15:53:00,7452,Published
atcdi.com.cn,"The Kapari Water Supply Project, successfully implemented by ATCDI, brings clean water access to the remote Kapari Village in Abau District, Central Province.",2024-07-26 08:40:00,2747,Published
homelandvinyl.com,"Find all the information you need to know in our homeowners guide. Homeland Vinyl Products, Inc. creates a wide range of high quality residential and commercial vinyl products including vinyl fence, vinyl deck, vinyl railing, and specialty products.",2024-07-26 08:33:00,2765,Published
sandytownshippolice.org,"Sandy Township Police is proud to partner with and serve our distinct neighborhoods of Oklahoma, West Sandy, West Liberty, Kiwanis Park, Adrian, Iselin Heights, Singing Hills, Clear Run, Indian Hills, Sabula, and Treasure Lake. The Sandy Township Pol...",2024-07-26 08:29:00,2717,Published
glnf.fr,La Grande Loge nationale française est une obédience maçonnique française fondée en 1913 sous le nom de « Grande Loge nationale indépendante et régulière pour la France et ses colonies,2024-07-25 17:28:00,2289,Published
fbrlaw.com,"UPDATED!!! All business life of company available inside Quickbook files. Fusco, Brandenstein & Rada, P.C. Your Experienced Workers’ Compensation and Social Security Disability Attorneys Are you unable to work or has your income been impacte...",2024-07-24 18:15:00,5552,Published
tccfleet.com,"TCC’s history began in 1917 with, the founder of Tai Chong Hsiang Steamship Company, Mr. C.S. Koo’s establishment of Tai Chong Hsiang Customs Brokerage Company in 1917. Leaving behind a poverty-stricken childhood, Mr. C.S. Koo was determined to set o...",2024-07-22 15:46:00,7793,Published
kns.com,"Kulicke & Soffa Ticker NASDAQ: KLIC Founded in 1951 and headquartered in Singapore, Kulicke & Soffa is a semiconductor and electronics manufacturing company. ### In light of the unexpected termination of negotiations and the emergence of new...",2024-07-22 15:38:00,7087,Published
customssupport.be,"We are specialised in - Import, export, and transit - Goods Classification - Customs Consultancy",2024-07-18 16:18:00,4516,Published
barkingwell.gr,"Barking Well Media was founded by the Greek entrepreneur Nikos Koklonis, who was selected by Fortune magazine for its ""40 under 40"" list as one of the top entrepreneurs of 2015 in Greece under 40 years old.",2024-07-18 14:57:00,6914,Published
troyareasd.org,"The Troy Area School District is a school district of the third class organized under state law in Bradford County, PA. It contains the boroughs of Alba, Burlington, Sylvania and Troy, and the townships of Armenia, Burlington, Columbia, Granville, So...",2024-07-18 14:56:00,5043,Published
paysdelaloire.fr,"Regional aid and services foreconomy and innovation Industry, commerce, agriculture, fishing, food or research... I discover all the regional aid and services useful to my projects for my business, my farm or my organization.",2024-07-18 14:53:00,4586,Published
glsco.com,"We here at Great Lakes Supply eat, breathe, and sleep PTACs. We know them all, sell them all and stock them all. We proudly serve the hospitality, health care, assisted living, educational and multi-family housing industries, and enjoy having an...",2024-07-18 14:50:00,4578,Published
goldstarmetal.com,GOLDSTAR METAL is an aluminium manufacturing company committed to delivering high-quality standard parts that meet the needs of our customers across various industries.,2024-07-18 14:48:00,4260,Published
lothar-rapp.de,Drilling and blasting companies,2024-07-18 14:45:00,3244,Published
albonanova.at,Welcome to our 4 star superior hotel in Zürs on Arlberg. The perfect starting point for your winter holiday with wellness & gourmet restaurant.,2024-07-18 14:41:00,4401,Published
iteam.gr,Artificial intelligence (AI) is a broad and general term that refers to any type of computer software that engages in human like activities,2024-07-18 14:40:00,4389,Published
claycountyin.gov,"Clay County is a county located in the northeastern part of the U.S. state of Florida along the west bank of the St. Johns River. As of 2020, the population was 218,245 and in 2023, that number increased to 232,439, making it the third largest county...",2024-07-18 14:38:00,4144,Published
wattlerange.sa.gov.au,"Wattle Range Council is committed to the principle of honest, open and accountable government and encourages community participation in the business",2024-07-18 14:36:00,4288,Published
lockbit.newcontacts,"You can contact the LockBit boss on the contacts below, waiting for an answer can take some time from 1 minute to several days depending on the workload. With questions about decryption to write only in a chat on the site, if the person who encrypte...",2024-07-18 14:01:00,3097,Published
assih.com,"Alameda Healthcare is a corporate entity operating in the healthcare field aiming to lead the private health care sectors in Egypt, MENA Region, East Europe, and East Asia into new frontiers building on Alameda’s vast experience and reputation",2024-07-17 18:28:00,4030,Published
gptchb.org,"Established in 1986, the Great Plains Tribal Leaders' Health Board (GPTLHB) is an organization representing the 18 tribal communities in the four-state region of South Dakota, North Dakota, Nebraska, and Iowa. Through public health practices and...",2024-07-17 13:47:00,4610,Published
piedmonthoist.com,"Starting from scratch in 1993 with not much more than several good supplier relationships, Piedmont Hoist & Crane has grown from a small service firm doing inspections and repairs to an organization of over 30 employees with 200 years of combined...",2024-07-17 13:44:00,4463,Published
plantmachineworks.com,"Plant Machine Works is a 62,000-square-foot, full-service machine shop with turn-key machining and fabrication capabilities and large-scale machining for oversized components that many shops can’t handle. Our experienced repair shop specializes in...",2024-07-17 13:43:00,3865,Published
energateinc.com,Energate Inc. provides interactive energy management solutions that enable next-generation energy management and the connected home. Energate’s vertically integrated Consumer Connected Demand Response™ platform provides management two-way communicat...,2024-07-17 13:39:00,3920,Published
norton.k12.ma.us,"Norton High School is a company that employs 250to499 people and has 25Mto50M of revenue. The company is headquartered in Norton, Massachusetts.",2024-07-17 12:39:00,3979,Published
kbc-zagreb.hr,"KBC Zagreb is a company that operates in the Hospital & Health Care industry. It employs 2,001-5,000 people and has $500M-$1B of revenue. we have: Medical records, patient exams and studies; doctors' research papers; surgery, organ and donor data...",2024-07-17 07:54:00,5748,Published
fairfieldmemorial.org,"Fairfield Memorial Hospital is a fully accredited, not-for-profit critical access hospital. The hospital has 25 acute-care beds and a workforce of over 400 employees. The medical staff at Fairfield Memorial Hospital is comprised of over 90 creden...",2024-07-17 07:51:00,4658,Published
townandforest.co.uk,"ALL CLIENT CASES We are a dedicated team of experts who are passionate about providing the best possible service to our clients. With a diverse range of skills and expertise, we are dedicated to delivering high quality results and ensuring client...",2024-07-15 14:28:00,3353,Published
concorddirect.com,"FILES UPDATED!!! Your organization is a unique mix of moving parts, and increasing your ROI, optimizing your channels, and growing your audience requires careful coordination. We’re direct response experts who have been creating successful program...",2024-07-15 14:18:00,4602,Published
competenz.co.nz,"FILES UPDATED!!! Passports Agreements Confidential data We arrange training for apprenticeships and trainee-ships through on-the-job qualifications, supporting employers, job seekers and people with jobs in our industries. We have stolen a lot...",2024-07-15 14:15:00,3487,Published
latinusa.co.id,"FILES UPDATED! 5 Gb private files! Internal and external company audit documents, claims, budgets, analysis, finance private info, etc. PT Pelat Timah Nusantara Tbk (NIKL) atau Latinusa, didirikan pada tanggal 19 Agustus 1982 sebagai perusaha...",2024-07-15 13:52:00,2744,Published
nicholsfleet.com,Nichols Fleet Equipment has been building the best service trucks in the industry. About 2 TB of private information. Drawings and developments. Banking information and more,2024-07-14 05:37:00,1795,Published
ws-stahl.eu,"Passion for steel. Since 1919 Bright steel. Bar steel. Steel tubes. Pre-processing. Materials expertise. The Westfälische Stahlgesellschaft group of companies comprises trading companies in various regions of Germany and, with the Plettenberg drawi...",2024-07-04 09:55:00,4244,Published
merrymanhouse.org,"Merryman House Domestic Crisis Center is committed to improving the lives of those affected by domestic violence: women, men, and children. We are the state-designated and only certified domestic violence program in the Purchase Area Development...",2024-07-02 10:44:00,4065,Published
federalreserve.gov,Federal banking is the term for the way the Federal Reserve of the United States distributes its money. The Reserve operates twelve banking districts around the country which oversee money distribution within their respective districts. The twelve ci...,2024-06-23 20:28:00,1895253,Published
manncorp.com,"UPDATED Manncorp offers equipment, service, and financing solutions for PCB assembly. Learn how they can help you with worry-free selection, protection, setup, support, training, and diagnostics. Finance, all Quickbook data, HR, KeePass with al...",2024-06-14 13:51:00,6049,Published
ccmaui.org,The Community Clinic of Maui is a nonprofit healthcare organization that serves the community of Maui as Mālama I Ke Ola Health Center. We are a proud member of the national Community Health Center movement which was birthed by the civil rights movem...,2024-06-10 21:38:00,9455,Published
craigsteven.com,"Craig/Steven Development Corporation has earned a solid reputation in the development of shopping centers, office buildings, mixed-use developments, industrial and multi-family residential projects.",2024-06-05 18:02:00,2386288,Published
emainc.net,"Electronic Maintenance Associates (Electronic Maintenance Associates, Inc. (dba EMA) provides products, services, training, and more related to Medium Voltage Variable Frequency Drives. Celebrating our 33rd year, over 98% of our customers say they ar...",2024-06-05 07:34:00,11203,Published
smithandcaugheys.co.nz,"In 1880, showing great courage and enterprise for the time, Marianne Smith (nee Caughey) established her own drapers and millinery. With the vision of providing the early pioneers of Auckland and beyond with quality merchandise at good value and with...",2024-06-02 13:19:00,11641,Published
heras.co.uk,** UPDATED ** SCREENS AVAILABLE ** Heras is an European leading end-to-end supplier of permanent and mobile perimeter protection solutions. We operate in over 24 countries and employ more than 1100 highly skilled experts. Experts in perimeter p...,2024-06-02 13:05:00,15497,Published
cfymca.org,"Founded in 1885, the YMCA of Central Florida is a non-profit youth development. The Y provides kids, adults, families, and communities with support, programs, and classes such as aquatics and fitness. The YMCA of Central Florida is based in Orlando,...",2024-06-01 17:28:00,11747,Published
aytosanlorenzo.es,"450GB Data | Ayuntamiento San Lorenzo de El Escorial is a company that operates in the Government industry. It employs 2,001-5,000 people",2024-05-30 22:56:00,11872,Published
valleyjoist.com,"Screens was uploaded Valley Joist + Deck is a company that designs, engineers, and manufactures steel joist and deck product systems for commercial and industrial projects. It has over 60 years of experience, a family culture, and a commitment to...",2024-05-27 12:49:00,23203,Published
longviewoms.com,"Our mission is to help patients live healthier lives. We provide a caring, compassionate environment where your comfort and health is of primary importance.",2024-05-25 11:12:00,15298,Published
sysroad.com,SYSROAD is a leader in the field of integrating high value-added IT and telecoms solutions. It uses the power of technology to support business growth in the digital age. Our expertise in innovative technologies from manufacturers and publishers such...,2024-05-25 11:10:00,15337,Published
