CompanyName,Website,Country,Company Description,DateVictimised,NumViews (of threat),Status,RansomDataSize,Data Type,RansomDataType,RansomwareGroup
Utica Mack,www.uticamack.com, United States,New York's leading heavy duty truck dealerships.,2024-05-13,24470,Published,28.0,"Private and personal confidential data, clients documents, budget, payroll, accounting, contracts, taxes, IDs, finance information and etc. Compressed full dump.","['PII', 'Customer and Client Data', 'Financial Data']",Play
Affordable Payroll & Bookkeeping Services,www.apb-services.com, United States,"Affordable Payroll & Bookkeeping (APB) is group of Certified Public Accountants, Professional Accountants and Certified Bookkeepers having a combined experience of over decade. APB provides reliable and professional bookkeeping and payroll services to small and mid level business in New York and state of Massachusetts.",2024-05-13,24473,Published,29.0,"Private and personal confidential data, clients documents, budget, payroll, accounting, contracts, taxes, IDs, finance information and etc. Compressed full dump.","['PII', 'Customer and Client Data', 'Financial Data']",Play
Donco Air,www.raymon-hvac.com, United States,"Raymon-Donco manufactures air distribution equipment for the heating, ventilating and air conditioning industry. We produce a custom line of air diffusers used primarily in commercial buildings. Sales are made through our network of manufacturers' representatives in offices across the United States and Canada.",2024-05-13,24494,Published,29.0,"Private and personal confidential data, clients documents, budget, payroll, accounting, contracts, taxes, IDs, finance information and etc. Compressed full dump.","['PII', 'Customer and Client Data', 'Financial Data']",Play
Somerville,www.somervilleinc.com, United States,Somerville is a company that operates in the Architecture & Planning industry.,2024-05-13,24488,Published,151.0,"Private and personal confidential data, clients documents, budget, payroll, accounting, contracts, taxes, IDs, finance information and etc. Compressed full dump.","['PII', 'Customer and Client Data', 'Financial Data']",Play
Mauritzon,www.mauritzon.net, United States,"Spanning Three Centuries, and five generations of family ownership, Mauritzon, Inc. has proudly served hundreds of industries since 1888. The tradition remains strong because the ideals have remained the same... our customer is the most valuable asset we have",2024-05-14,24475,Published,12.0,"Private and personal confidential data, clients documents, budget, payroll, accounting, contracts, taxes, IDs, finance information and etc. Compressed full dump.","['PII', 'Customer and Client Data', 'Financial Data']",Play
High Performance Services,www.hpsllc.us, United States,We pride ourselves on being able to offer our clients the full range of telecommunication services. We are your project management team who focuseson the wireless telecommunication industry.,2024-05-14,24480,Published,192.0,"Private and personal confidential data, clients documents, budget, payroll, accounting, contracts, taxes, IDs, finance information and etc. Compressed full dump.","['PII', 'Customer and Client Data', 'Financial Data']",Play
Central Florida Equipment,www.centralcivil.com, United States,"Founded by James Baer in 1977, the family-owned and operated construction company has been involved in laying the foundation for some of South Florida's most notable projects.",2024-05-14,24427,Published,155.0,"Private and personal confidential data, clients documents, budget, payroll, accounting, contracts, taxes, IDs, finance information and etc. Compressed full dump.","['PII', 'Customer and Client Data', 'Financial Data']",Play
Stainless Foundry & Engineering,www.stainlessfoundry.com, United States,"Established in 1946 by John McBroom, & headquartered in Milwaukee, Wisconsin, Stainless Foundry & Engineering Inc. (SFE) is a well-established andhighly regarded manufacturer of raw and machined castings in both sand and investment.",2024-05-05,24923,Published,366.0,"Private and personal confidential data, clients documents, budget, payroll, accounting, contracts, taxes, IDs, finance information and etc. Compressed full dump.","['PII', 'Customer and Client Data', 'Financial Data']",Play
Profile Products,www.profileproducts.com, United States,"Based in Buffalo Grove, IL, PROFILE Products, LLC offers environmentally sound, site-specific solutions for soil modification, horticultural production, erosion control and plant establishment.",2024-05-03,25345,Published,95.0,"Private and personal confidential data, clients documents, budget, payroll, accounting, contracts, taxes, IDs, finance information and etc. Compressed full dump.","['PII', 'Customer and Client Data', 'Financial Data']",Play
Advanced Business Networks,www.netabn.com, United States,Advanced Business Networks is an IT consulting company specializing in providing IT support to small and mid-sized organizations across the Chicagoarea.,2024-05-03,25361,Published,304.0,"Private and personal confidential data, clients documents, budget, payroll, accounting, contracts, taxes, IDs, finance information and etc. Compressed full dump.","['PII', 'Customer and Client Data', 'Financial Data']",Play
Canatal Industries,www.canatal.net, United States,"Canatal fabricates and fully installs structural steel projects customized to your specifications and schedule; our goal is to exceed your expectations. In a market where fast-track construction projects are increasingly common, where efficiency is paramount and where delays mean a loss of profits, Canatal prides itself in being able to alter the workflow in ingenious and resourceful ways to meet deadlines.",2024-05-02,25118,Published,79.0,"Private and personal confidential data, clients documents, budget, payroll, accounting, contracts, taxes, IDs, finance information and etc. Compressed full dump.","['PII', 'Customer and Client Data', 'Financial Data']",Play
New Hudson Facades,www.newhudsonfacades.com, United States,"ncorporated in 2014, New Hudson Facades (NHF) is a custom architectural faade company specializing in the design, engineering, manufacturing, andinstallation of facades on world class buildings. NHF partners with leading architects and general contractors to provide innovative and challenging cladding solutions for some of the most architecturally significant projects being built today.",2024-05-01,25994,Published,586.0,"Private and personal confidential data, clients documents, budget, payroll, accounting, contracts, taxes, IDs, finance information and etc. Compressed full dump.","['PII', 'Customer and Client Data', 'Financial Data']",Play
Toolmarts,www.toolmarts.com, United States,"Toolmarts has been a factory direct distributor of power tools, woodworking equipment and shop machinery since 1986. Toolmarts is headquartered inEscondido, CA",2024-05-01,25971,Published,,"Private and personal confidential data, clients documents, budget, payroll, accounting, contracts, taxes, IDs, finance information and etc. For now part of the data have been published, If there no reaction full dump will be uploaded.","['PII', 'Customer and Client Data', 'Employee and HR data', 'Financial Data']",Play
Legislative Bill Drafting Commission,www.lbdc.state.ny.us, United States,Legislative Bill Drafting Commission is a company that operates in the Government industry.,2024-05-01,25899,Published,74.0,"Private and personal confidential data, clients documents, budget, payroll, accounting, contracts, taxes, IDs, finance information and etc. Compressed full dump.","['PII', 'Customer and Client Data', 'Financial Data']",Play
Yale Mortgage,www.yalemortgage.com, United States,"ale Mortgage offers mortgage loans to others. It provides information, protection from unauthorized access, verifies identity, andaccount services.",2024-05-02,25909,Published,87.0,"Private and personal confidential data, clients documents, budget, payroll, accounting, contracts, taxes, IDs, finance information and etc. Compressed full dump.","['PII', 'Customer and Client Data', 'Financial Data']",Play
Precision Fluid Controls,www.precisionfluidcontrols.com, United States,"Precision Fluid Controls, Inc. designs, manufactures and tests components for launch vehicles and ground support applications-providing many typesof valves including throttling valves, ball valves, check and relief valves, vent and relief valves, pressure reducing, both manual and dome loaded, regulators, sleeve valves, butterfly valves, solenoid valves plus many others.",2024-05-02,25924,Published,51.0,"Private and personal confidential data, clients documents, budget, payroll, accounting, contracts, taxes, IDs, finance information and etc. Compressed full dump.","['PII', 'Customer and Client Data', 'Financial Data']",Play
Original Herkimer Cheese,www.originalherkimercheese.com, United States,"We like to say that Original Herkimer Cheese® is Where Excellence Is a Tradition, and to us that's personal. We are a 3rd generation family ownedand operated business.",2024-05-02,25819,Published,27.0,"Private and personal confidential data, clients documents, budget, payroll, accounting, contracts, taxes, IDs, finance information and etc. Compressed full dump.","['PII', 'Customer and Client Data', 'Financial Data']",Play
Axip Energy Services,www.axip.com, United States,"Axip Energy Services is a provider of contract compression and production equipment, wellpad solutions, and treating facilities to the oil and gasindustry.",2024-05-02,25822,Published,129.0,"Private and personal confidential data, clients documents, budget, payroll, accounting, contracts, taxes, IDs, finance information and etc. Compressed full dump.","['PII', 'Customer and Client Data', 'Financial Data']",Play
Engineered Automation of Maine,www.eaminc.com, United States,"Engineered Automation of Maine, Inc. designs, manufactures, and services both standard and custom equipment for your unique needs and process.",2024-04-24,27474,Published,157.0,"Private and personal confidential data, clients documents, budget, payroll, accounting, contracts, taxes, IDs, finance information and etc. Compressed full dump.","['PII', 'Customer and Client Data', 'Financial Data']",Play
Pennsylvania Convention Center,www.paconvention.com, United States,"Established in 1950. The Philadelphia Convention & Visitors Bureau (PCVB), a private membership corporation, is the official Tourism Promotion Agency for the City of Philadelphia, and the primary sales and marketing agency for the Pennsylvania Convention Center.",2024-04-26,27291,Published,211.0,"Private and personal confidential data, clients documents, budget, payroll, accounting, contracts, taxes, IDs, finance information and etc. Compressed full dump.","['PII', 'Customer and Client Data', 'Financial Data']",Play
SIS Automatisering,www.sisautomatisering.nl, Netherlands,"The technically oriented SIS team complements our own specialists and is fully prepared to support COIN at any time. The fact that COIN has been able to count on Martin and his team for years, and that they provide optimal input when designing technical solutions for our customers, is very valuable to COIN.",2024-04-24,27246,Published,216.0,"Private and personal confidential data, clients documents, budget, payroll, accounting, contracts, taxes, IDs, finance information and etc. Compressed full dump.","['PII', 'Customer and Client Data', 'Financial Data']",Play
Alltruck Bodies,www.alltruckbodies.com.au, Australia,"Alltruck Bodies manufacture a range of rigid bodies, such as Curtainsiders, Colorbond vans, FRP vans, Trays, Insulated bodies, Freezer bodies and Light Weight bodies.",2024-04-24,27232,Published,365.0,"Private and personal confidential data, clients documents, budget, payroll, accounting, contracts, taxes, IDs, finance information and etc. Compressed full dump.","['PII', 'Customer and Client Data', 'Financial Data']",Play
JE Owens,www.jeowens.com, United States,JE Owens & Co is a company that operates in the Accounting industry.,2024-04-23,26996,Published,137.0,"Private and personal confidential data, clients documents, budget, payroll, accounting, contracts, taxes, IDs, finance information and etc. Compressed full dump.","['PII', 'Customer and Client Data', 'Financial Data']",Play
Heritage Cooperative,www.heritagecooperative.com, United States,"Founded in 2009, Heritage cooperative provides agricultural products and services to increases the quality of life in the rural communities. They are based in Delaware, Ohio.",2024-04-16,28507,Published,297.0,"Private and personal confidential data, clients documents, budget, payroll, accounting, contracts, taxes, IDs, finance information and etc. Compressed full dump.","['PII', 'Customer and Client Data', 'Financial Data']",Play
The MBTW Group,www.mbtw.com, Canada,"The MBTW Group is an award winning, multi-disciplinary landscape architecture, urban design and community planning firm located in Midtown Toronto. Our design studio, in business since 1975, has provided design consulting services to an international roster of clients in both private and public sectors",2024-04-16,28651,Published,251.0,"Private and personal confidential data, clients documents, budget, payroll, accounting, contracts, taxes, IDs, finance information and etc. Compressed full dump.","['PII', 'Customer and Client Data', 'Financial Data']",Play
LS Networks,www.lsnetworks.net, United States,"ounded in 2005, LS Networks serves business, government, healthcare, education and other enterprises with bandwidth and network connectivity. LS Networks is located in Portland, Oregon.",2024-04-16,28655,Published,408.0,"Private and personal confidential data, clients documents, budget, payroll, accounting, contracts, taxes, IDs, finance information and etc. Compressed full dump.","['PII', 'Customer and Client Data', 'Financial Data']",Play
New England Wooden Ware,www.newwpkg.com, United States,"Founded in 1834 as the E. Murdock Company in Winchendon, Massachusetts we were at one time the largest manufacturer of wooden products and containers in New England. We pride ourselves in over 180 years of craftsmanship and evolving technology.",2024-04-16,28551,Published,95.0,"Private and personal confidential data, clients documents, budget, payroll, accounting, contracts, taxes, IDs, finance information and etc. Compressed full dump.","['PII', 'Customer and Client Data', 'Financial Data']",Play
Access Intelligence,www.accessintel.com, United States,"Founded in 1977, Access Intelligence provides clients with business insights and integrated marketing solutions. Access Intelligence is headquartered in Rockville, Maryland.",2024-04-16,28570,Published,34.0,"Private and personal confidential data, clients documents, budget, payroll, accounting, contracts, taxes, IDs, finance information and etc. Compressed full dump.","['PII', 'Customer and Client Data', 'Financial Data']",Play
Theatrixx Technologies,www.theatrixx.com, Canada,"Theatrixx Technologies distributes and manufactures technical equipment to suit the needs of the performing arts industry.Theatrixx Technologies' product lines are carefully selected based on our rigorous criteria with regards to safety, reliability, sturdiness, quality of construction and manufacturers' solid reputation.",2024-04-16,28442,Published,65.0,"Private and personal confidential data, clients documents, budget, payroll, accounting, contracts, taxes, IDs, finance information and etc. Compressed full dump.","['PII', 'Customer and Client Data', 'Financial Data']",Play
MoldTech,www.moldtechrubber.com, United States,"Moldtech, Inc. is a leading North American developer and manufacturer of innovative custom rubber molded products.",2024-04-16,28357,Published,19.0,"Private and personal confidential data, clients documents, budget, payroll, accounting, contracts, taxes, IDs, finance information and etc. Compressed full dump.","['PII', 'Customer and Client Data', 'Financial Data']",Play
Feldstein & Stewart,www.feldsteinandstewart.com, United States,Feldstein & Stewart LLP provides accounting and tax services to clients in the New York & New Jersey Metropolitan Area.,2024-04-13,28394,Published,271.0,"Private and personal confidential data, clients documents, budget, payroll, accounting, contracts, taxes, IDs, finance information and etc. Compressed full dump.","['PII', 'Customer and Client Data', 'Financial Data']",Play
Everbrite,www.everbrite.com, United States,"Founded in 1927, Everbrite provides visual identification and LED lighting solutions to companies throughout the world. Headquartered in Greenfield, Wisconsin.",2024-04-10,29610,Published,63.0,"Private and personal confidential data, clients documents, budget, payroll, accounting, contracts, taxes, IDs, finance information and etc. Compressed full dump.","['PII', 'Customer and Client Data', 'Financial Data']",Play
Guy's Floor Service,www.guysfloor.com, United States,"Guys Floor Service, Inc. was launched by our founder, Guy Routzon, in 1942 from a modest home in downtown Denver. In those early days, Guy got hisstart refinishing hardwood floors in the barracks of the Lowry Air Force Base. Now with two design center locations, three divisions and a high volume fabrication facility, we are proud of our substantial growth and our reputation for excellence within the residential and commercial interior finishing industry.",2024-04-10,29627,Published,232.0,"Private and personal confidential data, clients documents, budget, payroll, accounting, contracts, taxes, IDs, finance information and etc. Compressed full dump.","['PII', 'Customer and Client Data', 'Financial Data']",Play
Sit,www.sitnsleep.com, United States,"Founded in 1978 and headquartered in Gardena, California, Sit 'n Sleep is a mattress company. The company has several locations where they sell their mattresses as well as other bedding accessories.",2024-04-10,29594,Published,192.0,"Private and personal confidential data, clients documents, budget, payroll, accounting, contracts, taxes, IDs, finance information and etc. Compressed full dump.","['PII', 'Customer and Client Data', 'Financial Data']",Play
Lambda Energy Resources,www.lambdaenergyllc.com, United States,"Lambda is the largest producer in Michigan by revenue and oil production volume. Our daily net production exceeds 6000 BOEPD. Lambda operates over850 active oil and gas wells in the Niagaran, Antrim, Richfield, and Prairie du Chien formations.",2024-04-02,31383,Published,550.0,"Private and personal confidential data, clients documents, budget, payroll, accounting, taxes, contracts, IDs, finance information and etc. Compressed full dump.","['PII', 'Customer and Client Data', 'Financial Data']",Play
Lawrence Semiconductor Research Laboratory,www.lsrl.com, United States,"Lawrence Semiconductor Research Laboratory, Inc. (LSRL) is a privately held corporation, founded in 1992. LSRL supplies custom epitaxial growth asa service for commercial organizations as well as for government and academic use.",2024-04-04,31343,Published,496.0,"Private and personal confidential data, clients documents, budget, payroll, accounting, taxes, contracts, a lot of technical documentation, IDs, finance information and etc. Compressed full dump.","['PII', 'Customer and Client Data', 'Financial Data']",Play
Quality Enclosures,www.qualityenclosures.com, United States,"Quality Enclosures, Inc. provides the highest quality shower enclosures and tempered glass with unmatched customer service. Consisting of multipletempering and manufacturing facilities, Quality Enclosures is a company devoted to growth across its market, its employees and the communities it services.",2024-04-02,31278,Published,23.0,"Private and personal confidential data, clients documents, budget, payroll, accounting, taxes, contracts, IDs, finance information and etc. Compressed full dump.","['PII', 'Customer and Client Data', 'Financial Data']",Play
Hartz,www.hartz.com, United States,Hartz is a manufacturer of pet care products with a 91 year history.,2024-04-02,31214,Published,655.0,"Private and personal confidential data, clients documents, budget, payroll, accounting, taxes, IDs, finance information and etc. Compressed full dump.","['PII', 'Customer and Client Data', 'Financial Data']",Play
Alber Law Group,www.alberlaw.com, United States,Alber Law Group is a Long Island based boutique law firm that provides legal services.,2024-04-02,31283,Published,195.0,"Private and personal confidential data, clients documents, budget, payroll, accounting, contracts, taxes, IDs, finance information and etc. Compressed full dump.","['PII', 'Customer and Client Data', 'Financial Data']",Play
Festspielhaus Baden-Baden,www.festspielhaus.de, Germany,The Festspielhaus Baden-Baden is Germany's largest opera house. Its acoustics are considered one of the best in the world.,2024-04-02,31285,Published,580.0,"Private and personal confidential data, clients documents, budget, payroll, accounting, contracts, taxes, IDs, finance information and etc. Compressed full dump.","['PII', 'Customer and Client Data', 'Financial Data']",Play
Weld Plus,www.weldplus.com, United States,Weld Plus has been serving the Cincinnati and Northern Kentucky and all through the Ohio Valley as well as International customers for over 20 years.,2024-04-02,31261,Published,,"Private and personal confidential data, clients documents, budget, payroll, accounting, contracts, taxes, IDs, finance information and etc. For now part of the data have been published, If there no reaction full dump will be uploaded.","['PII', 'Customer and Client Data', 'Employee and HR data', 'Financial Data']",Play
JM Thompson,www.jmthompson.com, United States,JM Thompson Co is a company that operates in the Construction industry.,2024-04-02,31253,Published,200.0,"Private and personal confidential data, clients documents, budget, payroll, accounting, contracts, taxes, IDs, finance information and etc. Compressed full dump.","['PII', 'Customer and Client Data', 'Financial Data']",Play
Tbr Kowalczyk,-, Poland,"Accounting, bookkeeping and auditing activities; tax consultancy",2024-04-02,31160,Published,48.0,"Private and personal confidential data, clients documents, budget, payroll, accounting, contracts, taxes, IDs, finance information and etc. Compressed full dump.","['PII', 'Customer and Client Data', 'Financial Data']",Play
Pavilion Construction,www.pavilionconstruction.com, United States,"At Pavilion Construction, we understand our growth has been fueled by repeat business with satisfied clients. We have emerged as an industry leaderthrough our focus on the client, establishing reputable contracting services at unparalleled standards.",2024-03-30,30943,Published,900.0,"Private and personal confidential data, clients documents, budget, payroll, accounting, contracts, taxes, IDs, finance information and etc. Compressed full dump.","['PII', 'Customer and Client Data', 'Financial Data']",Play
Boingo Graphics,www.boingographics.com, United States,"Boingo Graphics is committed to providing customers with a unique range of complete, scalable, and practical solutions that make sense. Whether youare shopping for graphic design, web sites, integrated direct mail campaigns, variable data printing, commercial printing, trade show graphics, wide format printing or fulfillment - Boingo Graphics has the solution for you.",2024-03-30,30871,Published,155.0,"Private and personal confidential data, clients documents, budget, payroll, accounting, contracts, taxes, IDs, a lot of technical information, projects, finance information and etc. Compressed full dump.","['PII', 'Customer and Client Data', 'Financial Data']",Play
Premier Technology,www.premiertechnology.net, United States,"Premier Technology: Home, Computer Networking, Computer Repair, Computer Sales, New Used, Consulting, Iowa; Cedar Rapids, Waterloo, Dubuque, Prairie du Chien, Davenport, Jesup, Monona, Fayette, Oelwein, Cascade.",2024-03-15,34236,Published,66.0,"Private and personal confidential data, clients documents, budget, payroll, taxes, IDs, finance information and etc. Compressed full dump.","['PII', 'Customer and Client Data', 'Financial Data']",Play
SREE Hotels,www.sree.com, United States,"SREE Hotels founded in 1980 and headquartered in Charlotte, North Carolina, is a hospitality management company providing fully integrated hotel development and management services throughout the Southeast and Midwest.",2024-03-14,34183,Published,64.0,"Private and personal confidential data, clients documents, budget, payroll, taxes, IDs, finance information and etc. Compressed full dump.","['PII', 'Customer and Client Data', 'Financial Data']",Play
Bridger Insurance,www.bridgerins.com, United States,"Bridger staff is intently focused to launch a new non-standard California auto insurance product by the end of 2017. Deep into the final quarter, the team is knee-deep implementing new operational procedures and systems to greatly improve agents' and policy holders' engagement with the new company.",2024-03-15,34142,Published,67.0,"Private and personal confidential data, clients documents, budget, clients DB, payroll, taxes, IDs, finance information and etc. Compressed full dump.","['PII', 'Databases', 'Customer and Client Data', 'Financial Data']",Play
