CompanyName,Website,Country,Company Description,DateVictimised,NumViews (of threat),Status,RansomDataSize,Data Type,RansomDataType,RansomwareGroup
Bunger Steel,www.bungersteel.com, United States,"Bunger Steel, Inc is a privately held corporation. Established 1974, since conception Bunger Steel, Inc. has been family owned and operated. Today, Bunger Steel is Arizona's largest steel building and components vendor and has over 40,000 projects constructed in the Southwest United States.",2024-06-26,18345,Published,131.0,"Private and personal confidential data, clients documents, budget, payroll, accounting, contracts, taxes, IDs, finance information and etc. Compressed full dump.","['PII', 'Customer and Client Data', 'Financial Data']",Play
World inquest,www.inquesttechnologies.com, United Kingdom,World inquest Ltd is a company that operates in the Computer Software industry.,2024-06-28,18382,Published,35.0,"Private and personal confidential data, clients documents, budget, payroll, accounting, contracts, taxes, IDs, finance information and etc. Compressed full dump.","['PII', 'Customer and Client Data', 'Financial Data']",Play
Hedrick Brothers Construction,www.hedrickbrothers.com, United States,"Hedrick Brothers Construction provides pre-construction, general contracting, construction management, and design-build services for luxury residen tial, commercial, municipal, industrial, and educational markets.",2024-06-28,18390,Published,296.0,"Private and personal confidential data, clients documents, budget, payroll, accounting, contracts, taxes, IDs, finance information and etc. Compressed full dump.","['PII', 'Customer and Client Data', 'Financial Data']",Play
Belle Tire,www.belletire.com, United States,"Belle Tire is an American tire, wheel and automotive service retailer.The company is headquartered in Allen Park, Michigan and was founded in 1922.",2024-06-28,18321,Published,549.0,"Private and personal confidential data, clients documents, budget, payroll, accounting, contracts, taxes, IDs, finance information and etc. Compressed full dump.","['PII', 'Customer and Client Data', 'Financial Data']",Play
Harvey Construction,www.harveyconst.com, United States,Harvey Construction Co Inc is a company that operates in the Construction industry.,2024-06-28,18328,Published,10.0,"Private and personal confidential data, clients documents, budget, payroll, accounting, contracts, taxes, IDs, finance information and etc. Compressed full dump.","['PII', 'Customer and Client Data', 'Financial Data']",Play
TPI,www.tpicorp.com, United States,"TPI Corporation is a U.S. based privately held manufacturer that offers heaters, fans, lights, controls, and process heat. The company is currently headquartered in Johnson City, TN.",2024-06-28,18315,Published,839.0,"Private and personal confidential data, clients documents, budget, payroll, accounting, contracts, taxes, IDs, finance information and etc. Compressed full dump.","['PII', 'Customer and Client Data', 'Financial Data']",Play
Shinnick & Ryan,www.srfirms.com, United States,The attorneys and staff at Shinnick & Ryan LLP have dedicated their careers to resolution of construction and design deficiency cases on behalf ofhomeowners.,2024-06-18,20444,Published,632.0,"Private and personal confidential data, clients documents, budget, payroll, accounting, contracts, taxes, IDs, finance information and etc. Compressed full dump.","['PII', 'Customer and Client Data', 'Financial Data']",Play
Chroma Color,www.chromacolors.com, United States,Chroma Color Corporation is a specialty color and additive concentrate supplier serving the global plastics marketplace.,2024-06-18,20452,Published,168.0,"Private and personal confidential data, clients documents, budget, payroll, accounting, contracts, taxes, IDs, finance information and etc. Compressed full dump.","['PII', 'Customer and Client Data', 'Financial Data']",Play
Peterbilt of Atlanta,www.peteatlanta.com, United States,Chroma Color Corporation is a specialty color and additive concentrate supplier serving the global plastics marketplace.,2024-06-18,20375,Published,99.0,"Private and personal confidential data, clients documents, budget, payroll, accounting, contracts, taxes, IDs, finance information and etc. Compressed full dump.","['PII', 'Customer and Client Data', 'Financial Data']",Play
Great Lakes International Trading,www.glit.com, United States,"Great Lakes International Trading first opened its doors in Traverse City, Michigan, as a full service import & export company specializing in processed fruits, edible seeds, and shell nuts.",2024-06-18,20121,Published,15.0,"Private and personal confidential data, clients documents, budget, payroll, accounting, contracts, taxes, IDs, finance information and etc. Compressed full dump.","['PII', 'Customer and Client Data', 'Financial Data']",Play
Eagle Materials,www.eaglematerials.com, United States,"Eagle Materials manufacturers, distributes, and sells gypsum wallboard, cement, recycled paperboard, and concrete and aggregates.",2024-06-16,20071,Published,384.0,"Private and personal confidential data, clients documents, budget, payroll, accounting, contracts, taxes, IDs, finance information and etc. Compressed full dump.","['PII', 'Customer and Client Data', 'Financial Data']",Play
Brainworks Software,www.brainworks.com, United States,"Software Development, Software General, Media and Entertainment, Application Software, Software, Social Media, Business Productivity Software, Internet Services",2024-06-18,20067,Published,48.0,"Private and personal confidential data, clients documents, budget, payroll, accounting, contracts, taxes, IDs, finance information and etc. Compressed full dump.","['PII', 'Customer and Client Data', 'Financial Data']",Play
3GL Technology Solutions,www.3gl.ca, Canada,"3GL still provides all the services, preventative maintenance, hosting, and disaster recovery that you would expect from an elite technology company.",2024-06-18,20045,Published,265.0,"Private and personal confidential data, clients documents, budget, payroll, accounting, contracts, taxes, IDs, finance information and etc. Compressed full dump.","['PII', 'Customer and Client Data', 'Financial Data']",Play
Goodman Reichwald-Dodge,www.freightbillauditor.com, United States,Goodman Reichwald-Dodge Inc is a company that operates in the Logistics and Supply Chain industry.,2024-06-19,20079,Published,7.0,"Private and personal confidential data, clients documents, budget, payroll, accounting, contracts, taxes, IDs, finance information and etc. Compressed full dump.","['PII', 'Customer and Client Data', 'Financial Data']",Play
Western Mechanical,www.westmech-hvac.com, United States,"Western Mechanical, Inc. is proud of their service to the residential community. Not only do we do new construction, but we provide 24 hour emergency service and support thorughout our service area.",2024-06-19,20074,Published,11.0,"Private and personal confidential data, clients documents, budget, payroll, accounting, contracts, taxes, IDs, finance information and etc. Compressed full dump.","['PII', 'Customer and Client Data', 'Financial Data']",Play
Seagulf Marine Industries,www.seagulf.com, Canada,Seagulf is the authorized distributor for Castrol Marine in Eastern Canada. We keep a wide range of products in inventory.,2024-06-19,20043,Published,65.0,"Private and personal confidential data, clients documents, budget, payroll, accounting, contracts, taxes, IDs, finance information and etc. Compressed full dump.","['PII', 'Customer and Client Data', 'Financial Data']",Play
Kinter,www.kinter.com, United States,"Kinter is a distributor of quality metal and plastic fasteners, hanging hardware & accessories, display components and more.",2024-06-17,19660,Published,215.0,"Private and personal confidential data, clients documents, budget, payroll, accounting, contracts, taxes, IDs, finance information and etc. Compressed full dump.","['PII', 'Customer and Client Data', 'Financial Data']",Play
Corbin Turf & Ornamental Supply,www.corbinturf.com, United States,"Corbin Turf & Ornamental Supply, Inc. is a leading turf and ornamental distributor in the Southeast headquartered in Greenville, SC. Known for developing close relationships with both customers and vendors, our company provides professional fertilizers, fungicides, herbicides, insecticides, seed, and accessories to a variety of industries.",2024-06-17,19486,Published,161.0,"Private and personal confidential data, clients documents, budget, payroll, accounting, contracts, taxes, IDs, finance information and etc. Compressed full dump.","['PII', 'Customer and Client Data', 'Financial Data']",Play
Air Cleaning Specialists,www.aircleaningspecialists.com, United States,"For over 40 years, Air Cleaning Specialists, Inc., has been providing indoor air quality solutions for industrial and commercial applications. We began in 1979 by selling and servicing Smokeeters for tobacco applications and have since grown exponentially into an internet marketing company with solid US distribution capabilities.",2024-06-17,19484,Published,249.0,"Private and personal confidential data, clients documents, budget, payroll, accounting, contracts, taxes, IDs, finance information and etc. Compressed full dump.","['PII', 'Customer and Client Data', 'Financial Data']",Play
Diverse Technology Industrial,www.dtindustrialflooring.com, United States,"Diverse Technology Industrial specializes in quality concrete solutions for all your exterior challenges. Flooring systems can be used for a variety of applications to achieve specific performance criteria, an aesthetic appearance or a combination of both.",2024-06-17,19429,Published,319.0,"Private and personal confidential data, clients documents, budget, payroll, accounting, contracts, taxes, IDs, finance information and etc. Compressed full dump.","['PII', 'Customer and Client Data', 'Financial Data']",Play
City Builders,www.citybuilders.com, United States,City Builders offers an array of high quality products for your home that we truly believe are the best in the industry.,2024-06-17,19416,Published,18.0,"Private and personal confidential data, clients documents, budget, payroll, accounting, contracts, taxes, IDs, finance information and etc. Compressed full dump.","['PII', 'Customer and Client Data', 'Financial Data']",Play
Refcio & Associates,www.rrlaw.ca, Canada,"Robinson & Refcio is a local London law firm that focuses on providing quality, cost-effective legal services to small and medium size businesses in the London area and throughout the Province.",2024-06-17,19367,Published,123.0,"Private and personal confidential data, clients documents, budget, payroll, accounting, contracts, taxes, IDs, finance information and etc. Compressed full dump.","['PII', 'Customer and Client Data', 'Financial Data']",Play
Aldenhoven,www.aldenhoven.nl, Netherlands,Aldenhoven Interieurwerken makes custom furniture and complete interiors.,2024-06-17,19434,Published,61.0,"Private and personal confidential data, clients documents, budget, payroll, accounting, contracts, taxes, IDs, finance information and etc. Compressed full dump.","['PII', 'Customer and Client Data', 'Financial Data']",Play
Amarilla Gas,www.amarillagas.com, Argentina,"Amarilla Gas is a company with national capital, in continuous expansion of its Liquefied Petroleum Gas (LPG) marketing systems.",2024-06-17,19341,Published,250.0,"Private and personal confidential data, clients documents, budget, payroll, accounting, contracts, taxes, IDs, finance information and etc. Compressed full dump.","['PII', 'Customer and Client Data', 'Financial Data']",Play
Ab Monsteras Metall,www.monsterasmetall.se, Sweden,Ab Monsteras Metall is a company that operates in the Wholesale industry.,2024-06-17,19332,Published,29.0,"Private and personal confidential data, clients documents, budget, payroll, accounting, contracts, taxes, IDs, finance information and etc. Compressed full dump.","['PII', 'Customer and Client Data', 'Financial Data']",Play
Me Too Shoes,www.metooshoes.com, United States,"For nearly 20 years, ...me Too has stood out in the industry by fulfilling a tall order: shoes that are stylish, comfortable and high quality.",2024-06-17,19367,Published,249.0,"Private and personal confidential data, clients documents, budget, payroll, accounting, contracts, taxes, IDs, finance information and etc. Compressed full dump.","['PII', 'Customer and Client Data', 'Financial Data']",Play
Celluphone,www.celluphone.com, United States,"Celluphone, Inc. is engaged in the wholesale distribution of wireless equipment. It offers smartphones, feature phones, Internet devices, and accessories; online tools for large retail chains; and personal support services.",2024-06-17,19387,Published,93.0,"Private and personal confidential data, clients documents, budget, payroll, accounting, contracts, taxes, IDs, finance information and etc. Compressed full dump.","['PII', 'Customer and Client Data', 'Financial Data']",Play
Walder Wyss and Partners,www.wwp.ch,  Switzerland,Walder Wyss and Partners is a company that operates in the Legal Services industry.,2024-06-17,19428,Published,46.0,"Private and personal confidential data, clients documents, budget, payroll, accounting, contracts, taxes, IDs, finance information and etc. Compressed full dump.","['PII', 'Customer and Client Data', 'Financial Data']",Play
Ntv,www.ntv.ca, Canada,"NTV is headquartered in St. John's, Newfoundland and Labrador, Canada, the easternmost tip of North America. NTV is independently owned and operated and is broadcast in HD.",2024-06-02,22001,Published,48.0,"Private and personal confidential data, clients documents, budget, payroll, accounting, contracts, taxes, IDs, finance information and etc. Compressed full dump.","['PII', 'Customer and Client Data', 'Financial Data']",Play
WALSER AUTOMOTIVE GROUP,www.walser.com, United States,"Walser Automotive Group has been family-owned and operated in Minnesota for over 65 years, where we pioneered our ‘Best Price First’ philosophy; we offer the lowest price we can on every vehicle from the start, no hassle or haggle required.",2024-06-02,21959,Published,469.0,"Private and personal confidential data, clients documents, budget, payroll, accounting, contracts, taxes, IDs, finance information and etc. Compressed full dump.","['PII', 'Customer and Client Data', 'Financial Data']",Play
Elmhurst Group,www.elmhurstgroup.com, United States,"The Elmhurst Group of companies is a 45-year-old Pittsburgh-based organization that invests in commercial real estate and the hospitality industry. Elmhurst’s real estate holdings include 40 buildings on 21 sites, totaling more than three million square feet of office, distribution, flex, and hotel space. Elmhurst’s long-term strategy is to continually increase the value of each of its properties by providing strong and dedicated management and exceptional customer service.",2024-06-02,21893,Published,79.0,"Private and personal confidential data, clients documents, budget, payroll, accounting, contracts, taxes, IDs, finance information and etc. Compressed full dump.","['PII', 'Customer and Client Data', 'Financial Data']",Play
FPL Food,www.fplfood.com, United States,"Founded in 2004 and headquartered in Augusta, Georgia, FPL Food, LLC produces and processes beef products. The Company offers beef tenderloin, ribeye, striploin, brisket, boneless shank, cube steak, and sliced knuckle products.",2024-06-11,21960,Published,,"Private and personal confidential data, clients documents, budget, payroll, accounting, contracts, taxes, IDs, finance information and etc. For now part of the data have been published, If there no reaction full dump will be uploaded.","['PII', 'Customer and Client Data', 'Employee and HR data', 'Financial Data']",Play
Credit Central,www.creditcentralllc.com, United States,"Credit Central provides installment loans to qualified Alabama, Georgia, South Carolina, Tennessee, and Texas residents. We also offer free tax preparation, filing, and options for advance tax refund loans.",2024-06-01,21869,Published,,"Private and personal confidential data, clients documents, budget, payroll, accounting, contracts, taxes, IDs, finance information and etc. For now part of the data have been published, If there no reaction full dump will be uploaded.","['PII', 'Customer and Client Data', 'Employee and HR data', 'Financial Data']",Play
Levin Porter Associates,www.levin-porter.com, United States,"Levin Porter Associates Inc. was founded in Dayton, Ohio in 1960. The services of Levin Porter Associates Inc, with its consultants, includes planning, programming, architecture, interior design, cost estimating, engineering and specialized technologies required for a complete project. For over 50 years,",2024-05-29,23135,Published,27.0,"Private and personal confidential data, clients documents, budget, payroll, accounting, contracts, taxes, IDs, finance information and etc. Compressed full dump.","['PII', 'Customer and Client Data', 'Financial Data']",Play
Semicore Equipment,www.semicore.com, United States,"Semicore is a manufacturer and worldwide supplier of PVD or Physical Vapor Deposition equipment and thermal evaporation systems for the electronics, academics, optical, solar energy and etc.",2024-05-29,23041,Published,21.0,"Private and personal confidential data, clients documents, budget, payroll, accounting, contracts, taxes, IDs, finance information and etc. Compressed full dump.","['PII', 'Customer and Client Data', 'Financial Data']",Play
Visa Lighting,www.visalighting.com, United States,"Visa Lighting's mission is to forge bold, exceptional experiences through progression and creative collaboration.",2024-05-28,23077,Published,127.0,"Private and personal confidential data, clients documents, budget, payroll, accounting, contracts, taxes, IDs, finance information and etc. Compressed full dump.","['PII', 'Customer and Client Data', 'Financial Data']",Play
Ardenbrook,www.ardenbrook.com, United States,"Ardenbrook, Inc. is one of the San Francisco Bay Area's largest real estate investment companies. The company has over 90 years of combined operational experience and owns or operates numerous properties including office and industrial buildings, shopping centers and apartment complexes. Holdings are in five Western States but primarily in the East Bay.",2024-05-28,22979,Published,17.0,"Private and personal confidential data, clients documents, budget, payroll, accounting, contracts, taxes, IDs, finance information and etc. Compressed full dump.","['PII', 'Customer and Client Data', 'Financial Data']",Play
RDI-USA,www.rdiglobalhospitality.com, United States,"RDI-USA, Inc. was established in 2004 with a vision to create a global sourcing solution for all aspects of the Hospitality Industry. The combination of experience and product development allows us to deliver quality products at low prices. Our products are maintained at the highest level of integrity to meet our Customer's and Brand's standards.",2024-05-28,22991,Published,326.0,"Private and personal confidential data, clients documents, budget, payroll, accounting, contracts, taxes, IDs, finance information and etc. Compressed full dump.","['PII', 'Customer and Client Data', 'Financial Data']",Play
Anchorage Daily News,www.adn.com, United States,"Based in Anchorage, Anchorage Daily News offers news, features and commentary with a statewide focus.",2024-05-28,22995,Published,16.0,"Private and personal confidential data, clients documents, budget, payroll, accounting, contracts, taxes, IDs, finance information and etc. Compressed full dump.","['PII', 'Customer and Client Data', 'Financial Data']",Play
Experis Technology Group,www.experistg.com, United States,"For the past two decades, Experis Technology Group, Inc. has been integrating the best of breed software and hardware solutions, along with our consulting services to deliver non-stop environments. We provide businesses with secure, high performing, and highly available systems to support mission-critical workloads.",2024-05-28,22934,Published,,"Private and personal confidential data, clients documents, budget, payroll, accounting, contracts, taxes, IDs, finance information and etc. For now part of the data have been published, If there no reaction full dump will be uploaded.","['PII', 'Customer and Client Data', 'Employee and HR data', 'Financial Data']",Play
The Louis G Freeman,www.freemancompany.com, United States,The Louis G Freeman Co is a company that operates in the Machinery industry.,2024-05-28,22557,Published,240.0,"Private and personal confidential data, clients documents, budget, payroll, accounting, contracts, taxes, IDs, finance information and etc. Compressed full dump.","['PII', 'Customer and Client Data', 'Financial Data']",Play
Aspire Tax,www.aspiretax.com, United States,"Aspire Tax and Bookkeeping Services is based out of New York, USA and is a trusted accounting partner to a large number of business establishmentsand CPAs in US and Canada, since 2012. With a Better Business Bureau rating of A+, we have created a benchmark in providing cost effective bookkeeping, accounting and taxation services.",2024-05-28,22443,Published,297.0,"Private and personal confidential data, clients documents, budget, payroll, accounting, contracts, taxes, IDs, finance information and etc. Compressed full dump.","['PII', 'Customer and Client Data', 'Financial Data']",Play
Starostwo Powiatowe w Świebodzinie,www.samorzad.gov.pl, Poland,Starostwo Powiatowe w Świebodzinie is a company that operates in the Government industry.,2024-05-28,22475,Published,10.0,"Private and personal confidential data, clients documents, budget, payroll, accounting, contracts, taxes, IDs, finance information and etc. Compressed full dump.","['PII', 'Customer and Client Data', 'Financial Data']",Play
Tri-state General Contractors,www.tri-stategc.com, United States,"The Best and Fastest Retail Builders in CA, AZ, NV, HI, ID, UT, WA, OK, NM, TX Incorporated in 2008, Tri State General Contractors specializes in retail and commercial construction with licenses in CA, AZ, NV, HI, ID, UT, OK, NM and TX. In 2013 Dave Mason, Sr. was named President of Tri State General Contractors and brought over 34 years of construction experience to the company.",2024-05-28,22459,Published,397.0,"Private and personal confidential data, clients documents, budget, payroll, accounting, contracts, taxes, IDs, finance information and etc. Compressed full dump.","['PII', 'Customer and Client Data', 'Financial Data']",Play
Ryder Scott Co.,www.ryderscott.com, United States,"We pride ourselves on providing personal service. Ryder Scott is committed to satisfying the individual needs of its clients. This helps build thelong-term business, professional and personal relationships that are so important in working together toward a common objective.",2024-05-28,22460,Published,333.0,"Private and personal confidential data, clients documents, payroll, accounting, contracts, taxes, IDs, finance information and etc. Compressed full dump.","['PII', 'Customer and Client Data', 'Financial Data']",Play
Badger Tag & Label,www.badgertag.com, United States,Badger Tag & Label will continually strive to provide quality products at competitive prices to our customers nationwide and beyond. We believe insmall town values and take customer service very seriously. Our customers know we are a company in the Midwest in whom they can place their trust.,2024-05-12,23956,Published,61.0,"Private and personal confidential data, clients documents, budget, payroll, accounting, contracts, taxes, IDs, finance information and etc. Compressed full dump.","['PII', 'Customer and Client Data', 'Financial Data']",Play
NK Parts Industries,www.nkparts.com, United States,"NK Parts Industries is a global supply chain and logistics management company providing a one-vendor supply chain management system that can provide domestic and international logistics, freight forwarding, exporting, warehousing, packaging, manufacturing services.",2024-05-12,23912,Published,598.0,"Private and personal confidential data, clients documents, budget, payroll, accounting, contracts, taxes, IDs, finance information and etc. Compressed full dump.","['PII', 'Customer and Client Data', 'Financial Data']",Play
LiveHelpNow,www.livehelpnow.net, United States,"LiveHelpNow offers a full suite of integrated solutions to streamline the ""business to consumer"" customer service process. LiveHelpNow provides award winning solutions for businesses looking to better sell to consumers.",2024-05-12,23875,Published,531.0,"Private and personal confidential data, clients documents, budget, payroll, accounting, contracts, taxes, IDs, finance information and etc. Compressed full dump.","['PII', 'Customer and Client Data', 'Financial Data']",Play
Sentry Data Management,www.sentrydatamgt.com, United States,"Sentry is committed to helping our customers handle a variety of information management challenges. The most important of these challenges is our main concern: Privacy. Whether you need important documents stored off-site or a major clean out of old files, you can count on Sentry to always use uncompromising security standards to get the job done efficiently and securely.",2024-05-13,24519,Published,52.0,"Private and personal confidential data, clients documents, budget, payroll, accounting, contracts, taxes, IDs, finance information and etc. Compressed full dump.","['PII', 'Customer and Client Data', 'Financial Data']",Play
KC Scout,www.kcscout.net, United States,KC Scout is a company that operates in the Public Safety industry.,2024-05-13,24517,Published,351.0,"Private and personal confidential data, clients documents, budget, payroll, accounting, contracts, taxes, IDs, finance information and etc. Compressed full dump.","['PII', 'Customer and Client Data', 'Financial Data']",Play
