CompanyName,Website,Country,Company Description,DateVictimised,NumViews (of threat),Status,RansomDataSize,Data Type,RansomDataType,RansomwareGroup
Software Engineering Associates,www.seadeo.com, United States,Software Engineering Associates.,2024-08-31,6368,Published,18.0,"Private and personal confidential data, clients documents, budget, payroll, accounting, contracts, taxes, IDs, finance information and etc. Compressed full dump.","['PII', 'Customer and Client Data', 'Financial Data']",Play
Precom,www.precom-inc.com, United States,"Based in Boise, Idaho and serving the Northwest since 1993, Precision Communications dba PRECOM is a locally woman owned and operated voice and data communications company. PRECOM has earned a reputation for building industry leading communication technologies from small businesses to large enterprises.",2024-08-30,6765,Published,28.0,"Private and personal confidential data, clients documents, budget, payroll, accounting, contracts, taxes, IDs, finance information and etc. Compressed full dump.","['PII', 'Customer and Client Data', 'Financial Data']",Play
Microchip Technology,www.microchip.com, United States,"Microchip Technology Incorporated is a leading provider of smart, connected and secure embedded control solutions. Its easy-to-use development tools and comprehensive product portfolio enable customers to create optimal designs, which reduce risk while lowering total system cost and time to market.",2024-08-29,6706,Published,,"Private and personal confidential data, clients documents, budget, payroll, accounting, contracts, taxes, IDs, finance information and etc. For now part of the data have been published, If there no reaction full dump will be uploaded.","['PII', 'Customer and Client Data', 'Employee and HR data', 'Financial Data']",Play
Policy Administration Solutions,www.pasolutions.com, United States,"Founded in 1996, Policy Administration Solutions specializes in state-of-the-art automation solutions for insurance carriers, sureties and large Managing General Agents (MGAs)",2024-08-26,7655,Published,31.0,"Private and personal confidential data, clients documents, budget, payroll, accounting, contracts, taxes, IDs, finance information and etc. Compressed full dump.","['PII', 'Customer and Client Data', 'Financial Data']",Play
RCG,www.rcg-llc.com, United States,RCG Corporate is a company that operates in the Real Estate industry.,2024-08-26,7709,Published,345.0,"Private and personal confidential data, clients documents, budget, payroll, accounting, contracts, taxes, IDs, finance information and etc. Compressed full dump.","['PII', 'Customer and Client Data', 'Financial Data']",Play
Armour Coatings,www.armourcoatings.com, United States,"Founded in 2003 and located in Germantown Wisconsin, Armour Coatings is a multi-metal job shop custom powder coater and sandblaster. Armour Coatings operates from a 45,000 sq. ft. facility that employs the latest technologies for part cleaning, powder delivery and curing of finishes.",2024-08-26,7824,Published,42.0,"Private and personal confidential data, clients documents, budget, payroll, accounting, contracts, taxes, IDs, finance information and etc. Compressed full dump.","['PII', 'Customer and Client Data', 'Financial Data']",Play
The SMS Group,www.thesmsgroup.com, United States,"Established in 1988, The SMS Group embarked on its journey with a dedicated team focused on delivering systems integration solutions to local manufacturing businesses within a fifty-mile radius of Sidney, Ohio. Over the years, our reach has expanded, and today we proudly serve businesses worldwide. Recognized as a leader in data collection integration, we tackle customer challenges through a combination of network expertise, custom software and solutions, adaptable for both mobile and traditional devices.",2024-08-26,7634,Published,,"Private and personal confidential data, clients documents, budget, payroll, accounting, contracts, taxes, IDs, finance information and etc. For now part of the data have been published, If there no reaction full dump will be uploaded.","['PII', 'Customer and Client Data', 'Employee and HR data', 'Financial Data']",Play
Erie Meats,www.eriemeats.com, Canada,"For over 45 years, Erie Meats have made delicious feel good food for Canadian Families. Our history, disciplined entrepreneurial drive, passion, and vision for the future sets us apart. Erie Meats is a privately owned & operated Canadian company with headquarters in Mississauga, Ontario and processing facilities in both Mississauga and Listowel, Ontario.",2024-08-19,9210,Published,397.0,"Private and personal confidential data, clients documents, budget, payroll, accounting, contracts, taxes, IDs, finance information and etc. Compressed full dump.","['PII', 'Customer and Client Data', 'Financial Data']",Play
CinemaTech,www.mycinematech.com, United States,"CinemaTech, Inc. continues to be recognized as the unparalleled leader in high-end, home theater seating. Along with this well-earned distinction, CinemaTech has expanded over the years to provide additional theater products to the most discriminating of customers. CinemaTech, Inc. provides a complete aesthetic solution to luxury home theaters.",2024-08-19,9223,Published,26.0,"Private and personal confidential data, clients documents, budget, payroll, accounting, contracts, taxes, IDs, finance information and etc. Compressed full dump.","['PII', 'Customer and Client Data', 'Financial Data']",Play
Adina Design,www.adinareyter.com, United States,Jewelry & Watch Retail,2024-08-19,9133,Published,17.0,"Private and personal confidential data, clients documents, budget, payroll, accounting, contracts, taxes, IDs, finance information and etc. Compressed full dump.","['PII', 'Customer and Client Data', 'Financial Data']",Play
Air International Thermal Systems,www.ai-thermal.com, United States,"Air International Thermal Systems has been keeping people cool and comfortable since 1967. We design, develop and supply high quality, high value thermal systems to automotive OEM's across four continents. We deliver heating ventilation & air conditioning (HVAC), power-train cooling (PTC), and electric & hybrid vehicle battery thermal management (BTM) systems.",2024-08-19,9169,Published,164.0,"Private and personal confidential data, clients documents, budget, payroll, accounting, contracts, taxes, IDs, finance information and etc. Compressed full dump.","['PII', 'Customer and Client Data', 'Financial Data']",Play
Parker Development Company,www.parkerdevco.com, United States,Parkers Developers is a construction company.,2024-08-19,9171,Published,42.0,"Private and personal confidential data, clients documents, budget, payroll, accounting, contracts, taxes, IDs, finance information and etc. Compressed full dump.","['PII', 'Customer and Client Data', 'Financial Data']",Play
Mill Creek Lumber,www.millcreeklumber.com, United States,Mill Creek Lumber core business is furnishing framing exterior envelope and complete millwork packages to new residential construction and light commercial.,2024-08-16,9073,Published,167.0,"Private and personal confidential data, clients documents, budget, payroll, accounting, contracts, taxes, IDs, finance information and etc. Compressed full dump.","['PII', 'Customer and Client Data', 'Financial Data']",Play
Grid Subject Matter Experts,www.gridsme.com, United States,GridSME - Grid Subject Matter Experts - Facilitating Change in Our Industry The electric industry is undergoing change at an unprecedented rate.,2024-08-18,6763,Published,,"Private and personal confidential data, clients documents, budget, payroll, accounting, contracts, taxes, IDs, finance information and etc. For now part of the data have been published, If there no reaction full dump will be uploaded.","['PII', 'Customer and Client Data', 'Employee and HR data', 'Financial Data']",Play
TelPro,www.telpro1.com, United States,"TelPro, Inc. is a technology firm that provides consulting, design, project management, system integration, installation and operations for data centers, engineering labs, industrial, warehousing, retail space, education, hospitality, campus, healthcare, and enterprise office environments. TelPro was founded in 1980 and deploys a large variety of services including architecture, electrical, mechanical, commissioning, fire protection, system monitoring, network cabling infrastructures, wireless LAN’s and VoIP telephony.",2024-08-16,9346,Published,228.0,"Private and personal confidential data, clients documents, budget, payroll, accounting, contracts, taxes, IDs, finance information and etc. Compressed full dump.","['PII', 'Customer and Client Data', 'Financial Data']",Play
Nilorngruppen AB,www.nilorn.com, Sweden,"Attractive labelling solutions, hangtags that convey visual identity, and exclusive packaging – with us, the possibilities are endless. We design and produce customised labels, hangtags, packaging and information labels according to your specific requirements.",2024-08-15,9738,Published,288.0,"Private and personal confidential data, clients documents, budget, payroll, accounting, contracts, taxes, IDs, finance information and etc. Compressed full dump.","['PII', 'Customer and Client Data', 'Financial Data']",Play
Credible Group,crediblegroup.com, Canada,Credible Group has an extensive client list from The United Nations to world-class hotels like MGM dotting the Las Vegas strip; the brand has built an international presence in its 25 years of operation. The brand has worked with some of the most notable designers to create pieces that stand out and built to last due to the team’s extensive engineering background and great awareness of how people and environmental factors interact with each of their pieces.,2024-08-15,9733,Published,205.0,"Private and personal confidential data, clients documents, budget, payroll, accounting, contracts, taxes, IDs, finance information and etc. Compressed full dump.","['PII', 'Customer and Client Data', 'Financial Data']",Play
KinetX,www.kinetx.com, United States,"KinetX is the first commercial company to provide mission design and navigation services for NASA’s deep space missions by bringing winning solutions to our partner’s competitive mission proposals. KinetX is also a world leader in the innovative design, development and operation of complex systems of spacecraft and telecommunications systems.",2024-08-11,10356,Published,31.0,"Private and personal confidential data, clients documents, budget, payroll, accounting, contracts, taxes, IDs, finance information and etc. Compressed full dump.","['PII', 'Customer and Client Data', 'Financial Data']",Play
Granit Design,www.granitdesign.com, Canada,"Granit Design is the largest North American manufacturer of natural stone, quartz and ultra-compact surface made-to-measure projects.",2024-08-11,10331,Published,69.0,"Private and personal confidential data, clients documents, budget, payroll, accounting, contracts, taxes, IDs, finance information and etc. Compressed full dump.","['PII', 'Customer and Client Data', 'Financial Data']",Play
True Blue Environmental,www.trueblueenvironmental.com, United States,"At True Blue we are committed to providing quality remediation and civil construction services throughout the Northeast by offering safe, competitive, reliable, efficient and friendly service to our clients. We specialize in environmental remediation, building demolition, hazardous materials removal, site construction, UST removal and replacement and wetlands restoration with a special emphasis on manufactured gas plant sites.",2024-08-11,10333,Published,69.0,"Private and personal confidential data, clients documents, budget, payroll, accounting, contracts, taxes, IDs, finance information and etc. Compressed full dump.","['PII', 'Customer and Client Data', 'Financial Data']",Play
Alternate Energy,www.alternateenergyhawaii.com, United States,"Founded in 1993 by the Ekimura Family, Alternate Energy, Inc. has been growing slowly and steadily for more than 30 years, becoming a front-runner in Hawaii's renewable energy revolution. AEI is driven by the knowledge that more renewable and energy efficiency installations, like solar, means less dependence on expensive oil and electricity. Solar allows Hawaii families and businesses to keep more of their hard-earned dollars.",2024-08-11,10206,Published,169.0,"Private and personal confidential data, clients documents, budget, payroll, accounting, contracts, taxes, IDs, finance information and etc. Compressed full dump.","['PII', 'Customer and Client Data', 'Financial Data']",Play
OfficeOps,www.officeops.com, United States,"OfficeOps is a nationwide provider of business software and consulting services, delivering exceptional enterprise value through effective technology implementation. OfficeOps applies its industry knowledge and best practices philosophy to provide ERP, B2B eCommerce and technology solutions throughout the United States. As a Microsoft Certified Partner,",2024-07-29,12814,Published,12.0,"Private and personal confidential data, clients documents, budget, payroll, accounting, contracts, taxes, IDs, finance information and etc. Compressed full dump.","['PII', 'Customer and Client Data', 'Financial Data']",Play
Odyssey Fitness Center,www.odysseyfitnesscenter.com, United States,Odyssey Fitness Center is a company that operates in the Fitness & Dance Facilities industry.,2024-07-29,12778,Published,15.0,"Private and personal confidential data, clients documents, budget, payroll, accounting, contracts, taxes, IDs, finance information and etc. Compressed full dump.","['PII', 'Customer and Client Data', 'Financial Data']",Play
Golden Business Machines,www.goldenbusiness.com, United States,"The Document Efficiency Specialists Golden Business Machines, Inc. (GBM), is a leading provider of copier, fax, computer, printer, scanner, document management, and networking solutions to large, medium, and small organizations throughout Northeastern and Central Pennsylvania as well as the Lehigh Valley.",2024-07-29,12744,Published,,"Private and personal confidential data, clients documents, budget, payroll, accounting, contracts, taxes, IDs, finance information and etc. For now part of the data have been published, If there no reaction full dump will be uploaded.","['PII', 'Customer and Client Data', 'Employee and HR data', 'Financial Data']",Play
Gendron & Gendron,www.gendroncorp.com, United States,"When you think of commercial construction companies in the Lewiston-Auburn area, you probably think of Gendron & Gendron. We are a well-known and well-respected commercial construction company located in Lewiston, Maine, and we serve the local communities as well as the wider area of Southern Maine, traveling as far as 50 miles for our projects. The Gendron family has been a significant real estate owner, developer, and contractor in the Lewiston-Auburn area since 1971, when it was co-founded by Del Gendron.",2024-07-29,12649,Published,107.0,"Private and personal confidential data, clients documents, budget, payroll, accounting, contracts, taxes, IDs, finance information and etc. Compressed full dump.","['PII', 'Customer and Client Data', 'Financial Data']",Play
Gateway Extrusions,www.gwextrusions.com, United States,"Gateway Extrusions offers a wide range of aluminum extrusion services, from design through production, finishing and packaging, to the residential and commercial building and industrial product markets.",2024-07-29,12559,Published,126.0,"Private and personal confidential data, clients documents, budget, payroll, accounting, contracts, taxes, IDs, finance information and etc. Compressed full dump.","['PII', 'Customer and Client Data', 'Financial Data']",Play
Williams Construction,www.williamsconst.com, United States,"Founded in 1980, Williams Construction Company has a rich history of serving clients across America. As a family-owned design-build construction firm, we pride ourselves on delivering superior customer service and satisfaction.",2024-07-29,12567,Published,113.0,"Private and personal confidential data, clients documents, budget, payroll, accounting, contracts, taxes, IDs, finance information and etc. Compressed full dump.","['PII', 'Customer and Client Data', 'Financial Data']",Play
Compact Mould,www.compactmould.com, Canada,"Compact Mould Ltd. is a Canadian-based manufacturer of high quality Extrusion Blow Molds, Stretch Blow Molds, and Injection Stretch Blow molds. We can offer a full range of services, including preform and bottle design, mold design, prototype tooling, high volume production tooling, as well as mold repairs, maintenance and modifications.",2024-07-29,12566,Published,,"Private and personal confidential data, clients documents, budget, payroll, accounting, contracts, taxes, IDs, finance information and etc. For now part of the data have been published, If there no reaction full dump will be uploaded.","['PII', 'Customer and Client Data', 'Employee and HR data', 'Financial Data']",Play
The Computer Merchant,www.itstaffing.com, United States,"The Computer Merchant, LTD.The Computer Merchant, Ltd. offers technology and enterprise staffing services.",2024-07-29,12647,Published,160.0,"Private and personal confidential data, clients documents, budget, payroll, accounting, contracts, taxes, IDs, finance information and etc. Compressed full dump.","['PII', 'Customer and Client Data', 'Financial Data']",Play
MIPS Technologies,www.mips.com, United States,"MIPS is a compute IP company with more than two decades of experience. Breaking down the barriers of closed and in-flexible architectures, MIPS designs efficient and configurable compute Cores for automotive, data center and embedded systems.",2024-07-19,14203,Published,68.0,"Private and personal confidential data, clients documents, budget, payroll, accounting, contracts, taxes, IDs, finance information and etc. Compressed full dump.","['PII', 'Customer and Client Data', 'Financial Data']",Play
Hayden Power Group,www.haydenpower.com, United States,"To be the Employer and Contractor of Choice by safely providing the best electrical services in the industry, creating successful projects with highly skilled, committed, and engaged teams, focused on excellent employee and customer satisfaction.",2024-07-19,14128,Published,68.0,"Private and personal confidential data, clients documents, budget, payroll, accounting, contracts, taxes, IDs, finance information and etc. Compressed full dump.","['PII', 'Customer and Client Data', 'Financial Data']",Play
Congoleum,www.congoleum.com, United States,"Congoleum, founded in 1886 and headquartered in Mercerville, NJ, develops and manufactures residential and commercial flooring products.",2024-07-22,13198,Published,278.0,"Private and personal confidential data, clients documents, budget, payroll, accounting, contracts, taxes, IDs, finance information and etc. Compressed full dump.","['PII', 'Customer and Client Data', 'Financial Data']",Play
T P C I,www.tpicorp.com, United States,"TPI Corporation is a U.S. based privately held manufacturer that offers heaters, fans, lights, controls, and process heat.",2024-07-13,15605,Published,839.0,"Private and personal confidential data, clients documents, budget, payroll, accounting, contracts, taxes, IDs, finance information and etc. Compressed full dump.","['PII', 'Customer and Client Data', 'Financial Data']",Play
The 21st Century Energy Group,www.21stcenturyenergygroup.com, United States,"The 21st Century Energy Group Delivers and Services Lawrence, Mercer, Crawford, Erie, Beaver, Allegheny, Westmoreland, Somerset, Butler, Armstrong.",2024-07-18,15375,Published,54.0,"Private and personal confidential data, clients documents, budget, payroll, accounting, contracts, taxes, IDs, finance information and etc. Compressed full dump.","['PII', 'Customer and Client Data', 'Financial Data']",Play
Texas Electric Cooperatives,www.texas-ec.org, United States,TEC was established in 1941 as a coalition of electric cooperatives formed to have greater bargaining leverage with power suppliers.,2024-07-18,15353,Published,280.0,"Private and personal confidential data, clients documents, budget, payroll, accounting, contracts, taxes, IDs, finance information and etc. Compressed full dump.","['PII', 'Customer and Client Data', 'Financial Data']",Play
Hyperice,www.hyperice.com, United States,Manufacturer of equipment for athletes.,2024-07-16,15201,Published,27.0,"Private and personal confidential data, clients documents, budget, payroll, accounting, contracts, taxes, IDs, finance information and etc. Compressed full dump.","['PII', 'Customer and Client Data', 'Financial Data']",Play
Fareri Associates,www.fareriassociates.com, United States,"Fareri Associates, LP is a highly-regarded, well-established, developer, owner and manager of fine commercial and residential real estate in New York.",2024-07-11,16569,Published,76.0,"Private and personal confidential data, clients documents, budget, payroll, accounting, contracts, taxes, IDs, finance information and etc. Compressed full dump.","['PII', 'Customer and Client Data', 'Financial Data']",Play
Prairie Athletic Club,www.prairieathletic.com, United States,"Prairie Athletic Club is Wisconsins largest single recreational fitness club with over 200,000 sq. feet of facilities.",2024-07-11,16561,Published,139.0,"Private and personal confidential data, clients documents, budget, payroll, accounting, contracts, taxes, IDs, finance information and etc. Compressed full dump.","['PII', 'Customer and Client Data', 'Financial Data']",Play
Innerspec Technologies,www.innerspec.com, United States,"Founded in 1989, Innerspec Technologies designs, manufactures, and commercializes non-destructive testing systems using proprietary technology.",2024-07-11,16535,Published,216.0,"Private and personal confidential data, clients documents, budget, payroll, accounting, contracts, taxes, IDs, finance information and etc. Compressed full dump.","['PII', 'Customer and Client Data', 'Financial Data']",Play
INDA's,www.inda.org, United States,"INDA, the Association of the Nonwoven Fabrics Industry, serves hundreds of member companies in the nonwovens/engineered materials industry to achieve business growth. Since 1968, INDA helps members convene and connect, innovate and develop their businesses.",2024-07-11,16578,Published,87.0,"Private and personal confidential data, clients documents, budget, payroll, accounting, contracts, taxes, IDs, finance information and etc. Compressed full dump.","['PII', 'Customer and Client Data', 'Financial Data']",Play
Texas Recycling,www.texasrecycling.com, United States,"Family-owned and operated business for 25+ years in the DFW area. Recyclers of paper, metals, corrugated, industrial plastic and electronics.",2024-07-11,16541,Published,,"Private and personal confidential data, clients documents, budget, payroll, accounting, contracts, taxes, IDs, finance information and etc. For now part of the data have been published, If there no reaction full dump will be uploaded.","['PII', 'Customer and Client Data', 'Employee and HR data', 'Financial Data']",Play
Elyria Foundry,www.elyriafoundry.com, United States,"Elyria Foundry and Hodge Foundry's top engineering experts partner with you on solutions-based design and development. We have the process documentation in place to make high quality, repeatable parts, and we have the overall capacity to meet your needs.",2024-07-14,16513,Published,70.0,"Private and personal confidential data, clients documents, budget, payroll, accounting, contracts, taxes, IDs, finance information and etc. Compressed full dump.","['PII', 'Customer and Client Data', 'Financial Data']",Play
Custom Concrete,www.customconcrete.com, United States,"Custom Concrete has been creating foundations for the finest homes, commercial buildings and industrial facilities throughout Central Indiana since 1969. Builders, contractors and homeowners depend on our expertise because so much depends on getting it right.",2024-06-26,18561,Published,417.0,"Private and personal confidential data, clients documents, budget, payroll, accounting, contracts, taxes, IDs, finance information and etc. Compressed full dump.","['PII', 'Customer and Client Data', 'Financial Data']",Play
ProMotion Holdings,www.promotionholdings.com, United States,"ProMotion Holdings Global, Inc. is a provider of communications consulting and content technology solutions for corporate, non-profit, and legal ma rkets. The company combines technology with talent to provide unique creative solutions for clients.",2024-06-26,18641,Published,56.0,"Private and personal confidential data, clients documents, budget, payroll, accounting, contracts, taxes, IDs, finance information and etc. Compressed full dump.","['PII', 'Customer and Client Data', 'Financial Data']",Play
RRCA Accounts Management,www.rrcaaccounts.com, United States,"RRCA Accounts Management, Inc., is a full-service collection agency serving businesses along the Lincoln Highway between DeKalb, Illinois, and Clin ton, Iowa. We have been successful in the collection business since 1979, offering a full range of collection services including an in-house attorney.",2024-06-26,18402,Published,40.0,"Private and personal confidential data, clients documents, budget, payroll, accounting, contracts, taxes, IDs, finance information and etc. Compressed full dump.","['PII', 'Customer and Client Data', 'Financial Data']",Play
